,MDR's Variable,Variable Source,MDR's Description,Source's Description,similarity_score,Cosine Score,Jaccard Score,Actual MDR's Variable
1405,EMP_WELD,B_TYPS_WRKS,"Selected MetalWorking Employment,  Welding of steel plate for manufacturing production",Types of workers that were used by the business,35.75%,42.06%,0.00%,WRKR_TYPE_CHKBOX
1406,NAPCS_OTH,B_SALES_PCT_OTH_WIN,Sum of Values for Prod_code NOT like 2%,Total percent entered from domestic sales questions,35.74%,42.05%,0.00%,SALES_OTH_WRTIN_TXT
1407,ADD_MAJOR_ACT_CODE,O1_OTH_BUS_WIN,"Added establishment,  Major activity code",Other status of the previous business Owner 1 started most recently,35.73%,42.04%,0.00%,PREV_BUS_OWN_TXT
1408,INV_OUTPR_END,B_SALES_TOT_US,"Inventories,  Stored or en route, OUTSIDE Puerto Rico,  End of Year","Amount of sales, revenue, and grants from domestic operations",35.73%,42.03%,0.00%,SALES_US_TOT_VAL
1409,INV_RPT_DATE,B_BUSTARGET,reporting Date for inventories,The timeframe that the business focused on for production targets,35.73%,42.03%,0.00%,PROD_TARG_TIMEFRM_CODE
1410,RCPT_C_ST_TN,B_RDFUND_US_STLOC,"Construction Work by State,  Tennessee",Domestic R&D costs paid by U.S. state or local government,35.72%,40.07%,11.11%,FUNDS_RD_US_LOCGOV_VAL
1411,RCPT_C_ST_PA,B_RDFUND_US_STLOC,"Construction Work by State,  Pennsylvania",Domestic R&D costs paid by U.S. state or local government,35.69%,40.02%,11.11%,FUNDS_RD_US_LOCGOV_VAL
1412,EMP_MAR12_LPN,B_EMPTRAIN,"Employment By Occupation, Licensed practical nurses",The areas covered by employee training,35.68%,41.98%,0.00%,EMP_TRAIN_AREA_CHKBOX
1413,RCPT_C_ST_NH,B_RDFUND_US_STLOC,"Construction Work by State,  New Hampshire",Domestic R&D costs paid by U.S. state or local government,35.68%,40.21%,10.00%,FUNDS_RD_US_LOCGOV_VAL
1414,EMP_MAR12_AUDIO,B_RDJOB_TOTEMP_DOMESTIC,"Employment By Occupation, Audiologists",Total R&D employees by staff type,35.66%,41.95%,0.00%,EMP_MAR12_RD_TOT_DNUM
1415,RCPT_C_ST_NV,B_RDFUND_US_STLOC,"Construction Work by State,  Nevada",Domestic R&D costs paid by U.S. state or local government,35.65%,39.98%,11.11%,FUNDS_RD_US_LOCGOV_VAL
1416,RCPT_PRDSHIP_GOVLOCAL,B_SALES_TOT_US,"Value of product shipped by customer in Puerto Rico,  Local government","Amount of sales, revenue, and grants from domestic operations",35.62%,41.91%,0.00%,SALES_US_TOT_VAL
1417,FOOD_MEALPRICE_30TO50_ARCHIVE,EXPNS,"Indicates the estimated average price per meal, excluding taxes and tip.",Amount of total expenses,35.59%,41.87%,0.00%,EXPS_TOT_VAL
1418,RCPT_C_ST_MA,ZSTAT,"Construction Work by State,  Massachusettes",Amount of domestic research funds that came from state and local governments,35.59%,39.91%,11.11%,EXPS_RSRCH_ST_LOC_VAL
1419,RCPT_UFO_VAL,B_CRDAMT,Unfilled Orders Value,Total amount of credit that was requested and received ,35.59%,41.88%,0.00%,CREDIT_AMT_RECEIVED_STAT
1420,TOTU3INT2,B_EMPNUM_W2_TOTAL,"Total Coop Units, Second Intv",Total number of W2 paid employees and owners,35.58%,39.66%,12.50%,EMP_W2_TOT_DNUM
1421,HOUSE_SNGL_ATTACH_LAND,B_EXPCOST_BLDG,"Houses built for customers on their land,  Number of Attached (single-family homes separated by an unbroken ground to roof wall with separate utility meters: townhomes, duplexes, row-homes)",R&D capital expenditures for buildings and land imp R&D capital expenditures for equipmentrovement,35.58%,41.09%,4.35%,CAPEX_RD_OPS_BLDG_VAL
1422,INV_VAL_FIFO,TCPEX,"Inventories by Valuation Method, First-in, First-Out (FIFO)",Total capital expenditures,35.57%,41.85%,0.00%,CAPEX_TOT_VAL
1423,RCPT_NEWS_PRNT_PCT,B_SALES_TOT_US,Source of Newspaper Revenue: Print,"Amount of sales, revenue, and grants from domestic operations",35.57%,39.65%,12.50%,SALES_US_TOT_VAL
1424,RCPT_UFO_TOT,B_EMPNUM_UNPAID,Value of Unfilled Orders,Number of individuals who did work for the business but were unpaid,35.57%,41.85%,0.00%,EMP_UNPAID_NUM
1425,RCPT_C_ST_CT,B_RDFUND_US_STLOC,"Construction Work by State,  Connecticut",Domestic R&D costs paid by U.S. state or local government,35.57%,39.89%,11.11%,FUNDS_RD_US_LOCGOV_VAL
1426,CLASS_MOS_OTH_WRTIN,B_NEWCUSTSTART_REASON,"Class of Customer,  Other method of sellling  write-in description",Why this new/customized product or service was developed,35.56%,41.84%,0.00%,NEW_CUST_PROD_START_REASON_STAT
1427,CLASS_OTH_WRTIN,B_REV ,"Class of Customer,  Other write-in description",Types of customers that accounted for 10% or more of total sales,35.56%,41.83%,0.00%,CUST_TYPE_10_PCT_SALES_CHKBOX
1428,EXPS_RPTOT_DVAL,EXPNS,deriving ASM/EC mfg collected total rental payments,Amount of total expenses,35.52%,39.82%,11.11%,EXPS_TOT_VAL
1429,NEG_INV_B_TOT_DVAL,TCPEX,Negative copy of total inventories,Total capital expenditures,35.51%,38.84%,16.67%,CAPEX_TOT_VAL
1430,PAY_ANN_LSD_OTH_P,GRNTS,Leased Annual Payroll from Other Clients,Amount of funding provided to others for research grants or contracts,35.51%,41.77%,0.00%,EXPS_PROV_RSRCH_VAL
1431,PAY_ANN_LSD_ACCOMM,EXPNS,Leased Annual Payroll for Accommodations Clients,Amount of total expenses,35.51%,41.78%,0.00%,EXPS_TOT_VAL
1432,TAX_DOM_VAL,B_SALES_PCT_US_TOT,Provision for current and deferred domestic income taxes,"Write-in of other sales, revenue, and grant sourcesTotal percent entered from domestic sales questions",35.50%,40.00%,10.00%,SALES_US_TOT_DPCT
1433,ORE_GOLD_GOLD,B_DIFF_TARGETS,"Quantity of Gold produced,  Gold",Amount of effort it took to meet production targets,35.48%,41.74%,0.00%,PROD_TARG_EFFORT_CODE
1434,RCPT_MOTR_ELECT_DVAL,B_OPEXPENSE ,Electronic & Precision motor carrier revenue,Total domestic operating expenses,35.48%,41.74%,0.00%,EXPS_TOT_VAL
1435,BENEFIT_PY,WZWAGE,"Fringe Benefits, Total  Prior Year",Amount of internal research funds allocated to payroll for internal employees,35.48%,41.74%,0.00%,EXPS_RSRCH_PAYROLL_VAL
1436,HOURS_MINEWRK,B_TYPS_WRKS,Worker hours at mine or pit,Types of workers that were used by the business,35.48%,41.75%,0.00%,WRKR_TYPE_CHKBOX
1437,EMP_MAR12_LSD_ARTS,B_CONTRACTOUT_TYPE,Q1 LEASED EMPLOYMENT FROM ARTS AND ENTERTAINMENT CLIENTS,Type of companies that manufacturing was contracted out to ,35.45%,41.71%,0.00%,MAN_CONTRACTOUT_CHKBOX
1438,RCPT_C_ST_CO,B_RDFUND_US_STLOC,"Construction Work by State,  Colorado",Domestic R&D costs paid by U.S. state or local government,35.45%,39.75%,11.11%,FUNDS_RD_US_LOCGOV_VAL
1439,PRCH_TRANS_NODRIVERS,O1_OWNER_DISABLE,"Purchased Transportation,  Lease and rental payments for trucks and other motor vehicles without drivers",Disability status of the first owner,35.44%,41.70%,0.00%,OWNER_DISABILITY_CODE
1440,RCPT_MOTR_WOOD_PCT,B_CONTRACTIN_TYPE ,"Analysis of Motor Carrier Operations: Wood products, textiles, and leather",Types of companies that this business performed manufacturing for,35.44%,41.69%,0.00%,MAN_CONTRACTIN_CHKBOX
1441,RCPT_CUST_LNGTEL_IND_DVAL,B_OPEXPENSE ,Household Fixed Long-distance revenue,Total domestic operating expenses,35.43%,41.68%,0.00%,EXPS_TOT_VAL
1442,EXPS_BENEFIT_AH_REINS,B_RDEXP_DOM_EMPL,"Benefits Paid, Health and medical reinsurance","Amount of domestic R&D costs going to salaries, wages, and benefits",35.42%,39.47%,12.50%,EXPS_RD_DOM_EMP_VAL
1443,INCOM_AFT_INCOM_TAX_VAL,TCPEX,Income (loss) before extraordinary items and cumulative effect of accounting changes,Total capital expenditures,35.41%,41.66%,0.00%,CAPEX_TOT_VAL
1444,RCPT_C_ST_OH,B_RDFUND_US_STLOC,"Construction Work by State,  Ohio",Domestic R&D costs paid by U.S. state or local government,35.37%,39.65%,11.11%,FUNDS_RD_US_LOCGOV_VAL
1445,PAY_ROLL_TIN,B_TYPS_WRKS,"Steel Mill Department Wages, Tinmills",Types of workers that were used by the business,35.35%,41.59%,0.00%,WRKR_TYPE_CHKBOX
1446,INCOM_U_LOAN_UNSEC_INT_PCT,B_CRDSRC_OTHER_WIN,"Loan Products Income,  Unsecured loans to consumers, Interest",Write-in of what lenders the business applied for new credit with ,35.34%,41.57%,0.00%,CREDIT_SRCS_OTH_WRTIN_TXT
1447,DELIV_SERV_YES_ARCHIVE,B_ACTIVITYUFC_LOG ,Did this establishment offer delivery services by its employees in $$00?,Yes/No if foreign unaffiliated companies conducted distribution and logistics for this business,35.34%,41.57%,0.00%,UNAFFIL_NONUS_LOGSTC_STAT
1448,RCPT_C_ST_NJ,B_RDFUND_US_STLOC,"Construction Work by State,  New Jersey",Domestic R&D costs paid by U.S. state or local government,35.32%,39.79%,10.00%,FUNDS_RD_US_LOCGOV_VAL
1449,PRCH_TAX_PY,COPYZSTAT,Governmental taxes and licensing fees   Prior Year,Total amount of research funds that came from state and local governments,35.31%,41.54%,0.00%,EXPS_RSRCH_ST_LOC_TOT_VAL
1450,AFFIL_SPL_ADDR_MUN,AFFILWI ,"Added child establishment,  Municipality",Details on affiliated organization ,35.29%,41.52%,0.00%,AFFIL_ORG_TXT
1451,PAY_ROLL_PIPE,B_RDEXP_DOM_EMPL,"Steel Mill Department Wages, Pipe mills","Amount of domestic R&D costs going to salaries, wages, and benefits",35.29%,39.32%,12.50%,EXPS_RD_DOM_EMP_VAL
1452,EMP_MAR12_NUM_SUM,WEMP,"Sum estabs Employment to KAU_x000D_
Sum KAU employment to Company",Number of employees as of March 12th,35.27%,41.49%,0.00%,EMP_MAR12_NUM
1453,ENT_SIZE_CODE_TXT,B_NUMKPI,"Side indicator for MU Enterprise:  'L' = ENT has 5000+ employees, 'M' = ENT has 1000-4999 employees, 'N' = ENT has 10+ estabs OR 50+ employees and is not an L or M ENT, 'S' - All other ENTs that are not identified as a L, M, or N.",Number of key performance indicators monitored by this business ,35.25%,41.47%,0.00%,KPI_MONITOR_NUM
1454,AIES_TAXEXEMPT,B_RDTAX_STATE,Indicator if taxable or tax-exempt KAU,The state in which the business filed for a tax credit for increasing research activities,35.25%,39.71%,10.00%,RSRCH_TAXCRED_ST
1455,RCPT_ECOMM_FDBRWN_VAL,B_IMPROCESS_LOG ,"Electronic Commerce (e-commerce) - Food, beer & wine","Whether the business introduced new or improved methods for logistics, delivery or distribution methods",35.22%,41.44%,0.00%,IMPROCESS_LOG_STAT 
1456,RATIO_FACTOR,B_SALES_PCT_US_TOT,"post stratification factors - _x000D_
makes KAU totals match the frame totals for Payroll_x000D_
makes GRO/Estab totals match the frame totals for Payroll","Write-in of other sales, revenue, and grant sourcesTotal percent entered from domestic sales questions",35.20%,41.41%,0.00%,SALES_US_TOT_DPCT
1457,RCPT_C_ST_TX,B_RDFUND_US_STLOC,"Construction Work by State,  Texas",Domestic R&D costs paid by U.S. state or local government,35.19%,39.44%,11.11%,FUNDS_RD_US_LOCGOV_VAL
1458,TAX_DOM_FED_NOPROV_TXT,FEDRD,Please explain briefly why there were no tax provisions for current and deferred domestic federal income taxes,Amount of domestic research funds that came from the federal government,35.17%,38.66%,15.38%,EXPS_RSRCH_FED_VAL
1459,PAY_ANN_LSD_UTIL,WZWAGE,Leased Annual Payroll from Utility Clients,Amount of internal research funds allocated to payroll for internal employees,35.15%,39.39%,11.11%,EXPS_RSRCH_PAYROLL_VAL
1460,BLDG_TYPE2,B_EXPCOST_BLDG,Second Type of Units in Building,R&D capital expenditures for buildings and land imp R&D capital expenditures for equipmentrovement,35.14%,41.34%,0.00%,CAPEX_RD_OPS_BLDG_VAL
1461,KAU_ID,AFFILWI ,Reporting unit that has the linkage between the KAU and its' corresponding MU establishments,Details on affiliated organization ,35.13%,41.33%,0.00%,AFFIL_ORG_TXT
1462,PAT_CARE_OTHER_PCT,B_EXPCOST_BLDG,"Patient Care, Other, including health facility services, such as provisions of space and equipment, meals, nursing care, etc.",R&D capital expenditures for buildings and land imp R&D capital expenditures for equipmentrovement,35.08%,41.28%,0.00%,CAPEX_RD_OPS_BLDG_VAL
1463,PAY_MINEWRK,B_RDEXP_DOM_EMPL,Wages paid to workers at mine or pit,"Amount of domestic R&D costs going to salaries, wages, and benefits",35.07%,38.74%,14.29%,EXPS_RD_DOM_EMP_VAL
1464,EXPS_FUEL_VAL,B_EXPCOST_EQUIP,Purchased Fuels (Except Motor Fuels),R&D capital expenditures for equipment,35.07%,41.25%,0.00%,CAPEX_RD_OPS_EQUIP_VAL
1465,RCPT_NEWS_PRNT_DVAL,B_SALES_TOT_US,Print newspapers revenue,"Amount of sales, revenue, and grants from domestic operations",35.05%,38.72%,14.29%,SALES_US_TOT_VAL
1466,ROBOT_INDST_PRCH_WRTIN_TXT,AIQUALC,"Robotics: Purchased, explain",What extent did this company use artificial intelligence (including machine learning algorithms in software applications) to support equipment maintenance                                                       ,35.04%,41.22%,0.00%,AI_QUAL_CTRL_CODE
1467,WATER_INTAKE,B_IMPROCESS_MAN ,"What was this establishment’s water intake, that is, the quantity of new water introduced into the establishment for the first time, regardless of source or quality",Whether the business introduced new or improved methods for producing goods or providing services,35.04%,38.87%,13.33%,IMPROCESS_MAN_STAT
1468,RCPT_C_ST_CA,B_RDFUND_US_STLOC,"Construction Work by State,  California",Domestic R&D costs paid by U.S. state or local government,35.03%,39.26%,11.11%,FUNDS_RD_US_LOCGOV_VAL
1469,PAY_ELEC,B_TYPS_WRKS,"Steel Mill Department Wages, Electric arc furnaces",Types of workers that were used by the business,35.01%,41.19%,0.00%,WRKR_TYPE_CHKBOX
1470,EXPS_BENEFIT_ACCDNT,O1_OWNER_DISABLE,"Benefits Paid, Accident insurance",Disability status of the first owner,35.00%,41.17%,0.00%,OWNER_DISABILITY_CODE
1471,RCPT_ECOMM_SPTGD_VAL,B_IMPROCESS_LOG ,Electronic Commerce (e-commerce) - Sporting goods,"Whether the business introduced new or improved methods for logistics, delivery or distribution methods",34.99%,41.16%,0.00%,IMPROCESS_LOG_STAT 
1472,EMP_MAR12_LSD_MINE,EMPC,Q1 LEASED EMPLOYMENT FOR MINING CLIENTS,Number of contract employes working on research activities,34.99%,41.17%,0.00%,EMP_RSRCH_CONTRACT_NUM
1473,INCOM_UNIT_CRED_INTER_PCT,B_CRDAMT,"Credit Card Products,  Interest",Total amount of credit that was requested and received ,34.98%,37.62%,20.00%,CREDIT_AMT_RECEIVED_STAT
1474,OPFRAN_FRAN_YES_WRTIN,B_CRDSRC_OTHER_WIN,Franchise tradmark or brand name write-in description,Write-in of what lenders the business applied for new credit with ,34.97%,38.93%,12.50%,CREDIT_SRCS_OTH_WRTIN_TXT
1475,ANYCHANGE,B_IMPROCESS_ADMIN ,Have there been any changes to the building since previous interview?,Whether the business introduced new or improved methods for administration and management activities,34.95%,41.12%,0.00%,IMPROCESS_ADMIN_STAT
1476,RECORD_NAICS,AIPRDMON,The updates needed on NAICS (North American Industry Classification System code),What extent did this company use artificial intelligence (including machine learning algorithms in software applications) to support environmental or safety compliance                                                   ,34.89%,41.04%,0.00%,AI_PROD_SCHED_CODE
1477,INV_B_AVG_VAL,TCPEX,"Inventory Valuation Methods: PY, AVG Cost",Total capital expenditures,34.88%,41.04%,0.00%,CAPEX_TOT_VAL
1478,ORE_SILVER_GOLD,B_DIFF_TARGETS,"Quantity of Silver produced,  Gold",Amount of effort it took to meet production targets,34.87%,41.02%,0.00%,PROD_TARG_EFFORT_CODE
1479,RCPT_COMSN_EARN_VAL,B_SALES_PCT_GRANT,Commissions and Fees: Commissions and Selling or Listing fees,"Percent of domestic sales, revenues, and grants coming from selling services to customers",34.80%,39.33%,9.09%,SALES_GRANT_PCT
1480,INCOM_LEAS_XAUTO_OTH_PCT,B_COOP,"Finance leasing services, except automobile and light-duty truck leasing services, Other","Suppliers of equipment, materials, components, or software outside your business group ",34.76%,40.89%,0.00%,COOP_PARTNER_LOC_CHKBOX
1481,RCPT_ECOMM_SLVR_DVAL,B_COOP,non Ecommerce sliver,"Suppliers of equipment, materials, components, or software outside your business group ",34.76%,40.89%,0.00%,COOP_PARTNER_LOC_CHKBOX
1482,ASSET_TRADE_REC_INC_GOV_VAL,B_ACTIVITYUFC_LOG ,Trade accounts and trade receivables including government,Yes/No if foreign affiliated companies conducted distribution and logistics for this business,34.75%,40.88%,0.00%,AFFIL_NONUS_LOGSTC_STAT
1483,RCPT_C_ST_MS,B_CONTRACTOUT_TYPE,"Construction Work by State,  Mississippi",Type of companies that manufacturing was contracted out to ,34.74%,40.87%,0.00%,MAN_CONTRACTOUT_CHKBOX
1484,TOTU3INT1,B_EMPNUM_W2_TOTAL,"Total Coop Units, First Intv",Total number of W2 paid employees and owners,34.71%,38.32%,14.29%,EMP_W2_TOT_DNUM
1485,SURVEY_ANALYST_SRCE,RESP_PHONE_EXT ,"Survey analyst mailing ID, alpha, or ent",Contact Information: Extension,34.70%,40.82%,0.00%,CERT_EXTENSION_NUM
1486,PAY_ANN_LSD_AGRICULTURE,B_EMPNUM_W2_TOTAL,Leased Annual Payroll for Agriculutral Clients,Total number of W2 paid employees and owners,34.68%,40.80%,0.00%,EMP_W2_TOT_DNUM
1487,TOTU4INT1,O1_PCT_OWNED ,"Total Condo Units, First Intv",Percent owned by first owner,34.68%,40.81%,0.00%,OWNER1_PCT
1488,RCPT_C_ST_UT,B_RDFUND_US_STLOC,"Construction Work by State,  Utah",Domestic R&D costs paid by U.S. state or local government,34.68%,38.84%,11.11%,FUNDS_RD_US_LOCGOV_VAL
1489,EXPS_BENEFIT_SUREPC_INS,O1_OWNER_DISABLE,"Benefits Paid, Surety and related insurance",Disability status of the first owner,34.67%,40.79%,0.00%,OWNER_DISABILITY_CODE
1490,EMP_MAR12_CHIRO,B_EMPTRAIN_PCT,"Employment By Occupation, Chiropractic physicians - licensed practitioners having D.C. degree",Percent of employees that received formal training,34.66%,40.78%,0.00%,EMP_TRAIN_PCT
1491,PROP_MAR12_PSYCH,RESP_BUS_DESC,"Proprietor or Partner by Occupation, Licensed doctoral-level psychologists, including clinical psychologists, counseling psychologists, health psychologists, and neuropsychologists",Primary business activity,34.66%,40.78%,0.00%,NAICS_DESC_TXT
1492,AFFIL_SPL_STORENUM,O1_OTH_BUS_WIN,"Added child establishment,   Store number",Other status of the previous business Owner 1 started most recently,34.64%,40.76%,0.00%,PREV_BUS_OWN_TXT
1493,REF_PER,B_WORKHOME_PCT_FIVE ,Survey reference period,Percent of workers that worked from home five or more days per weTotal percent entered from work from home questionsek,34.61%,40.72%,0.00%,WORK_HOME_FIVE_PCT
1494,PAY_ROLL_SHEET,B_TYPS_WRKS,"Steel Mill Department Wages, Sheet and strip mills",Types of workers that were used by the business,34.60%,40.70%,0.00%,WRKR_TYPE_CHKBOX
1495,BLDG_TYPE,B_EXPCOST_BLDG,Type of Units in Building,R&D capital expenditures for buildings and land imp R&D capital expenditures for equipmentrovement,34.59%,40.70%,0.00%,CAPEX_RD_OPS_BLDG_VAL
1496,AFFIL_SPL_ADDR_CITY,RESP_CONTACT_NAME ,"Added child establishment,  City, town, village etc.",Contact Information: Name,34.57%,40.67%,0.00%,CERT_NAME_TXT
1497,INCOM_LOAN_VEH_INT_PCT,B_CRDSRC_OTHER_WIN,"Loan Products Income, Consumer vehicle loans, Interest",Write-in of what lenders the business applied for new credit with ,34.54%,40.63%,0.00%,CREDIT_SRCS_OTH_WRTIN_TXT
1498,EXPS_BENEFIT_PRDPC_INS,B_RDEXP_DOM_EMPL,"Benefits Paid, Product liability insurance","Amount of domestic R&D costs going to salaries, wages, and benefits",34.53%,38.41%,12.50%,EXPS_RD_DOM_EMP_VAL
1499,MSC_REFUSE,B_IMPROCESS_LOG ,What were the miscellaneous receipts for Sales of scrap and refuse?,"Whether the business introduced new or improved methods for logistics, delivery or distribution methods",34.51%,40.60%,0.00%,IMPROCESS_LOG_STAT 
1500,PAY_ANN_LSD_REAL_ESTATE,WZTEMP,Leased Annual Payroll from Real Estate Clients,Amount of internal research funds allocated to contract employees ,34.51%,40.60%,0.00%,EXPS_RSRCH_CONTRACT_VAL
1501,INCOM_LEAS_AUTO_OTH_PCT,B_CONTRACTIN_TYPE ,"Automobile and light-duty truck leasing services - includes operating and finance leases,  Other",Types of companies that this business performed manufacturing for,34.48%,40.57%,0.00%,MAN_CONTRACTIN_CHKBOX
1502,CLNC_CHSE_MEAS_INS,B_NUMKPI,Measures of Clinical Performance - Who chooses which measures of clinical performance to collect - Insurance providers?,Number of key performance indicators monitored by this business ,34.47%,38.59%,11.11%,KPI_MONITOR_NUM
1503,RCPT_ECOMM_COMP_VAL,B_IMPROCESS_INFO,Electronic Commerce (e-commerce) - Computer,Whether the business introduced new or improved methods for information and communication systems,34.47%,40.55%,0.00%,IMPROCESS_INFO_STAT
1504,BED1U3,CPSTR,Total 1 bedrooms for Type 3,Total capital expenditures for research operations that went towards buildings and land improvement,34.45%,38.57%,11.11%,CAPEX_RSRCH_BUILD_VAL
1505,TOURIST_LAW_NO_ARCHIVE,B_OWNED_GOVT_TRIBAL,Establishment operates under the Puerto Rico Tourist Incentive Act,Yes/No if business is owned by a government or tribal entity,34.44%,40.52%,0.00%,OWNED_GOV_TRIBAL_STAT
1506,TRAILER_NUM_TOT_DVAL,TCPEX,"Inventories:_x000D_
Total Trailers",Total capital expenditures,34.41%,37.54%,16.67%,CAPEX_TOT_VAL
1507,ORE_GOLD_COPPER,B_DIFF_TARGETS,"Quantity of Gold produced,  Copper",Amount of effort it took to meet production targets,34.39%,40.46%,0.00%,PROD_TARG_EFFORT_CODE
1508,AFFIL_SPL_NAME,AFFILWI ,"Added child establishment,   Name",Details on affiliated organization ,34.38%,40.44%,0.00%,AFFIL_ORG_TXT
1509,DIRECT_PREM_WRKPC_INS,B_RDEXP_DOM_EMPL,"Direct Premiums Earned,  Workers' compensation insuranc","Amount of domestic R&D costs going to salaries, wages, and benefits",34.35%,40.41%,0.00%,EXPS_RD_DOM_EMP_VAL
1510,REMAINING,FTESU,Number of remaining units less any subsidized and transient units.,Number of full-time equivalents working on research activities who were other support personnel ,34.34%,38.79%,9.09%,EMP_FTE_SUPPORT_NUM
1511,ORE_GOLD_LEADZINC,B_DIFF_TARGETS,"Quantity of Gold produced,  Lead/Zinc",Amount of effort it took to meet production targets,34.34%,40.40%,0.00%,PROD_TARG_EFFORT_CODE
1512,PATNT_CARE_INSURE,B_INNOV_SERV,"Patient Care Services Offered,  Information on health insurance options",Whether the business introduced new or improved services,34.29%,38.73%,9.09%,NEW_IMPROVE_SERVICES_STAT
1513,PROP_MAR12_DENTIST,O1_EDUC ,"Proprietor or Partner by Occupation, Dentists - having D.M.D., D.D.S., or D.D.Sc. degree and other dental practitioners (Include hygienists, assistants, and others performing or assisting with dental procedures.)",Highest degree achieved by the first owner prior to owning this business,34.29%,39.41%,5.26%,EDU_PREV_OWN_CODE
1514,PROCESS_DIV_CODE_TXT,B_ACTIVITYUC_ENG ,Economic division of an entity based on industry classification and various other characteristics from survey results or administrative records,Yes/No if domestic unaffiliated companies conducted engineering for this business,34.28%,40.33%,0.00%,UNAFFIL_US_ENGINEER_STAT
1515,INV_E_LIFO_RSV_VAL,B_EXPCOST_BLDG,"Inventories: LIFO reserve, EOY",R&D capital expenditures for buildings and land imp R&D capital expenditures for equipmentrovement,34.27%,40.32%,0.00%,CAPEX_RD_OPS_BLDG_VAL
1516,RCPT_C_ST_KS,B_RDTAX_STATE,"Construction Work by State,  Kansas",The state in which the business filed for a tax credit for increasing research activities,34.26%,38.35%,11.11%,RSRCH_TAXCRED_ST
1517,RCPT_MOTR_HAZRD_DVAL,B_OPEXPENSE ,Hazardous Materials motor carrier revenue,Total domestic operating expenses,34.23%,40.27%,0.00%,EXPS_TOT_VAL
1518,EMP_PAINT,B_TYPS_WRKS,"Selected MetalWorking Employment,  Painting, lacquering, and enameling on metals",Types of workers that were used by the business,34.23%,40.27%,0.00%,WRKR_TYPE_CHKBOX
1519,WATER_USE,CPSTR,"What was this establishment’s gross water use, that is, the quantity of water that would have been required if no water had been recirculated or reused?",Total capital expenditures for research operations that went towards buildings and land improvement,34.22%,40.26%,0.00%,CAPEX_RSRCH_BUILD_VAL
1520,RCPT_C_ST_AL,B_RDFUND_US_STLOC,"Construction Work by State,  Alabama",Domestic R&D costs paid by U.S. state or local government,34.22%,38.30%,11.11%,FUNDS_RD_US_LOCGOV_VAL
1521,INV_B_WIP_VAL,B_CEASED_MONTH,"Inventories: Work-in-process,_x000D_
Prior Year",Month the business ceased operation,34.22%,40.26%,0.00%,OPSTAT_CEASED_MONTH_DATE
1522,INV_VAL_OTH,WZDEPR,"Inventories by Valuation Method, Other non-LIFO valutation methods",Amount of internal research funds allocated to depreciation and amortization of assets,34.21%,40.25%,0.00%,EXPS_RSRCH_DEPR_VAL
1523,BED1U4,CPSTR,Total 1 bedrooms for Type 4,Total capital expenditures for research operations that went towards buildings and land improvement,34.21%,38.29%,11.11%,CAPEX_RSRCH_BUILD_VAL
1524,SPACE_STORAGE,B_IMPROCESS_LOG ,"The warehouse, stockroom, or other inventory storage space","Whether the business introduced new or improved methods for logistics, delivery or distribution methods",34.20%,40.23%,0.00%,IMPROCESS_LOG_STAT 
1525,BENEFIT_HEALTH,B_RDEXP_DOM_EMPL,Employer's cost for health insurance,"Amount of domestic R&D costs going to salaries, wages, and benefits",34.20%,40.24%,0.00%,EXPS_RD_DOM_EMP_VAL
1526,AFFIL_SPL_TYPOP_SELFDSG_WRT,AFFILWI ,"Added child establishment,   Type of operation write-in description",Details on affiliated organization ,34.18%,40.21%,0.00%,AFFIL_ORG_TXT
1527,BPONAME,B_COOP,BPO/Segment Name - Name of the building permit office or NP segment,Companies that are the clients or customers outside the business group,34.17%,40.20%,0.00%,COOP_PARTNER_LOC_CHKBOX
1528,BALANCE_SHEET_DATE,EXTERNALCPA,Balance sheet date,"Did this company retain an external Certified Public Accountant to conduct an audit, review, or compilation of its financial statements",34.17%,40.20%,0.00%,CPA_EXTRN_RETAIN_CODE
1529,BED2U3,CPSTR,Total 2 bedrooms for Type 3,Total capital expenditures for research operations that went towards buildings and land improvement,34.16%,38.23%,11.11%,CAPEX_RSRCH_BUILD_VAL
1530,BLDG_TYPE3,B_EXPCOST_BLDG,Third Type of Units in Building,R&D capital expenditures for buildings and land imp R&D capital expenditures for equipmentrovement,34.15%,40.18%,0.00%,CAPEX_RD_OPS_BLDG_VAL
1531,RCPT_C_ST_HI,B_RDFUND_US_STLOC,"Construction Work by State,  Hawaii",Domestic R&D costs paid by U.S. state or local government,34.13%,38.19%,11.11%,FUNDS_RD_US_LOCGOV_VAL
1532,EMP_MAR12_DENT,TOTSE,"Employment By Occupation, Dentists - licensed practitioners having D.M.D., D.D.S., or D.D.Sc. Degree",Number of full-time equivalents working on research activities who were researchers,34.09%,40.11%,0.00%,EMP_FTE_RSRCH_NUM
