,MDR's Variable,Variable Source,MDR's Description,Source's Description,similarity_score,Cosine Score,Jaccard Score,Actual MDR's Variable
767,PAY_ANN_PRDWRK,WZWAGE,Annual Payroll for Production Workers,Amount of internal research funds allocated to payroll for internal employees,43.47%,48.93%,12.50%,EXPS_RSRCH_PAYROLL_VAL
768,RCPT_CONTRACT_GOVLOCAL,B_CONTRACTOUT,"Contract Work done by customer in Puerto Rico, Local government",Yes/No if business contracted out manufacturing tasks,43.45%,51.12%,0.00%,MAN_CONTRACTOUT_STAT
769,NPATREV_INVPROP,B_SALES_PCT_US_TOT,"Non-Patient Care Revenue,  Investment and property income - Include interest and dividends. Exclude gains (losses) from assets sold.","Write-in of other sales, revenue, and grant sourcesTotal percent entered from domestic sales questions",43.44%,50.12%,5.56%,SALES_US_TOT_DPCT
770,RCPT_S_MERCH_GT50_NO_ARCHIVE,B_SALES_PCT_GOODS,Did the sale of merchandise account for more than half of the total receipts of this establishment?,"Percent of domestic sales, revenues, and grants coming from selling goods to customers",43.43%,51.09%,0.00%,SALES_GOODS_PCT
771,NUMUNITSU3,B_OWNERNUM,Total Number of Coop units,Number of owners of the business,43.42%,47.55%,20.00%,OWNER_NUM_STAT
772,PRCH_COMPSVC,B_ACTIVITYUC_INFO ,"Purchased Communication services (Include telephone, cellular phones, Internet, fax, and related service contracts)",Yes/No if domestic unaffiliated companies conducted information and communication tech services for this business,43.42%,49.00%,11.76%,UNAFFIL_US_INFOTEC_STAT
773,RCPT_CONTRACT_HOUSE,B_CONTRACTOUT,"Contract Work done by customer in Puerto Rico,  Household consumers",Yes/No if business contracted out manufacturing tasks,43.41%,51.07%,0.00%,MAN_CONTRACTOUT_STAT
774,EMP_MAR12_REPAIR,B_TYPS_WRKS,"Employment By Occupation, Repair and maintenance (for vehicles and equipment)",Types of workers that were used by the business,43.35%,51.00%,0.00%,WRKR_TYPE_CHKBOX
775,CLASS_GOV_COMWLTH,B_COOP,"Class of Customer,  Commonwealth government","Clients or customers from the public sector: public sector includes government owned organizations such as local, regional and national administrations and agencies, schools, hospitals, and government providers of services such as security, transport, housing, energy, etc. ",43.35%,50.19%,4.55%,COOP_PARTNER_LOC_CHKBOX
776,RCPT_CONTRACT_FED,B_CONTRACTOUT,"Contract Work done by customer in Puerto Rico,  Federal government",Yes/No if business contracted out manufacturing tasks,43.33%,50.98%,0.00%,MAN_CONTRACTOUT_STAT
777,RCPT_CONTRACT_GOV,B_CONTRACTOUT,"Contract Work done by customer in Puerto Rico,  Commonwealth or Territorial government",Yes/No if business contracted out manufacturing tasks,43.33%,50.97%,0.00%,MAN_CONTRACTOUT_STAT
778,AFFIL_OWNER_GT50_STAT,B_ANYONE_10_PCT,Ownership or Control: Voting Stock Status,Yes/No if one person owns 10% or more of the company,43.33%,50.98%,0.00%,OWNED_10_PCT_STAT
779,RCPT_CLIENT_U_RES,B_REV ,"Class of Customer,  Residential (Include apartment buildings.)",Types of customers that accounted for 10% or more of total sales,43.32%,50.96%,0.00%,CUST_TYPE_10_PCT_SALES_CHKBOX
780,INCOM_UNIT_BROK_OTHER_PCT,RESP_BUS_DESC,"Brokering and Dealing Products, Other",Primary business activity,43.32%,50.96%,0.00%,NAICS_DESC_TXT
781,AFFIL_SPL_ESTAB,B_OWNERNUM,Number of affiliated locations (child establishments) with the same EIN,Number of owners of the business,43.30%,48.42%,14.29%,OWNER_NUM_STAT
782,EXPS_ADMIN_OTHPC_INS,B_EXPCOST_BLDG,"Adminstrative Expenses, Other property and liability (casualty) insurance",R&D capital expenditures for buildings and land imp R&D capital expenditures for equipmentrovement,43.27%,50.91%,0.00%,CAPEX_RD_OPS_BLDG_VAL
783,EIN_STAT_YES_ARCHIVE,B_EMPNUM_W2_NON_OWNER ,Is the Employer Identification Number correct?,Number of employees who received a W2 from this business,43.26%,48.38%,14.29%,EMP_W2_NONOWNER_NUM
784,PHYSLOC_ON,B_RDTAX_STATE,The state the domestic unit of the establishment is operating from.,The state in which the business filed for a tax credit for increasing research activities,43.26%,49.13%,10.00%,RSRCH_TAXCRED_ST
785,RCPT_CLIENT_S_HOSP,B_COOP,"Class of Customer, Hospitals and other health care services","Clients or customers from the public sector: public sector includes government owned organizations such as local, regional and national administrations and agencies, schools, hospitals, and government providers of services such as security, transport, housing, energy, etc. ",43.26%,49.36%,8.70%,COOP_PARTNER_LOC_CHKBOX
786,INCOM_OPER_VAL,B_WORLDEXP_TOTAL ,Income (loss) from operations,Total worldwide operating expenses,43.26%,50.89%,0.00%,EXPS_WORLD_TOT_VAL
787,RECORD_NAME1_TXT,RESP_CONTACT_NAME ,Physical Address: Name 1,Contact Information: Name,43.25%,50.88%,0.00%,CERT_NAME_TXT
788,RCPT_MOTOR_LOCAL,B_SALES_TOT_US,"Trucking Revenue,  LOCAL (motor carrier service within a single metropolitan area and its adjacent nonurban areas, which may cross state lines)","Amount of sales, revenue, and grants from domestic operations",43.23%,49.93%,5.26%,SALES_US_TOT_VAL
789,FGINFO_ADDR2,"
RESP_TITLE   ",Second address line of F/G contact person,Contact Information: Title,43.22%,48.32%,14.29%,CERT_TITLE_TXT
790,JOINT_COMPANY_ADDR_STREET_3,B_COOP,"Investors,  Street Address of Company Investor 3",Companieswithin the business group ,43.21%,50.84%,0.00%,COOP_PARTNER_LOC_CHKBOX
791,EXPS_TRANSP_VAL,B_IMPROCESS_LOG ,Purchased Freight Transportation,"Whether the business introduced new or improved methods for logistics, delivery or distribution methods",43.21%,50.84%,0.00%,IMPROCESS_LOG_STAT 
792,DATE_BUILT,B_CONTRACTIN_TYPE ,"Steel Mill Operations, Date this establishment was built",Types of companies that this business performed manufacturing for,43.20%,50.83%,0.00%,MAN_CONTRACTIN_CHKBOX
793,RCPT_PRDSHIP_FOOD,B_SALES_PCT_GOODS,"Value of product shipped by customer in Puerto Rico,  Hotels, restaurants, food services, and drinking places","Percent of domestic sales, revenues, and grants coming from selling goods to customers",43.18%,50.80%,0.00%,SALES_GOODS_PCT
794,PRCH_AUX_REPAIR_MACH_V,B_COOP,"Auxiliary establishment, purchased repairs and maintenance to machinery, vehicles, and equipment","Suppliers of equipment, materials, components, or software outside your business group ",43.16%,49.51%,7.14%,COOP_PARTNER_LOC_CHKBOX
795,COST_ENT_UTIL_OTH,B_EXPCOST_BLDG,"Enterprise payments for other establishments,  Water, sewer, refuse removal, and other utility payments",R&D capital expenditures for buildings and land imp R&D capital expenditures for equipmentrovement,43.16%,50.78%,0.00%,CAPEX_RD_OPS_BLDG_VAL
796,PROP_MAR12_RN_NP,B_OPR ,"Proprietor or Partner by Occupation, Registered nurses and nurse practitioners",Business operated equally by both spouses or unmarried partners,43.15%,50.76%,0.00%,EQUAL_OP_CODE
797,PRCH_AUX_REPAIR_MACH,B_COOP,"Auxiliary establishment, purchased repairs and maintenance to machinery and equipment","Suppliers of equipment, materials, components, or software outside your business group ",43.15%,49.41%,7.69%,COOP_PARTNER_LOC_CHKBOX
798,SOC_ASSIST_TOT_PCT,NPSY,"Social Assitance Services, Total",Amount of internal research funds allocated to social sciences,43.14%,48.23%,14.29%,EXPS_RSRCH_SOC_SCIENCE_VAL
799,CAPEX_CL_VAL,B_EXPCOST_BLDG,capital leases,R&D capital expenditures for buildings and land imp R&D capital expenditures for equipmentrovement,43.11%,47.19%,20.00%,CAPEX_RD_OPS_BLDG_VAL
800,CAPEX_CL_VAL,B_EXPCOST_BLDG,Capital Leases,R&D capital expenditures for buildings and land imp R&D capital expenditures for equipmentrovement,43.11%,47.19%,20.00%,CAPEX_RD_OPS_BLDG_VAL
801,RCPT_PAT_NET_DVAL,B_SALES_PCT_GRANT,Patient Care Revenue,"Percent of domestic sales, revenues, and grants coming from selling services to customers",43.10%,50.70%,0.00%,SALES_GRANT_PCT
802,INV_VAL_TOT_END,TCPEX,"Inventories by Valuation Method, Total LIFO and Non-LIFO valuation methods, End of Year",Total capital expenditures,43.03%,49.02%,9.09%,CAPEX_TOT_VAL
803,LSD_50_YES_ARCHIVE,B_COLLABNP_ENGAGED ,Did your company lease 50 percent or more of its permanent full-and part-time workforce from a Professional Employer Organization?,Yes/No if business exchanged personnel with a nonprofit,43.00%,50.59%,0.00%,COLLABNP_ENGAGED_STAT
804,PRCH_AUX_REPAIR_TRANS,B_EXPCOST_EQUIP,"Auxiliary establishment, purchased repairs and maintenance to transportation equipment",R&D capital expenditures for equipment,43.00%,48.63%,11.11%,CAPEX_RD_OPS_EQUIP_VAL
805,PATREV_HLTHCARE,B_SALES_PCT_SERVICE,Patient Care Revenue:  Medicare - Fee for service and managed care plans,"Percent of domestic sales, revenues, and grants coming from selling services to customers",42.96%,50.54%,0.00%,SALES_SERVICE_PCT
806,TELEMEDICINE_SER,B_SALES_PCT_GRANT,Receive Revenues from telemedicine services,"Percent of domestic sales, revenues, and grants coming from selling services to customers",42.95%,47.00%,20.00%,SALES_GRANT_PCT
807,EXPS_TAX_VAL,B_RDFUND_US_STLOC,Governmental Taxes and License Fees,Domestic R&D costs paid by U.S. state or local government,42.95%,50.52%,0.00%,FUNDS_RD_US_LOCGOV_VAL
808,INCOM_LOAN_OTHHOM_TOT_PCT,B_SALES_PCT_GOODS,"Loan Products Income, Other secured or guaranteed home loans to consumers - includes home eqty loans, Total","Percent of domestic sales, revenues, and grants coming from selling goods to customers",42.94%,50.52%,0.00%,SALES_GOODS_PCT
809,RCPT_ECOMM_HOTEL_OWN3RD_VAL,B_ACTIVITYUC_ADMIN ,Hotel Management Owned by Others: Revenue from electronic sources,Yes/No if domestic unaffiliated companies conducted administrative or management functions for this business,42.93%,48.90%,9.09%,UNAFFIL_US_ADMIN_STAT
810,ADD_SELFDSG_WRTIN,O1_OTH_BUS_WIN,"Added establishment,  principal business or activity write-in description",Other status of the previous business Owner 1 started most recently,42.92%,49.03%,8.33%,PREV_BUS_OWN_TXT
811,COST_LABOR_PRD,B_CONTRACTOUT,Contract labor for production,Yes/No if business contracted out manufacturing tasks,42.92%,50.49%,0.00%,MAN_CONTRACTOUT_STAT
812,INCOM_EXPS_RECURR_DBCRD_TXT,B_EXPCOST_OTH ,Other recurring nonoperating income (expenses) - principal debits and credits that contribute - Description,All other R&D capital expenditures,42.90%,50.47%,0.00%,CAPEX_RD_OPS_OTH_VAL
813,PRCH_COMMSVC_PY,B_CEASED_MONTH,Purchased communication services   Prior Year,Month the business ceased operation,42.89%,50.45%,0.00%,OPSTAT_CEASED_MONTH_DATE
814,RCPT_FOOD_CNTRC_OFFICE,B_COOP,"Contract Feeding,  Commercial offices and office buildings","Clients or customers from the public sector: public sector includes government owned organizations such as local, regional and national administrations and agencies, schools, hospitals, and government providers of services such as security, transport, housing, energy, etc. ",42.87%,50.44%,0.00%,COOP_PARTNER_LOC_CHKBOX
815,EXPS_ADMIN_AH_REINS,B_EXPCOST_BLDG,"Adminstrative Expenses, Health and medical reinsurance",R&D capital expenditures for buildings and land imp R&D capital expenditures for equipmentrovement,42.86%,50.43%,0.00%,CAPEX_RD_OPS_BLDG_VAL
816,PRCH_OTHEXPS_PY,B_CEASED_MONTH,"All other purchased services, Prior year",Month the business ceased operation,42.82%,50.38%,0.00%,OPSTAT_CEASED_MONTH_DATE
817,EMP_MAR12_PY,FYEND_MONTH,"First  Quarter Employment,  Prior Year",Month that fiscal year ends ,42.80%,47.41%,16.67%,FY_END_DATE
818,RCPT_GROWN_GT50,B_IMPROCESS_MAN ,Were more than half of the total sales and receipts of this establishment derived from items grown by this establishment?,Whether the business introduced new or improved methods for producing goods or providing services,42.79%,50.34%,0.00%,IMPROCESS_MAN_STAT
819,PATREV_GOV_MDCAID,B_SALES_PCT_GRANT,Patient Care Revenue:  Medicaid - Fee for service and managed care plans,"Percent of domestic sales, revenues, and grants coming from selling services to customers",42.79%,50.34%,0.00%,SALES_GRANT_PCT
820,BUS_TECH_TOUCH_DEV,B_NEWCUSTSTART_REASON,Developed in-house,Why this new/customized product or service was developed,42.78%,47.39%,16.67%,NEW_CUST_PROD_START_REASON_STAT
821,EMP_MAR12_LSD_TOT_S,B_EMPNUM_W2_TOTAL,TOTAL Q1 LEASED EMPLOYMENT FOR ALL CLIENTS,Total number of W2 paid employees and owners,42.74%,48.08%,12.50%,EMP_W2_TOT_DNUM
822,RCPT_MOTR_WOOD_DVAL,B_CONTRACTIN_TYPE ,"Wood Products, Textiles, Leather motor carrier revenue",Types of companies that this business performed manufacturing for,42.74%,50.28%,0.00%,MAN_CONTRACTIN_CHKBOX
823,INV_MAT_END,B_EXPCOST_EQUIP,"Inventories, Materials, supplies, fuels, etc., End of Year",R&D capital expenditures for equipment,42.73%,50.27%,0.00%,CAPEX_RD_OPS_EQUIP_VAL
824,MRCH_NONMERCH_EC_DVAL,B_SALES_PCT_GOODS,non-merchandise ecommerce derived estimate,"Percent of domestic sales, revenues, and grants coming from selling goods to customers",42.73%,50.27%,0.00%,SALES_GOODS_PCT
825,RECORD_NAME2,O2_NAME_TITLE,The secondary name,Name of second owner,42.71%,50.24%,0.00%,OWNER2_NAME
826,ROBOT_PURCHASE_WRTIN,AIQUALC,Number of industrial robots PURCHASED for this plant write-in description,What extent did this company use artificial intelligence (including machine learning algorithms in software applications) to support equipment maintenance                                                       ,42.69%,50.22%,0.00%,AI_QUAL_CTRL_CODE
827,ROBOT_PURCHASE,AIQUALC,Number of industrial robots PURCHASED for this plant,What extent did this company use artificial intelligence (including machine learning algorithms in software applications) to support equipment maintenance                                                       ,42.66%,50.19%,0.00%,AI_QUAL_CTRL_CODE
828,INV_RPT_DATE,RESP_REMARKS,Inventories: Date reported,Remarks about reported data,42.65%,46.65%,20.00%,REMARKS_WRTIN_TXT
829,OPSTAT_EIN_NUM,O1_OTH_BUS_WIN,Operational Status: Sold or Leased EIN,Other status of the previous business Owner 1 started most recently,42.64%,48.41%,10.00%,PREV_BUS_OWN_TXT
830,EXPS_ADMIN_MEDPC_INS,EXPNS,"Adminstrative Expenses, Medical malpractice insurance",Amount of total expenses,42.62%,47.20%,16.67%,EXPS_TOT_VAL
831,EMP_MAR12_LGL,O1_REASON_FINDJOB,"Employment By Occupation, Legal",Reason for owning business: Unable to find employment,42.61%,47.19%,16.67%,OWNING_REASON_FINDJOB_CODE
832,INCOM_U_OTHER_FEES_PCT,B_CRDSRC,"Other credit financing, Fees",Other sources of credit not listed,42.61%,46.60%,20.00%,CREDIT_SOURCES_CHKBOX
833,PAY_QTR1_NONPRDWRK_VAL,WZWAGE,First Quarter Payroll - Nonproduction Workers,Amount of internal research funds allocated to payroll for internal employees,42.61%,47.92%,12.50%,EXPS_RSRCH_PAYROLL_VAL
834,ELEC_SOLD_KWH_PY,B_OPEXPENSE ,Quantity of electricity sold or transferred to other domestic reporting units  Prior Year,Total domestic operating expenses,42.60%,48.65%,8.33%,EXPS_TOT_VAL
835,RCPT_OTH_GOVPROG_VAL,COPYZSTAT,Net patient revenues from government payers: All other government programs,Total amount of research funds that came from state and local governments,42.59%,50.10%,0.00%,EXPS_RSRCH_ST_LOC_TOT_VAL
836,RENT_PAY_AUX_MACH,B_COOP,"Auxiliary establishments,  Lease and rental payments for machinery, equipment, and other tangible items","Suppliers of equipment, materials, components, or software outside your business group ",42.58%,48.92%,6.67%,COOP_PARTNER_LOC_CHKBOX
837,ARU_TOT_ESTAB,B_NUMKPI,Alternate Reporting Unit:   Total establishment count,Number of key performance indicators monitored by this business ,42.54%,50.04%,0.00%,KPI_MONITOR_NUM
838,INCOM_EXPS_NOP_DBCRD1_VAL,EXPNS,Nonoperating income and expenses - principal debits and credits that contribute - Amount - 1,Amount of total expenses,42.54%,47.84%,12.50%,EXPS_TOT_VAL
839,RCPT_CONTRACT_CLASS_TOT,B_EMPNUM_UNPAID,"Contract Work done by customer in Puerto Rico,  Total",Number of individuals who did work for the business but were unpaid,42.52%,48.26%,10.00%,EMP_UNPAID_NUM
840,TAX_EXEMPT_NO_ARCHIVE,B_COLLABNP_LICENSED ,Was all or part of the income of this establishment or organization exempt from Federal income taxes under section 501 of the Internal Revenue Code?,Yes/No if business licensed or purchased IP from a nonprofit,42.51%,50.02%,0.00%,COLLABNP_LICENSED_STAT
841,RCPT_FOOD_CNTRC_TRANS,B_IMPROCESS_LOG ,"Contract Feeding,  Airlines, ships, railroads, business, and other in-transit facilities","Whether the business introduced new or improved methods for logistics, delivery or distribution methods",42.51%,48.65%,7.69%,IMPROCESS_LOG_STAT 
842,PREV_OWNER_ADDR_ZIP,O1_OTH_BUS_WIN,ZIP Code of Former Owner or operator,Other status of the previous business Owner 1 started most recently,42.50%,48.04%,11.11%,PREV_BUS_OWN_TXT
843,PRCH_AUX_OTHEXPS_WRTIN,EXPNS,"Auxiliary establishment,  all other selected expenses write-in description",Amount of total expenses,42.50%,47.47%,14.29%,EXPS_TOT_VAL
844,MAIL_ADDR_STREET_TXT,"
RESP_TITLE   ",Company Mailing Address: Street,Contact Information: Title,42.48%,49.97%,0.00%,CERT_TITLE_TXT
845,PROP_MAR12_OSTEO,AFFILWI ,"Proprietor or Partner by Occupation, Osteopathic physicians - licensed practitioners having D.O. degree",Details on affiliated organization ,42.48%,49.97%,0.00%,AFFIL_ORG_TXT
846,INV_WRKPROC_END,B_DIFF_TARGETS,"Inventories, Work-in-process, End of Year",Amount of effort it took to meet production targets,42.47%,49.97%,0.00%,PROD_TARG_EFFORT_CODE
847,INV_LIFO_COST,B_SALES_PCT_US_TOT,"Inventories, Amount subject to Last-In, First-Out (LIFO) gross (gross LIFO amount) before adjustment","Write-in of other sales, revenue, and grant sourcesTotal percent entered from domestic sales questions",42.46%,49.96%,0.00%,SALES_US_TOT_DPCT
848,AFFIL_FOR_ADDR_CNTRY,B_ACTIVITYUFC_ADMIN ,"Country of the foreign entity (company, individual, government, etc.)",Yes/No if foreign affiliated companies conducted administrative or management functions for this business,42.45%,48.48%,8.33%,AFFIL_NONUS_ADMIN_STAT
849,RECORD_NAME2_TXT,RESP_CONTACT_NAME ,Physical Address: Name 2,Contact Information: Name,42.44%,49.93%,0.00%,CERT_NAME_TXT
850,RCPT_CONTRACT_FOOD,B_CONTRACTOUT,"Contract Work done by customer in Puerto Rico, Hotels, restaurants, food services, and drinking places",Yes/No if business contracted out manufacturing tasks,42.43%,49.91%,0.00%,MAN_CONTRACTOUT_STAT
851,AFFIL_OWNER_ADDR_STREET,O1_NAME_TITLE,Street Address of the owning or controlling company,Name of first owner,42.42%,49.90%,0.00%,OWNER1_NAME
852,INV_WRKPROC_BGN,B_BUSTARGET,"Inventories, Work-in-process, Beginning of Year",The timeframe that the business focused on for production targets,42.41%,49.89%,0.00%,PROD_TARG_TIMEFRM_CODE
853,EMP_MAR12_PRCHSTAFF,EMPC,"Employment By Occupation, Procurement/purchasing staff",Number of contract employes working on research activities,42.41%,49.90%,0.00%,EMP_RSRCH_CONTRACT_NUM
854,RCPT_MOTR_VAL,B_WORLDEXP_TOTAL ,Total Motor Carrier Revenue,Total worldwide operating expenses,42.40%,47.36%,14.29%,EXPS_WORLD_TOT_VAL
855,EXPS_PRCH_RESALE_VAL,B_SALES_PCT_GOODS,Purchases of Products for Resale,"Percent of domestic sales, revenues, and grants coming from selling goods to customers",42.39%,49.87%,0.00%,SALES_GOODS_PCT
856,RCPT_ADV_OTH_DVAL,B_SALES_PCT_SERVICE,all other advertising revenue,"Percent of domestic sales, revenues, and grants coming from selling services to customers",42.37%,49.85%,0.00%,SALES_SERVICE_PCT
857,SUBSID_NONCONSOL_NUM,EXTERNALCPA,Number of corporations not consolidated in this report,"Did this company retain an external Certified Public Accountant to conduct an audit, review, or compilation of its financial statements",42.37%,49.84%,0.00%,CPA_EXTRN_RETAIN_CODE
858,RCPT_SOFTWARE_VAL,B_SALES_PCT_US_TOT,"Sales, Shipments Receipts, or Revenue - Software","Write-in of other sales, revenue, and grant sourcesTotal percent entered from domestic sales questions",42.36%,45.42%,25.00%,SALES_US_TOT_DPCT
859,PAY_QTR1_PRDWRK_VAL,WEMP,First Quarter Payroll - Production Workers,Number of employees as of March 12th,42.36%,49.84%,0.00%,EMP_MAR12_NUM
860,NUM_UNITS,B_OWNERNUM,Number of Units in building,Number of owners of the business,42.36%,45.42%,25.00%,OWNER_NUM_STAT
861,RCPT_CONTRACT_CENTRAL,B_CONTRACTOUT_TYPE,"Contract Work done by customer location,  Central America, South America, and Caribbean Zone",Type of companies that manufacturing was contracted out to ,42.34%,49.81%,0.00%,MAN_CONTRACTOUT_CHKBOX
862,RENT_PAY_BUILD,B_EXPCOST_BLDG,Payments for Rental or lease of buildings and other structures,R&D capital expenditures for buildings and land imp R&D capital expenditures for equipmentrovement,42.32%,47.58%,12.50%,CAPEX_RD_OPS_BLDG_VAL
863,AFFIL_OWNER_EIN_NUM,B_OWNERNUM,Ownership or Controlling Company: EIN,Number of owners of the business,42.32%,49.79%,0.00%,OWNER_NUM_STAT
864,INCOM_LOAN_XMORVEH_TOT_PCT,B_SALES_PCT_GOODS,"Loan Products Income, Secured or guaranteed loans to consumers, except mortgage and vehicle loans, Total","Percent of domestic sales, revenues, and grants coming from selling goods to customers",42.31%,49.77%,0.00%,SALES_GOODS_PCT
865,ROBOT_ACTIVE,AIQUALC,Number of industrial robots IN OPERATION at this plant,What extent did this company use artificial intelligence (including machine learning algorithms in software applications) to support equipment maintenance                                                       ,42.30%,49.77%,0.00%,AI_QUAL_CTRL_CODE
866,INV_LIFO_COST_END,B_SALES_PCT_US_TOT,"Inventories, Amount subject to Last-In, First-Out (LIFO) gross (gross LIFO amount) before adjustment,  End of Year","Write-in of other sales, revenue, and grant sourcesTotal percent entered from domestic sales questions",42.29%,49.76%,0.00%,SALES_US_TOT_DPCT
867,HOURS_FORGE,B_TYPS_WRKS,"Steel Mill Department Worker Hours,  Forging (presses, hammers, or upsetter), excluding manufacture of nuts, bolts, etc.",Types of workers that were used by the business,42.28%,49.74%,0.00%,WRKR_TYPE_CHKBOX
868,EMP_MAR12_OTH,B_TYPS_WRKS,"Employment By Occupation, Other",Types of workers that were used by the business,42.27%,49.72%,0.00%,WRKR_TYPE_CHKBOX
869,RCPT_PRDSHIP_C,B_ACTIVITYUFC_LOG ,"Value of product shipped by customer in Puerto Rico,  Construction companies",Yes/No if foreign unaffiliated companies conducted distribution and logistics for this business,42.27%,48.26%,8.33%,UNAFFIL_NONUS_LOGSTC_STAT
870,EMP_MAR12_OTHMAN,B_TYPS_WRKS,"Employment By Occupation, Other management staff",Types of workers that were used by the business,42.25%,49.71%,0.00%,WRKR_TYPE_CHKBOX
871,CLASS_REPAIR,B_COOP,"Class of Customer,  Repair shops for use in repair work","Suppliers of equipment, materials, components, or software outside your business group ",42.24%,49.69%,0.00%,COOP_PARTNER_LOC_CHKBOX
872,EXPS_ADMIN_ACCDNT,EXPNS,"Adminstrative Expenses, Accident insurance",Amount of total expenses,42.24%,46.17%,20.00%,EXPS_TOT_VAL
873,OPSTAT_ADDR_ZIP_NUM,O1_OTH_BUS_WIN,Operational Status: Sold or Leased ZIP,Other status of the previous business Owner 1 started most recently,42.23%,47.92%,10.00%,PREV_BUS_OWN_TXT
874,LEASED_AUX_TEMP,EXPNS,"Auxiliary establishment, Temporary staff and leased employee expense ",Amount of total expenses,42.23%,49.69%,0.00%,EXPS_TOT_VAL
875,RCPT_BRDBND_BUN_PCT,B_SALES_PCT_GRANT,Percentage of receipts for broadband internet access from “bundled” services,"Percent of domestic sales, revenues, and grants coming from selling services to customers",42.20%,48.39%,7.14%,SALES_GRANT_PCT
876,RCPT_PRDSHIP_HOUSE,B_SALES_PCT_GOODS,"Value of product shipped by customer in Puerto Rico,  Household consumers","Percent of domestic sales, revenues, and grants coming from selling goods to customers",42.20%,49.65%,0.00%,SALES_GOODS_PCT
877,INCOM_LOAN_VEH_TOT_PCT,B_CRDSRC_OTHER_WIN,"Loan Products Income, Consumer vehicle loans, Total",Write-in of what lenders the business applied for new credit with ,42.20%,49.64%,0.00%,CREDIT_SRCS_OTH_WRTIN_TXT
878,PRCH_DATAPROC,B_ACTIVITYUFC_INFO,Data processing and other purchased computer services,Yes/No if foreign affiliated companies conducted information and communication tech services for this business,42.19%,48.16%,8.33%,AFFIL_NONUS_INFOTEC_STAT
879,EXPS_DATAPROC_VAL,B_ACTIVITYUFC_INFO,Data Processing and Other Purchased Computer Services,Yes/No if foreign affiliated companies conducted information and communication tech services for this business,42.19%,48.16%,8.33%,AFFIL_NONUS_INFOTEC_STAT
880,TAXSTAT,B_RDSTTX,Tax exempt status,Yes/No if business filed for the state tax credit for increasing research activities,42.19%,47.67%,11.11%,RSRCH_ST_TAXCRED_STAT
881,RCPT_MEDICAID_VAL,B_SALES_PCT_SERVICE,Net patient revenues from government payers: Medicaid,"Percent of domestic sales, revenues, and grants coming from selling services to customers",42.16%,48.24%,7.69%,SALES_SERVICE_PCT
882,PRCH_REPAIR_PY,B_CEASED_MONTH,Purchased repairs and maintenance to buildings and/or machinery and equipment  Prior Year,Month the business ceased operation,42.14%,49.57%,0.00%,OPSTAT_CEASED_MONTH_DATE
883,INCOM_DIV_VAL,ZOTH,Dividend income - Domestic and foreign,Total amount of domestic and foreign internal research funds that came from other sources,42.13%,45.64%,22.22%,EXPS_RSRCH_OTH_TOT_VAL
884,RCPT_OWN_VAL,B_SALES_PCT_GOODS,Commissions and Fee: Product sales,"Percent of domestic sales, revenues, and grants coming from selling goods to customers",42.12%,47.95%,9.09%,SALES_GOODS_PCT
885,RCPT_ECOMM_THRD_STAT,B_ACTIVITYUFC_INFO,Revenue from Electronic Sources: Third-party,Yes/No if foreign unaffiliated companies conducted information and communication tech services for this business,42.11%,49.54%,0.00%,UNAFFIL_NONUS_INFOTEC_STAT
886,PAY_ANN_LSD_EDU,WZWAGE,Leased Annual Payroll from Educational Clients,Amount of internal research funds allocated to payroll for internal employees,42.10%,47.57%,11.11%,EXPS_RSRCH_PAYROLL_VAL
887,HOURS_ROLL_WIRE,B_TYPS_WRKS,"Steel Mill Department Worker Hours,  Wiredrawing mills",Types of workers that were used by the business,42.10%,49.53%,0.00%,WRKR_TYPE_CHKBOX
