,VariableNameA,VariableNameB,descriptionA,descriptionB,similarity_score
762,REPORTING_ID,00022,"Reporting Unit ID.  8nnnnnnnnn= Enterprise level or record type 10, 2nnnnnnnnn= Establishment or record type 20, 3nnnnnnnnn= KAU or record type 30",EI of corp Employer Identification Number Employer Identification Number Federal Employer Identification Number (EI)       00022,39.7%
763,TOTU2INT1,00216,"Total Furn Units, First Intv",Plant and Equipment                  216 Plant and Equipment Plant and Equipment Plant and equipment                               00216,39.7%
764,CAPEX_MACH_NEW_VAL,00103,Capital Expenditures: New machinery,Other Operating Cost and Expenses    103 nan Other Operating Cost and Expenses All other operating costs and expenses            00103,39.7%
765,CLASS_BUS_END,00001,"Class of Customer,  Businesses for end use in their own operation, not for resale or production",Is this your Company's Industry -YES/NO Is this your company's industry - yes/no Is this your company's industry - yes/no Does the industry description describe your       00001,39.7%
766,EXPS_ADMIN_ACCDNT_REINS,00110,"Adminstrative Expenses, Accident reinsurance",NONOPERATING INCOME and EXPENSES     110 Nonoperating expenses and income Nonoperating Income and Expenses Nonoperating Income and Expenses                  00110,39.7%
767,EMP_DEC12_PRDWRK_PY,PPAY,"Fourth Quarter Employment,  Production Workers  Prior Year",Prior quarter payroll from br nan nan nan,39.7%
768,COST_CONTRACT_NONPRD,00110,Contract work and nonproduction labor done for you by others,NONOPERATING INCOME and EXPENSES     110 Nonoperating expenses and income Nonoperating Income and Expenses Nonoperating Income and Expenses                  00110,39.7%
769,RCPT_CLIENT_S_ARCH,00001,"Class of Customer, Architectural firms",Is this your Company's Industry -YES/NO Is this your company's industry - yes/no Is this your company's industry - yes/no Does the industry description describe your       00001,39.7%
770,RCPT_REPAIR_LABOR,IRS01,"Repair Receipts, Labor changes",IRS Reported Receipts nan nan nan,39.7%
771,NAPCS_BLTOT,00223,(sum of the BL by ID),Total Assets                         223 Total Assets Total Assets TOTAL ASSETS                                      00223,39.6%
772,INV_B_FIFO_VAL,00101,"Inventory Valuation Methods: PY, FIFO","Sales Receipts and Operating Revenue-101 nan Sales , Receipts, and Operating Revenues Sales, Receipts and Operating Revenues            00101",39.6%
773,PAY_ANN_NONPRDWRK_VAL,00110,Annual Payroll - Nonproduction Workers,NONOPERATING INCOME and EXPENSES     110 Nonoperating expenses and income Nonoperating Income and Expenses Nonoperating Income and Expenses                  00110,39.6%
774,RCPT_BOOK_PRNT_DVAL,00101,print books revenue,"Sales Receipts and Operating Revenue-101 nan Sales , Receipts, and Operating Revenues Sales, Receipts and Operating Revenues            00101",39.6%
775,OWNSTAT_NAT_ARCHIVE,00041,What is the citizenship of the majority ownership of this establishment?,Owned by another company-NO/YES Owned by another company - No/Yes Owned by another Company-No/Yes Owned by more than 50%                            00041,39.6%
776,CAPEX_NEW_BUILD,00326,"Capital Expenditures, New Buildings",Capital Stock and Other Capital      326 Capital Stock and Other Capital Capital Stock and Other Capital Capital stock and other capital                   00326,39.6%
777,BLDG_TYPE1,00216,First Type of Units in Building,Plant and Equipment                  216 Plant and Equipment Plant and Equipment Plant and equipment                               00216,39.5%
778,PREV_OWN_CNTRY_TXT,00041,New Establishment: Former Ownership Country,Owned by another company-NO/YES Owned by another company - No/Yes Owned by another Company-No/Yes Owned by more than 50%                            00041,39.5%
779,ELEC_SOLD_KWH,00101,Quantity of electricity sold or transferred to other domestic reporting units,"Sales Receipts and Operating Revenue-101 nan Sales , Receipts, and Operating Revenues Sales, Receipts and Operating Revenues            00101",39.5%
780,INV_VAL_TOT_BGN,00218,"Inventories by Valuation Method, Total LIFO and Non-LIFO valuation methods, Beginning of Year","Accumulated Depreciation             218 Accumulated Depreciation Accumulated Depreciation Accum depr, depletion, and amortization           00218",39.5%
781,RCPT_NEWS_PRNT_PCT,00206,Source of Newspaper Revenue: Print,Commercial and Finance company Paper 206 Commercial and Finance Company paper of US issuers Commercial and Finance Company Paper of U.S. issuers Comm/finance co paper of US issuers               00206,39.5%
782,TOTU2INT3,00216,"Total Furn Units, Third Intv",Plant and Equipment                  216 Plant and Equipment Plant and Equipment Plant and equipment                               00216,39.5%
783,EQP_MAT_COMHRD,00219,"Auxiliary establishment, expensed computer hardware and other equipment","Net Property Plant and Equipment     219 NET PPE Net PPE Net property, plant, and equipment                00219",39.5%
784,COMPANYNAME,00001,Builder Company Name,Is this your Company's Industry -YES/NO Is this your company's industry - yes/no Is this your company's industry - yes/no Does the industry description describe your       00001,39.5%
785,COST3U4B1INT0,00103,"Initial Interview, Condo, 1 Bedrms, Cost #3",Other Operating Cost and Expenses    103 nan Other Operating Cost and Expenses All other operating costs and expenses            00103,39.5%
786,SERVICES_EXPORTED_Y_ARCHIVE,00061,"Did this establishment provide services to foreign businesses in $$00 (that is, exported services)?",Number of Subsidiary corps Number of Subsidiary Corporations Number of Subsidiary Corporations How many domestic and foreign corporations are    00061,39.4%
787,BLDG_TYPE,00216,Type of Units in Building,Plant and Equipment                  216 Plant and Equipment Plant and Equipment Plant and equipment                               00216,39.4%
788,RCPT_MULTCHL_UNBUN_PCT,00101,Percentage of receipts for multichannel programming distribution services from unbundled or stand alone services.,"Sales Receipts and Operating Revenue-101 nan Sales , Receipts, and Operating Revenues Sales, Receipts and Operating Revenues            00101",39.4%
789,NAICS_CODE,CB117,PRODUCT NAICS code(previously NAICS_NUM)  6 or 7 digit ( zero filled to 8 ) Most recent BR NAICS update   2017 Naics Basis.,cb117 nan nan nan,39.4%
790,INV_VAL_NLIFO_TOT_BGN,00218,"Inventories by Valuation Method, Total Non-LIFO methods,  Beginning of Year","Accumulated Depreciation             218 Accumulated Depreciation Accumulated Depreciation Accum depr, depletion, and amortization           00218",39.4%
791,MSC_CONTRACT_TOT,00101,What were the total receipts for contract work performed for others on their materials?,"Sales Receipts and Operating Revenue-101 nan Sales , Receipts, and Operating Revenues Sales, Receipts and Operating Revenues            00101",39.4%
792,RCPT_CLIENT_F_OTH,00001,"Class of Customer,  Businesses and all other",Is this your Company's Industry -YES/NO Is this your company's industry - yes/no Is this your company's industry - yes/no Does the industry description describe your       00001,39.4%
793,CAPEX_BUILD_PY,00326,"Capital Expenditures, New and Used Buildings  Prior Year",Capital Stock and Other Capital      326 Capital Stock and Other Capital Capital Stock and Other Capital Capital stock and other capital                   00326,39.3%
794,EXPS_CON_PCT_OWN_EMP,00103,"Expenditures incurred,  Percent of the total expenditures that represents work done by your own employees as opposed to work done by contractors or other hired labor",Other Operating Cost and Expenses    103 nan Other Operating Cost and Expenses All other operating costs and expenses            00103,39.3%
795,MAIL_ADDR_NAME1_TXT,00001,Company Mailing Address: Name 1,Is this your Company's Industry -YES/NO Is this your company's industry - yes/no Is this your company's industry - yes/no Does the industry description describe your       00001,39.3%
796,RCPT_PATCARE_OTH_VAL,00101,Net patient revenues from all other sources of revenue for patient care,"Sales Receipts and Operating Revenue-101 nan Sales , Receipts, and Operating Revenues Sales, Receipts and Operating Revenues            00101",39.3%
797,PRCH_ENT_REPAIR_TRANS,00219,"Enterprise payments for other establishments,  purchased repairs and maintenance to transportation equipment","Net Property Plant and Equipment     219 NET PPE Net PPE Net property, plant, and equipment                00219",39.3%
798,RCPT_CUST_RES_DVAL,00101,Residential Customers Revenue,"Sales Receipts and Operating Revenue-101 nan Sales , Receipts, and Operating Revenues Sales, Receipts and Operating Revenues            00101",39.3%
799,EMP_MAR12_LSD_MANUF,P3PAY,Q1 LEASED EMPLOYMENT FOR MANUFACTURING CLIENTS,PRIOR PRIOR PRIOR qt payroll from BR nan nan nan,39.3%
800,INV_VAL_OTH_END,00218,"Inventories by Valuation Method, Other non-LIFO valutation methods, End of Year","Accumulated Depreciation             218 Accumulated Depreciation Accumulated Depreciation Accum depr, depletion, and amortization           00218",39.2%
801,INV_B_NL_TOT_DVAL,00101,Inventory Valuation Methods: PY non-LIFO Total,"Sales Receipts and Operating Revenue-101 nan Sales , Receipts, and Operating Revenues Sales, Receipts and Operating Revenues            00101",39.2%
802,COST3U4B3INT0,00103,"Initial Interview, Condo, 3 Bedrms, Cost #3",Other Operating Cost and Expenses    103 nan Other Operating Cost and Expenses All other operating costs and expenses            00103,39.2%
803,INV_B_STD_VAL,00103,"Inventory Valuation Methods: PY, Standard Cost",Other Operating Cost and Expenses    103 nan Other Operating Cost and Expenses All other operating costs and expenses            00103,39.2%
804,RCPT_LEISURE_DVAL,00101,leisure  revenue,"Sales Receipts and Operating Revenue-101 nan Sales , Receipts, and Operating Revenues Sales, Receipts and Operating Revenues            00101",39.2%
805,TOTU3INT4,00084,"Total Coop Units, Fourth Intv",EI for Addition 4 EI for addition 4 EI for Addition 4 nan,39.2%
806,ADD_MAJOR_ACT_CODE,00219,"Added establishment,  Major activity code","Net Property Plant and Equipment     219 NET PPE Net PPE Net property, plant, and equipment                00219",39.1%
807,IA_PAPER_TYPOP_SELFDSG_49,00206,IA TYPOP Code - Electronic market,Commercial and Finance company Paper 206 Commercial and Finance Company paper of US issuers Commercial and Finance Company Paper of U.S. issuers Comm/finance co paper of US issuers               00206,39.1%
808,PRCH_TAX,00113,Governmental taxes and licensing fees,Provision for income taxes (STATE)   113 Provision for Income Taxes (STATE) Provision for domestic income taxes (STATE) Provision for Income Taxes -- State               00113,39.1%
809,INV_OUTPR_END,00203,"Inventories,  Stored or en route, OUTSIDE Puerto Rico,  End of Year",Time Deposits Outside the U.S.       203 Time Deposit Outside the U.S. Time deposits outside the US Deposits outisde the U.S.                         00203,39.1%
810,EXPS_CON_PCT_ADD,00110,"Expenditures incurred, Additions, alterations, or reconstruction",NONOPERATING INCOME and EXPENSES     110 Nonoperating expenses and income Nonoperating Income and Expenses Nonoperating Income and Expenses                  00110,39.1%
811,PROD_QTYPRD_OTHCLY_NONE,00217,"None for the question: If MINE_HERE = 1, report the quantity of all other nonmetallic minerals (including natural abrasives, shell and native asphalt and bitumens) mined and/or beneficiated at this mine or pit",Land and Mineral rights              217 Land and Mineral Rights Land and Mineral Rights Land and mineral rights                           00217,39.1%
812,RCPT_MOTR_HAZRD_PCT,00101,Analysis of Motor Carrier Operations: Hazmat revenue,"Sales Receipts and Operating Revenue-101 nan Sales , Receipts, and Operating Revenues Sales, Receipts and Operating Revenues            00101",39.1%
813,ARU_TOT_ESTAB,00072,Alternate Reporting Unit:   Total establishment count,Number of Subs - not consolidated Number of Subsidiary Corporations - Not Consolidated Number of Subsidiary Corporations - Not consolidated Number of Subsidiaries Not Fully Consolidated     00072,39.1%
814,COST3U4B2INT0,00103,"Initial Interview, Condo, 2 Bedrms, Cost #3",Other Operating Cost and Expenses    103 nan Other Operating Cost and Expenses All other operating costs and expenses            00103,39.1%
815,INITIATED_SURVEY,00402,Date respondent initiated survey,statement of income ending date      402 nan staement of income ending date Statement of Income-- TO date (YYYYMMDD)          00402,39.1%
816,RCPT_CLIENT_U_GOVOWN,00206,"Class of Customer,  Government-owned utilties",Commercial and Finance company Paper 206 Commercial and Finance Company paper of US issuers Commercial and Finance Company Paper of U.S. issuers Comm/finance co paper of US issuers               00206,39.0%
817,RCPT_APSOFT_PUB_VAL,00101,Total Application Software Publishing Revenue,"Sales Receipts and Operating Revenue-101 nan Sales , Receipts, and Operating Revenues Sales, Receipts and Operating Revenues            00101",39.0%
818,COST3U4B0INT0,00103,"Initial Interview, Condo, 0 Bedrms, Cost #3",Other Operating Cost and Expenses    103 nan Other Operating Cost and Expenses All other operating costs and expenses            00103,39.0%
819,EMP_MAR12_PRDWRK,PPAY,"First  Quarter Employment,  Production Workers",Prior quarter payroll from br nan nan nan,39.0%
820,RCPT_SYSOFT_ENTR_PCT,00101,Source of System Software Publishing Revenue: Enterprise or network,"Sales Receipts and Operating Revenue-101 nan Sales , Receipts, and Operating Revenues Sales, Receipts and Operating Revenues            00101",39.0%
821,RCPT_MOTR_WOOD_DVAL,00101,"Wood Products, Textiles, Leather motor carrier revenue","Sales Receipts and Operating Revenue-101 nan Sales , Receipts, and Operating Revenues Sales, Receipts and Operating Revenues            00101",39.0%
822,RCPT_PRDSHIP_C,00206,"Value of product shipped by customer in Puerto Rico,  Construction companies",Commercial and Finance company Paper 206 Commercial and Finance Company paper of US issuers Commercial and Finance Company Paper of U.S. issuers Comm/finance co paper of US issuers               00206,39.0%
823,RENT_PAY_TOT_PY,00110,"Payments for Rental or lease of buildings, other structures, machinery, and equipment Total Prior Year",NONOPERATING INCOME and EXPENSES     110 Nonoperating expenses and income Nonoperating Income and Expenses Nonoperating Income and Expenses                  00110,39.0%
824,INV_CY_AVGCOST_VAL,00218,"Inventory Valuation Methods: CY, AVG Cost","Accumulated Depreciation             218 Accumulated Depreciation Accumulated Depreciation Accum depr, depletion, and amortization           00218",39.0%
825,CERT_DATE_COMPLETED,00021,"Certification, Calendar date survey was completed",Closing date Closing date Closing date Annual closing date (MMDD)                        00021,39.0%
826,RCPT_APSOFT_MAIN_PCT,00101,Source of Application Software Publishing Revenue: Mainframe,"Sales Receipts and Operating Revenue-101 nan Sales , Receipts, and Operating Revenues Sales, Receipts and Operating Revenues            00101",39.0%
827,INV_E_OTHNONLIFO_VAL,00101,"Inventory Valuation Methods: CY, Other Non-LIFO","Sales Receipts and Operating Revenue-101 nan Sales , Receipts, and Operating Revenues Sales, Receipts and Operating Revenues            00101",39.0%
828,BLDG_TYPE4,00216,Fourth Type of Units in Building,Plant and Equipment                  216 Plant and Equipment Plant and Equipment Plant and equipment                               00216,39.0%
829,EMP_DEC12,0123D,"Fourth Quarter Employment,  Construction Workers and Other Construction Employees Total",Retained Earnings at End of Quarter  123 Retained Earning at End of Quarter Retained Earning at End of quarter Retained Earnings -- End of Quarter (REE),39.0%
830,RENT_PAY_ENT_BUILD,00219,"Enterprise payments for other establishments,  Lease and rental payments for land, buildings, structures, store spaces, and offices","Net Property Plant and Equipment     219 NET PPE Net PPE Net property, plant, and equipment                00219",39.0%
831,ACTV_MIO_NUM,TXMN,Months in Operation,taxmonth nan nan nan,38.9%
832,AFFIL_OWNER_ADDR_STREET,00041,Street Address of the owning or controlling company,Owned by another company-NO/YES Owned by another company - No/Yes Owned by another Company-No/Yes Owned by more than 50%                            00041,38.9%
833,TOTU2INT4,00216,"Total Furn Units, Fourth Intv",Plant and Equipment                  216 Plant and Equipment Plant and Equipment Plant and equipment                               00216,38.9%
834,RCPT_C_OWN_PRVT,00041,"Ownership of Construction projects,  Private businesses and individuals",Owned by another company-NO/YES Owned by another company - No/Yes Owned by another Company-No/Yes Owned by more than 50%                            00041,38.9%
835,PRCH_TRANS_COST_MOTOR,00219,"Purchased Transportation,  Motor carrier","Net Property Plant and Equipment     219 NET PPE Net PPE Net property, plant, and equipment                00219",38.9%
836,RCPT_OVERTOP_UNBUN_PCT,00101,Percentage of receipts for over-the-top (OTT) services from unbundled or stand alone services.,"Sales Receipts and Operating Revenue-101 nan Sales , Receipts, and Operating Revenues Sales, Receipts and Operating Revenues            00101",38.9%
837,AFFIL_FOR_ADDR_STREET,00061,"Street Address of the foreign entity (company, individual, government, etc.)",Number of Subsidiary corps Number of Subsidiary Corporations Number of Subsidiary Corporations How many domestic and foreign corporations are    00061,38.8%
838,COST_AUX_TRANS_FUEL,00216,"Auxiliary establishments,  Purchased fuels for transportation equipment",Plant and Equipment                  216 Plant and Equipment Plant and Equipment Plant and equipment                               00216,38.8%
839,MRCH_NONMERCH_SALES_DVAL,00101,non-merchandise sales derived estimate,"Sales Receipts and Operating Revenue-101 nan Sales , Receipts, and Operating Revenues Sales, Receipts and Operating Revenues            00101",38.8%
840,NUMUNITS,00219,"Number of total units for indicated type of unit (Unfurnished, Furnished, Co-op, or Condo)","Net Property Plant and Equipment     219 NET PPE Net PPE Net property, plant, and equipment                00219",38.8%
841,OWNSTAT_RACE_SAMOA,00041,Race of majority ownership - Is the race of the majority ownership of this establishment Samoan?,Owned by another company-NO/YES Owned by another company - No/Yes Owned by another Company-No/Yes Owned by more than 50%                            00041,38.8%
842,SURVDATE,00035,Date of last interview,Merged Date Merged Date Merged Date Corporation Status of MERGED Date (YYYYMMDD)      00035,38.7%
843,INV_VAL_FIFO_BGN,0223D,"Inventories by Valuation Method, First-in, First-Out (FIFO), Beginning of Year",Derived prior quarter assets nan nan nan,38.7%
844,CAPEX_MACH_AUTO,00326,"Capital Expenditures, Automobiles",Capital Stock and Other Capital      326 Capital Stock and Other Capital Capital Stock and Other Capital Capital stock and other capital                   00326,38.7%
845,OPSTAT_ADDR_STREET,00031,"Operational Status,  New owner/operator,  Street Address",Corp status active/discontinued/merged Corporation Status Active/Discontinued/Merged Corporation Status Active/Discontinued/Merged Corporation Status                                00031,38.7%
846,RCPT_C_OWN_FEDGOV,00044,"Ownership of Construction projects,  Federal Government",EI of company who owns EI of company who owns EI of company who owns Federal EI of Company that owns more than 50%     00044,38.7%
847,DOLI,00035,Date of Last Interview,Merged Date Merged Date Merged Date Corporation Status of MERGED Date (YYYYMMDD)      00035,38.7%
848,OWNSTAT_OTH,00041,"Race of majority ownership - Is the race of the majority ownership of this establishment some other race, for example Hmong, Laotian, Pakistani, Cambodian, etc.?",Owned by another company-NO/YES Owned by another company - No/Yes Owned by another Company-No/Yes Owned by more than 50%                            00041,38.7%
849,RCPT_SVCSTA_VALUE,00206,"Value of transfers to other company-owned gasoline stations, fuel oil dealers, and liquefied petroleum (LP) gas dealers",Commercial and Finance company Paper 206 Commercial and Finance Company paper of US issuers Commercial and Finance Company Paper of U.S. issuers Comm/finance co paper of US issuers               00206,38.7%
850,EMP_MAR12_PRDWRK_NUM,00001,Employment: Q1 production workers,Is this your Company's Industry -YES/NO Is this your company's industry - yes/no Is this your company's industry - yes/no Does the industry description describe your       00001,38.7%
851,RCPT_TOT_HOTEL_OWN_VAL,00101,Hotels owned or leased: Revenue,"Sales Receipts and Operating Revenue-101 nan Sales , Receipts, and Operating Revenues Sales, Receipts and Operating Revenues            00101",38.7%
852,OWNSTAT_RACE_PHILI,00041,Race of majority ownership - Is the race of the majority ownership of this establishment Filipino?,Owned by another company-NO/YES Owned by another company - No/Yes Owned by another Company-No/Yes Owned by more than 50%                            00041,38.7%
853,EXPS_BENEFIT_OTHPC_INS,00110,"Benefits Paid, Other property and liability (casualty) insurance",NONOPERATING INCOME and EXPENSES     110 Nonoperating expenses and income Nonoperating Income and Expenses Nonoperating Income and Expenses                  00110,38.7%
854,RCPT_MOTR_METAL_DVAL,NDNET,Base Metal and Machinery motor carrier revenue,Weather Corporation Net Profit Change 1 - Increased a lot How did this corporation's net profit change compared to what was normal before nan,38.6%
855,INV_VAL_AVG,00214,"Inventories by Valuation Method, Average Cost",Inventories                          214 Inventories Inventories Inventories                                       00214,38.6%
856,PRCH_COMPSVC,00219,"Purchased Communication services (Include telephone, cellular phones, Internet, fax, and related service contracts)","Net Property Plant and Equipment     219 NET PPE Net PPE Net property, plant, and equipment                00219",38.6%
857,INV_B_IVAL_TOT_DVAL,00101,"Inventory Valuation Methods: PY, LIFO and non-LIFO","Sales Receipts and Operating Revenue-101 nan Sales , Receipts, and Operating Revenues Sales, Receipts and Operating Revenues            00101",38.6%
858,PAY_QTR1_PRDWRK_VAL,PPAY,Payroll: production workers,Prior quarter payroll from br nan nan nan,38.6%
859,EXPS_BENEFIT_PRDPC_INS,00328,"Benefits Paid, Product liability insurance",Liabilities & Stockholders Equity    328 Total Laibilities and Stockholders Equity Total Liabilities and Stockholders Equity TOTAL LIABILITIES AND STOCKHOLDERS' EQUITY        00328,38.6%
860,RCPT_PER_PRNT_DVAL,00206,print periodicals revenue,Commercial and Finance company Paper 206 Commercial and Finance Company paper of US issuers Commercial and Finance Company Paper of U.S. issuers Comm/finance co paper of US issuers               00206,38.6%
861,INCOM_UNIT_BROK_AO_DEAL,00051,Did this establishment have income from brokering and/or dealing products?,Own another company-YES/NO Own another company - Yes/No Own another Company-yes/no Does this corp own more than 50% of another       00051,38.5%
862,COMP_DATE,00035,Completion Date - Month and Year completed or occupied,Merged Date Merged Date Merged Date Corporation Status of MERGED Date (YYYYMMDD)      00035,38.5%
863,EXPS_ADMIN_MEDPC_INS,00110,"Adminstrative Expenses, Medical malpractice insurance",NONOPERATING INCOME and EXPENSES     110 Nonoperating expenses and income Nonoperating Income and Expenses Nonoperating Income and Expenses                  00110,38.5%
864,INCOM_UNIT_CRED_TOT_PCT,00213,"Credit Card Products,  Total",Trade Accnts and Notes Receivable    213 Trade Accounts and Trade Notes Receivable Trade Accounts and Trade Notes Receivable Trade accounts and trade notes receivable         00213,38.5%
865,MULTIPLE_INVESTORS,00051,Does this location have multiple investors?,Own another company-YES/NO Own another company - Yes/No Own another Company-yes/no Does this corp own more than 50% of another       00051,38.5%
866,OWNSTAT_RACE_BLACK,00041,Race of majority ownership - Is the race of the majority ownership of this establishment black or African American?,Owned by another company-NO/YES Owned by another company - No/Yes Owned by another Company-No/Yes Owned by more than 50%                            00041,38.5%
867,RCPT_C_OWN_GOV_TOT,00217,"Ownership of Construction projects,  Federal, Commonwealth, Territorial, and municipal governments",Land and Mineral rights              217 Land and Mineral Rights Land and Mineral Rights Land and mineral rights                           00217,38.5%
868,RCPT_BOOK_ONLINE_PCT,00101,Source of Book Revenue: Online,"Sales Receipts and Operating Revenue-101 nan Sales , Receipts, and Operating Revenues Sales, Receipts and Operating Revenues            00101",38.5%
869,COST_AUX_ELEC,00219,"Auxiliary establishments,  Purchased electricity","Net Property Plant and Equipment     219 NET PPE Net PPE Net property, plant, and equipment                00219",38.5%
870,CLASS_FARMGT50_YES,00051,"Class of Customer,  Were 50 percent or more of the goods sold by this establishment purchased directly from farmers?",Own another company-YES/NO Own another company - Yes/No Own another Company-yes/no Does this corp own more than 50% of another       00051,38.5%
871,COST_ENT_UTIL_OTH,00110,"Enterprise payments for other establishments,  Water, sewer, refuse removal, and other utility payments",NONOPERATING INCOME and EXPENSES     110 Nonoperating expenses and income Nonoperating Income and Expenses Nonoperating Income and Expenses                  00110,38.5%
