723,EMP_DEC12_CONWRK,B_TYPS_WRKS,"Fourth Quarter Employment,  Construction Workers",Types of workers that were used by the business,47.9%,WRKR_TYPE_CHKBOX
724,EMP_MACH,B_TYPS_WRKS,"Selected MetalWorking Employment,  Machine shop",Types of workers that were used by the business,47.9%,WRKR_TYPE_CHKBOX
725,SUBSID_NONCONSOL_NUM,B_COOP,Number of corporations not consolidated in this report,Companieswithin the business group ,47.9%,COOP_PARTNER_LOC_CHKBOX
726,EMP_JUN12_PRDWRK_PY,WEMP,"Second Quarter Employment,  Production Workers  Prior Year",Number of employees as of March 12th,47.9%,EMP_MAR12_NUM
727,HOURS_FOUND,B_EMPTRAIN_HRS,"Steel Mill Department Worker Hours, Foundry (iron or steel)",Average number of hours of training that employees at this business received,47.9%,EMP_TRAIN_HRS_AVG
728,JOINT_COMPANY_ADDR_STATE_4,O4_NAME_TITLE,"Investors, State of Company Investor 4",Name of fourth owner,47.9%,OWNER4_NAME
729,EMP_MAR12_ASMBLY,B_CONTRACTIN_TYPE ,"Employment By Primary Occupation, 'Knockdown' assembly - assembling prefabricated components designed for a single application or reassembly of completed products",Types of companies that this business performed manufacturing for,47.8%,MAN_CONTRACTIN_CHKBOX
730,OPSTAT_SOLD_DATE,B_CEASED_MONTH,Operational Status: Sold or Leased Date,Month the business ceased operation,47.8%,OPSTAT_CEASED_MONTH_DATE
731,JOINT_COMPANY_ADDR_CITY_4,O4_NAME_TITLE,"Investors, City of Company Investor 4",Name of fourth owner,47.8%,OWNER4_NAME
732,GOVOWN_NO_ARCHIVE,AFFILWI ,Was this establishment operated by or under the control of a government entity or a board of directors either appointed by such an entity or publicly elected?,Details on affiliated organization ,47.8%,AFFIL_ORG_TXT
733,PRCH_ENT_REPAIR_TRANS,B_DESIGNOUT ,"Enterprise payments for other establishments,  purchased repairs and maintenance to transportation equipment",Yes/No if business provided design for goods that were contracted out,47.8%,MAN_DESIGNOUT_STAT
734,LICENSED_MD_YES_ARCHIVE,B_EMPNUM_RDFTE_TOTAL,Is there a licensed M.D. or D.O. working at this establishment?,Full-time equivalent of the R&D employees,47.8%,EMP_FTE_RD_NUM
735,AIES_LOCATION_SUMMARY,B_COOP,Summary of the locations for a company,Companieswithin the business group ,47.8%,COOP_PARTNER_LOC_CHKBOX
736,RCPT_FOOD_CNTRC_TOT,EXPNS,"Contract Feeding,  Total",Amount of total expenses,47.8%,EXPS_TOT_VAL
737,RCPT_CLIENT_F_GOV,B_COOP,"Class of Customer,  Federal, state, and local governments","Clients or customers from the public sector: public sector includes government owned organizations such as local, regional and national administrations and agencies, schools, hospitals, and government providers of services such as security, transport, housing, energy, etc. ",47.8%,COOP_PARTNER_LOC_CHKBOX
738,PAY_ANN_OTHWRK_M_PY,B_EMPNUM_W2_TOTAL,Annual Payroll for Other Manufacturing Employees  prior Year,Total number of W2 paid employees and owners,47.8%,EMP_W2_TOT_DNUM
739,EXPS_TRANSP_VAL,B_IMPROCESS_LOG ,Purchased Freight Transportation,"Whether the business introduced new or improved methods for logistics, delivery or distribution methods",47.7%,IMPROCESS_LOG_STAT 
740,RCPT_CONTRACT_R,B_DESIGNOUT ,"Contract Work done by customer in Puerto Rico,  Retailers",Yes/No if business provided design for goods that were contracted out,47.7%,MAN_DESIGNOUT_STAT
741,RCPT_CUST_SUBLIN_BUS_DVAL,B_SALES_TOT_US,Subscriber Line - Gov & Business revenue,"Amount of sales, revenue, and grants from domestic operations",47.7%,SALES_US_TOT_VAL
742,EMP_MAR12_LPN_XPSY,B_TYPS_WRKS,"Employment By Occupation, Licensed practical or vocational nurses",Types of workers that were used by the business,47.7%,WRKR_TYPE_CHKBOX
743,EMP_MAR12_LGL,O1_REASON_FINDJOB,"Employment By Occupation, Legal",Reason for owning business: Unable to find employment,47.7%,OWNING_REASON_FINDJOB_CODE
744,RCPT_MOTR_AGR_DVAL,B_SALES_TOT_US,Agricultural Products motor carrier revenue,"Amount of sales, revenue, and grants from domestic operations",47.7%,SALES_US_TOT_VAL
745,PRCH_AUX_COMSFT,B_EXPCOST_TECH,"Auxiliary establishment,  expensed purchases of software",R&D capital expenditures for software,47.7%,CAPEX_RD_OPS_TECH_VAL
746,RCPT_ESHIP_PCT,B_IMPROCESS_LOG ,E-shipments,"Whether the business introduced new or improved methods for logistics, delivery or distribution methods",47.7%,IMPROCESS_LOG_STAT 
747,SURVEY_LFO_OTH_WRTIN,AFFILWI ,"Legal form of Organization, Other,  write-in description",Details on affiliated organization ,47.7%,AFFIL_ORG_TXT
748,INCOM_LOAN_VEH_ORI_PCT,B_CRDSRC_OTHER_WIN,"Loan Products Income, Consumer vehicle loans, Origination Fees",Write-in of what lenders the business applied for new credit with ,47.7%,CREDIT_SRCS_OTH_WRTIN_TXT
749,RCPT_CLIENT_U_IND,B_COOP,"Class of Customer, Industrial",Companies that are the clients or customers outside the business group,47.6%,COOP_PARTNER_LOC_CHKBOX
750,EXPS_TEMPSTAF_VAL,B_OPEXPENSE ,Temporary Staff and Leased Employee Expense,Total domestic operating expenses,47.6%,EXPS_TOT_VAL
751,EXPS_TEMPSTAF_VAL,B_OPEXPENSE ,Temporary staff and leased employee expense,Total domestic operating expenses,47.6%,EXPS_TOT_VAL
752,HOUSE_NEWRES_NO,O1_OTH_BUS,"Did you start the building and/or manage construction of new residential buildings (single-family homes, townhomes, apartments, condominiums)?","Status of the previous business, other than this one, that the first owner started",47.6%,PREV_BUS_OWN_CODE
753,INV_WRKPROC_END,B_BUSTARGET,"Inventories, Work-in-process, End of Year",The timeframe that the business focused on for production targets,47.6%,PROD_TARG_TIMEFRM_CODE
754,INCOM_LEAS_AUTO_TOT_PCT,B_SALES_TOT_US,"Automobile and light-duty truck leasing services - includes operating and finance leases,  Total","Amount of sales, revenue, and grants from domestic operations",47.6%,SALES_US_TOT_VAL
755,MERCH_EST_NEW2_NO,B_INNOV_GOODS,"Did this establishment sell ""new"" merchandise, excluding parts installed in repair work, in $$00?",Whether the business introduced new or improved goods,47.5%,NEW_IMPROVE_GOODS_STAT
756,INV_VAL_STD_BGN,O1_ACQ_BUS_YR,"Inventories by Valuation Method, Standard Cost, Beginning of Year",Year that the first owner initially acquired this business,47.5%,OWNER_ACQ_YEAR
757,INCOM_UNIT_BROK_TOT_PCT,B_SALES_TOT_US,"Brokering and Dealing Products,  Total income","Amount of sales, revenue, and grants from domestic operations",47.5%,SALES_US_TOT_VAL
758,COST_RESALE_PY,B_CEASED_DATE_ YEAR ,Products bought and sold as such without further processing  Prior Year,Year the business ceased operation,47.5%,OPSTAT_CEASED_YEAR_DATE
759,EXPS_ADMIN_VEHPC_INS,B_OPEXPENSE ,"Adminstrative Expenses, Vehicle property and liability (casualty) insurance",Total domestic operating expenses,47.5%,EXPS_TOT_VAL
760,HOURS_ROLL_TIN,B_EMPTRAIN_HRS,"Steel Mill Department Worker Hours,  Tinmills",Average number of hours of training that employees at this business received,47.5%,EMP_TRAIN_HRS_AVG
761,RCPT_MOTR_FUEL_DVAL,B_SALES_TOT_US,Coal and Petroleum Products motor carrier revenue,"Amount of sales, revenue, and grants from domestic operations",47.5%,SALES_US_TOT_VAL
762,RCPT_CLIENT_U_INST,B_COOP,"Class of Customer, Institutional",Companies that are the clients or customers outside the business group,47.5%,COOP_PARTNER_LOC_CHKBOX
763,INV_E_WIP_VAL,B_BUSTARGET,"Inventories: Work-in-process, Current Year",The timeframe that the business focused on for production targets,47.5%,PROD_TARG_TIMEFRM_CODE
764,CLASS_GOV_LOC,B_COOP,"Class of Customer,  Local government","Clients or customers from the public sector: public sector includes government owned organizations such as local, regional and national administrations and agencies, schools, hospitals, and government providers of services such as security, transport, housing, energy, etc. ",47.5%,COOP_PARTNER_LOC_CHKBOX
765,INV_WRKPROC_BGN,B_BUSTARGET,"Inventories, Work-in-process, Beginning of Year",The timeframe that the business focused on for production targets,47.4%,PROD_TARG_TIMEFRM_CODE
766,RCPT_ADV_OTH_PCT,B_SALES_PCT_SERVICE,Source of Advertising Revenue: All other,"Percent of domestic sales, revenues, and grants coming from selling services to customers",47.4%,SALES_SERVICE_PCT
767,MRCH_NONMERCH_EC_DVAL,B_SALES_PCT_GOODS,non-merchandise ecommerce derived estimate,"Percent of domestic sales, revenues, and grants coming from selling goods to customers",47.4%,SALES_GOODS_PCT
768,AFFIL_SPL_PAY_ANN,WZWAGE,"Added child establishment,   Total Annual Payroll",Amount of internal research funds allocated to payroll for internal employees,47.4%,EXPS_RSRCH_PAYROLL_VAL
769,PRCH_COMMSVC_PY,O1_ACQ_BUS_YR,Purchased communication services   Prior Year,Year that the first owner initially acquired this business,47.4%,OWNER_ACQ_YEAR
770,RENT_PAY_MACH,B_RDEXP_DOM_EQUIPMT,Payments for Rental or lease of machinery and equipment,Amount of domestic R&D costs going to expensed machinery and equipment,47.3%,EXPS_RD_DOM_EQUIP_VAL
771,HOURS_ROLL_WIRE,B_EMPTRAIN_HRS,"Steel Mill Department Worker Hours,  Wiredrawing mills",Average number of hours of training that employees at this business received,47.3%,EMP_TRAIN_HRS_AVG
772,RCPT_PER_PUB_VAL,,Total Periodical Revenue,Frequency of financial audits,47.3%,AUD_FREQ_CODE
773,CONTACT_NAME,RESP_CONTACT_NAME ,Name of person to contact about the survey,Contact Information: Name,47.3%,CERT_NAME_TXT
774,INCOM_LOAN_RESMOR_TOT_PCT,B_SALES_PCT_GRANT,"Loan Products Income, Residential mortgage loans, Total","Percent of domestic sales, revenues, and grants coming from selling services to customers",47.3%,SALES_GRANT_PCT
775,CLASS_MTHDRECV_RAIL,B_IMPROCESS_MARKET ,"Class of Customer,  What is the primary method of receiving bulk liquid products?",Whether the business introduced new or improved methods for marketing methods,47.2%,IMPROCESS_MARKET_STAT
776,EMP_MAR12_COMSYS,B_TYPS_WRKS,"Employment By Occupation, Computer systems design, custom computer programming, and electronic data processing",Types of workers that were used by the business,47.2%,WRKR_TYPE_CHKBOX
777,RCPT_CONTRACT_CENTRAL,B_CONTRACTOUT_TYPE,"Contract Work done by customer location,  Central America, South America, and Caribbean Zone",Type of companies that manufacturing was contracted out to ,47.2%,MAN_CONTRACTOUT_CHKBOX
778,RCPT_CONTRACT_CLASS_TOT,EMPC,"Contract Work done by customer in Puerto Rico,  Total",Number of contract employes working on research activities,47.2%,EMP_RSRCH_CONTRACT_NUM
779,MULTIPLE_INVESTORS_YES_ARCHIVE,B_ANYONE_10_PCT,Does this location have multiple investors?,Yes/No if one person owns 10% or more of the company,47.2%,OWNED_10_PCT_STAT
780,RCPT_TOT_HOTEL_OWN_VAL,B_SALES_TOT_US,Hotels owned or leased: Revenue,"Amount of sales, revenue, and grants from domestic operations",47.2%,SALES_US_TOT_VAL
781,PRCH_PROFTECH_PY,O1_ACQ_BUS_YR,Purchased professional and technical services   Prior Year,Year that the first owner initially acquired this business,47.2%,OWNER_ACQ_YEAR
782,RCPT_LOCTEL_VAL,B_SALES_TOT_US,Total Fixed Local Telephony Revenue,"Amount of sales, revenue, and grants from domestic operations",47.2%,SALES_US_TOT_VAL
783,ENT_SIZE_CODE_TXT,B_RDJOB_TOTEMP_DOMESTIC,"Side indicator for MU Enterprise:  'L' = ENT has 5000+ employees, 'M' = ENT has 1000-4999 employees, 'N' = ENT has 10+ estabs OR 50+ employees and is not an L or M ENT, 'S' - All other ENTs that are not identified as a L, M, or N.",Total R&D employees by staff type,47.1%,EMP_MAR12_RD_TOT_DNUM
784,CLASS_W_RESALE,B_REV ,"Class of Customer,  Wholesalers/distributors for resale",Types of customers that accounted for 10% or more of total sales,47.1%,CUST_TYPE_10_PCT_SALES_CHKBOX
785,JOINT_COMPANY_NAME_5,B_COOP,Investors: Company Name of Company Investor 5,Companieswithin the business group ,47.1%,COOP_PARTNER_LOC_CHKBOX
786,EXPS_LOSS_VAL,B_RDEXP_DOM_DEPR,"Direct Losses Incurred: Property, including Life",Amount of domestic R&D costs going to depreciation on property and equipment,47.1%,EXPS_RD_DOM_DEPR_VAL
787,LSD_50_STAT,AFFILWI ,Professional Employer Organization (PEO) Status,Details on affiliated organization ,47.1%,AFFIL_ORG_TXT
788,COST_MINEWRK,B_RDEXP_DOM_MATERIALS,"Cost of supplies, fuels, electric energy, and contract work for a mine or pit",Amount of domestic R&D costs going to materials and supplies,47.1%,EXPS_RD_DOM_MAT_VAL
789,JOINT_COMPANY_ADDR_STATE_3,O3_NAME_TITLE,"Investors, State of Company Investor 3",Name of third owner,47.1%,OWNER3_NAME
790,RCPT_CLIENT_U_COMM,B_COOP,"Class of Customer,  Commercial (Include farms.)",Companies that are the clients or customers outside the business group,47.0%,COOP_PARTNER_LOC_CHKBOX
791,EMP_JUN12_CONWRK,WEMP,"Second Quarter Employment,  Construction Workers",Number of employees as of March 12th,47.0%,EMP_MAR12_NUM
792,PEGA_CONT_UPDATE,RESP_CONTACT_NAME ,PEGA Case contact information updated,Contact Information: Name,47.0%,CERT_NAME_TXT
793,INCOM_LOAN_VEH_OTH_PCT,B_CRDSRC_OTHER_WIN,"Loan Products Income, Consumer vehicle loans, Other Fees",Write-in of what lenders the business applied for new credit with ,47.0%,CREDIT_SRCS_OTH_WRTIN_TXT
794,ACTCHG_CUM_DBCRD_VAL,TCPEX,"Cumulative effect of accounting changes, net of taxes - principal debits and credits that contribute - Amount",Total capital expenditures,47.0%,CAPEX_TOT_VAL
795,RCPT_PRDSHIP_M,B_MANACTIVITY ,"Value of product shipped by customer in Puerto Rico,  Other manufacturing establishments",Yes/No if business manufactured goods in the US,46.9%,MAN_US_STAT
796,EMP_MAR12_ACCT,RESP_BUS_DESC,"Employment By Primary Occupation, Accounting, billing, tax preparation, and bookkeeping",Primary business activity,46.9%,NAICS_DESC_TXT
797,EMP_SEP12_OTHWRK_C,WEMP,"Third Quarter Employment,  Other Construction Employees",Number of employees as of March 12th,46.9%,EMP_MAR12_NUM
798,PROD_CLASS_DESC_WRTIN,NPRDFIELDWI,Description that corresponds to the 'other' product reported by the respondent,Additional detail or clarification for question response,46.9%,EXPS_RSRCH_FLD_TOT_TXT
799,JOINT_COMPANY_ADDR_CITY_3,O3_NAME_TITLE,"Investors, City of Company Investor 3",Name of third owner,46.9%,OWNER3_NAME
800,EXPS_RPTOT_DVAL,B_CRDAMT,deriving ASM/EC mfg collected total rental payments,Total amount of credit that was requested and received ,46.8%,CREDIT_AMT_RECEIVED_STAT
801,RCPT_MERCH_NONE_OF_ABOVE,B_SALES_PCT_US_TOT,On 1 Instrument Question: 	SALES_BY_PRINCIPAL_SOURCE_003,"Write-in of other sales, revenue, and grant sourcesTotal percent entered from domestic sales questions",46.8%,SALES_US_TOT_DPCT
802,EMP_JUN12_OTHWRK_C,WEMP,"Second Quarter Employment,  Other Construction Employees",Number of employees as of March 12th,46.8%,EMP_MAR12_NUM
803,PRCH_OTHEXPS_WRTIN,B_NEWCUSTSTART_REASON,"All other purchased services, write-in description",Why this new/customized product or service was developed,46.8%,NEW_CUST_PROD_START_REASON_STAT
804,PAY_QTR1_OTHWRK_M_PY,WZWAGE,Prior Year First Quarter Payroll for Non-Production Workers,Amount of internal research funds allocated to payroll for internal employees,46.8%,EXPS_RSRCH_PAYROLL_VAL
805,COST6,B_RDEXP_DOM_EQUIPMT,How many units available at sixth cost?,Amount of domestic R&D costs going to expensed machinery and equipment,46.8%,EXPS_RD_DOM_EQUIP_VAL
806,COMPID,B_COOP,Company ID used for disclosure avoidance processing,Companieswithin the business group ,46.8%,COOP_PARTNER_LOC_CHKBOX
807,INCOM_LOAN_RESMOR_ORI_PCT,B_SALES_PCT_GRANT,"Loan Products Income, Residential mortgage loans, Origination Fees","Percent of domestic sales, revenues, and grants coming from selling services to customers",46.8%,SALES_GRANT_PCT
808,INV_B_WIP_VAL,O1_OTH_BUS,"Inventories: Work-in-process,_x000D_
Prior Year","Status of the previous business, other than this one, that the first owner started",46.7%,PREV_BUS_OWN_CODE
809,RCPT_CLIENT_S_FIN,B_COOP,"Class of Customer, Banks, insurance companies, and other financial institutions",Companies that are the clients or customers outside the business group,46.7%,COOP_PARTNER_LOC_CHKBOX
810,RCPT_PRDSHIP_LOC_TOT,B_SALES_PCT_OTH_WIN,"Value of product shipped by customer location, Total",Total percent entered from domestic sales questions,46.7%,SALES_OTH_WRTIN_TXT
811,MAJOR_ACT_CODE_STAT,RESP_BUS_DESC,Major Activity Code,Primary business activity,46.7%,NAICS_DESC_TXT
812,PRCH_ENT_REPAIR_BUILD,B_DESIGNOUT ,"Enterprise payments for other establishments,  purchased repairs and maintenance to buildings, structures, and offices",Yes/No if business provided design for goods that were contracted out,46.7%,MAN_DESIGNOUT_STAT
813,PRCH_TAX,B_RDFUND_US_STLOC,Governmental taxes and licensing fees,Domestic R&D costs paid by U.S. state or local government,46.6%,FUNDS_RD_US_LOCGOV_VAL
814,PRCH_REPAIR,B_RD_MACHINE,Purchased repairs and maintenance to buildings and/or machinery and equipment,"Yes/No if business engaged in acquisition of machinery, equipment, or other tangible assets",46.6%,RD_MACHINE_STAT
815,RCPT_INTELPH_BUN_PCT,B_SALES_PCT_SERVICE,Percentage of receipts for internet telephone services from “bundled” services.,"Percent of domestic sales, revenues, and grants coming from selling services to customers",46.6%,SALES_SERVICE_PCT
816,INCOM_EXPS_RECURR_DBCRD_TXT,B_OPEXPENSE ,Other recurring nonoperating income (expenses) - principal debits and credits that contribute - Description,Total domestic operating expenses,46.6%,EXPS_TOT_VAL
817,RCPT_SVCSTA_NO,B_SALES_TOT_US,"Did any of the sales reported include the value of transfers to other company-owned gasoline stations, fuel oil dealers, and liquefied petroleum (LP) gas dealers?","Amount of sales, revenue, and grants from domestic operations",46.6%,SALES_US_TOT_VAL
818,AFFIL_FOR_MAIL_ADDR_TXT,O2_NAME_TITLE,"Foreign Ownership or Control:_x000D_
Mailing Address",Name of second owner,46.6%,OWNER2_NAME
819,CERT_NAME,RESP_CONTACT_NAME ,"Certification, :Name of person to contact about the survey",Contact Information: Name,46.6%,CERT_NAME_TXT
820,RCPT_FOOD_IMMCNSUM_GT50_YES_ARCHIVE,B_REV ,"Were more than half of the total sales and receipts of this establishment derived from the sale of prepared food, including refreshments, for immediate consumption?",Types of customers that accounted for 10% or more of total sales,46.5%,CUST_TYPE_10_PCT_SALES_CHKBOX
821,PAY_QTR1,WZWAGE,First Quarter Payroll,Amount of internal research funds allocated to payroll for internal employees,46.5%,EXPS_RSRCH_PAYROLL_VAL
822,NC-9902C_TYPOP_SELFDSG,B_PROMOTE_PERF,Type of Operation - What is the establishment's primary type of operation,Primary method that employees are promoted at this business,46.5%,PROMOTION_METHOD_CODE
823,EMP_MAR12_LSD_TOT_S,B_EMPNUM_UNPAID,TOTAL Q1 LEASED EMPLOYMENT FOR ALL CLIENTS,Number of individuals who did work for the business but were unpaid,46.5%,EMP_UNPAID_NUM
824,EXPS_PRCH_RESALE_AGBR_VAL,B_SALES_PCT_GOODS,Purchases of Products: AGBR,"Percent of domestic sales, revenues, and grants coming from selling goods to customers",46.5%,SALES_GOODS_PCT
825,EXPS_LOSS_NONMED_VAL,B_RDEXP_DOM_DEPR,"Direct Losses Incurred: Property, Except Life",Amount of domestic R&D costs going to depreciation on property and equipment,46.5%,EXPS_RD_DOM_DEPR_VAL
826,PRCH_REPAIR_PY,B_CEASED_DATE_ YEAR ,Purchased repairs and maintenance to buildings and/or machinery and equipment  Prior Year,Year the business ceased operation,46.5%,OPSTAT_CEASED_YEAR_DATE
827,PAY_QTR1_VAL,WZWAGE,First quarter payroll,Amount of internal research funds allocated to payroll for internal employees,46.5%,EXPS_RSRCH_PAYROLL_VAL
828,RCPT_OWN_VAL,B_SALES_PCT_GOODS,Commissions and Fee: Product sales,"Percent of domestic sales, revenues, and grants coming from selling goods to customers",46.4%,SALES_GOODS_PCT
829,EXPS_MAT_V2_VAL,B_COOP,"Materials, Parts, and Supplies V2","Suppliers of equipment, materials, components, or software outside your business group ",46.4%,COOP_PARTNER_LOC_CHKBOX
830,PAY_ANN_PRDWRK_PY,WEMP,Annual Payroll for Production Workers Prior Year,Number of employees as of March 12th,46.4%,EMP_MAR12_NUM
831,MAIL_ADDR_ST_TXT,RESP_EMAIL  ,Mailing State,Contact Information: Email,46.4%,CERT_EMAIL_TXT
832,LEASED_AUX_TEMP,B_OPEXPENSE ,"Auxiliary establishment, Temporary staff and leased employee expense ",Total domestic operating expenses,46.4%,EXPS_TOT_VAL
833,HOUSEKEEP,B_IMPROCESS_ADMIN ,Management provides housekeeping?,Whether the business introduced new or improved methods for administration and management activities,46.4%,IMPROCESS_ADMIN_STAT
834,RCPT_MOTR_GRAIN_DVAL,B_SALES_TOT_US,"Grains, Alcohol, Tobacco Products motor carrier revenue","Amount of sales, revenue, and grants from domestic operations",46.4%,SALES_US_TOT_VAL
835,CLNC_SEE_PERF_NONMNG,PERFBONUSM,Measures of Clinical Performance - Who sees your organization's measures of clinical performance - Employees (non-managers)?,What were managers’ performance bonuses usually based on at this company,46.4%,EMP_MNG_BONUS_CODE
836,PAY_ANN_VAL_SUM,WZWAGE,"Sum estabs payroll to KAU_x000D_
Sum KAU payroll to Company",Amount of internal research funds allocated to payroll for internal employees,46.4%,EXPS_RSRCH_PAYROLL_VAL
837,CLASS_EATDRINK,B_REV ,"Class of Customer,  Restaurants, food services, and nightclubs",Types of customers that accounted for 10% or more of total sales,46.3%,CUST_TYPE_10_PCT_SALES_CHKBOX
838,PAY_ANN_NONPRDWRK_VAL,WZWAGE,Annual Payroll - Nonproduction Workers,Amount of internal research funds allocated to payroll for internal employees,46.3%,EXPS_RSRCH_PAYROLL_VAL
839,INV_FINISHED_END,B_CEASED_DATE_ YEAR ,"Inventories, Finished Goods,  End of Year",Year the business ceased operation,46.3%,OPSTAT_CEASED_YEAR_DATE
840,COST3,B_RDEXP_DOM_EQUIPMT,How many units available at third cost?,Amount of domestic R&D costs going to expensed machinery and equipment,46.3%,EXPS_RD_DOM_EQUIP_VAL
841,FGINFO_ST,"
RESP_TITLE   ",State of F/G contact person,Contact Information: Title,46.3%,CERT_TITLE_TXT
842,RCPT_MOTR_HAZRD_PCT,B_SALES_TOT_US,Analysis of Motor Carrier Operations: Hazmat revenue,"Amount of sales, revenue, and grants from domestic operations",46.3%,SALES_US_TOT_VAL
843,RCPT_INTELPH_UNBUN_PCT,B_ACTIVITYUC_INFO ,Percentage of receipts for internet telephone services from “unbundled” or “stand alone” services.,Yes/No if domestic unaffiliated companies conducted information and communication tech services for this business,46.3%,UNAFFIL_US_INFOTEC_STAT
844,RCPT_ECOMM_THRD_STAT,B_SALES_PCT_US_TOT,Revenue from Electronic Sources: Third-party,"Write-in of other sales, revenue, and grant sourcesTotal percent entered from domestic sales questions",46.3%,SALES_US_TOT_DPCT
845,EXPS_TRANSP_REP_VAL,AIQUALC,Purchased Repairs and Maintenance to Transportation Equipment,What extent did this company use artificial intelligence (including machine learning algorithms in software applications) to support equipment maintenance                                                       ,46.3%,AI_QUAL_CTRL_CODE
846,JOINT_COMPANY_ADDR_STREET_2,O2_NAME_TITLE,"Investors,  Street Address of Company Investor 2",Name of second owner,46.3%,OWNER2_NAME
847,EXPS_INTEREST_PAID,B_CRDAMT,Interest paid,Total amount of credit that was requested and received ,46.3%,CREDIT_AMT_RECEIVED_STAT
848,EXPS_MACH_REP_VAL,B_RD_MACHINE,"Purchased Repairs and Maintenance to Machinery, Vehicles, and Equipment","Yes/No if business engaged in acquisition of machinery, equipment, or other tangible assets",46.3%,RD_MACHINE_STAT
849,INV_E_FIN_VAL,B_INNOV_GOODS,"Inventories: finished goods,  EOY",Whether the business introduced new or improved goods,46.3%,NEW_IMPROVE_GOODS_STAT
850,ASSET_NET_PPE_VAL,B_EXPCOST_BLDG,"Net property, plant, and equipment",R&D capital expenditures for buildings and land imp R&D capital expenditures for equipmentrovement,46.2%,CAPEX_RD_OPS_BLDG_VAL
851,HOURS_ROLL_PIPE,B_EMPTRAIN_HRS,"Steel Mill Department Worker Hours,  Pipe mills",Average number of hours of training that employees at this business received,46.2%,EMP_TRAIN_HRS_AVG
852,SURV_YEAR_STAT,RESP_REMARKS,Reporting Period Type,Remarks about reported data,46.2%,REMARKS_WRTIN_TXT
853,PRCH_TRANS_COST_OTH,B_IMPROCESS_LOG ,"Purchased Transportation,  Other (Include pickup, delivery, and transfer service.)","Whether the business introduced new or improved methods for logistics, delivery or distribution methods",46.2%,IMPROCESS_LOG_STAT 
854,EMP_PATTERN,B_TYPS_WRKS,"Selected MetalWorking Employment,  Pattern shop (foundry patterns only - metal, wood, etc.)",Types of workers that were used by the business,46.2%,WRKR_TYPE_CHKBOX
855,EMP_DEC12_OTHWRK_C,WEMP,"Fourth Quarter Employment,  Other Construction Employees",Number of employees as of March 12th,46.1%,EMP_MAR12_NUM
856,FORM_MAILED,RESP_EMAIL  ,Name of Form mailed,Contact Information: Email,46.1%,CERT_EMAIL_TXT
857,EMP_PREC,B_TYPS_WRKS,"Selected MetalWorking Employment,  Precision turned products (on screw machines, turning centers, and CNC equipment)",Types of workers that were used by the business,46.1%,WRKR_TYPE_CHKBOX
858,HOURS_OXY,B_EMPTRAIN_HRS,"Steel Mill Department Worker Hours,  Basic oxygen furnaces",Average number of hours of training that employees at this business received,46.1%,EMP_TRAIN_HRS_AVG
859,RCPT_MULTCHL_TOT_PCT,B_SALES_PCT_GRANT,Percentage of receipts for multichannel programming distribution services  Total,"Percent of domestic sales, revenues, and grants coming from selling services to customers",46.1%,SALES_GRANT_PCT
860,AFFIL_SPL_NAICS_SELFDSG_WRT,O1_REASON_FAMBUS ,"Added child establishment,   Kind of business write-in description",Reason for owning business: Carrying on family business,46.0%,OWNING_REASON_FAMBUS _CODE
861,COST10,B_RDEXP_DOM_EQUIPMT,How many units available at tenth cost?,Amount of domestic R&D costs going to expensed machinery and equipment,46.0%,EXPS_RD_DOM_EQUIP_VAL
862,RCPT_BOOK_ONLINE_DVAL,B_SALES_TOT ,online books revenue,"Amount of worldwide and domestic sales, revenue, and grants",46.0%,RCPT_ALL_TOT_VAL
