1410,INV_B_AVG_VAL,EXPNS,"Inventory Valuation Methods: PY, AVG Cost",Amount of total expenses,38.6%,EXPS_TOT_VAL
1411,RCPT_COMSN_AVGPCT,B_EMPTRAIN_HRS,Establishment's average commission rate earned,Average number of hours of training that employees at this business received,38.6%,EMP_TRAIN_HRS_AVG
1412,REVENUE_INST,B_SALES_PCT_US_TOT,QSS revenue instructions based on NAICS,"Write-in of other sales, revenue, and grant sourcesTotal percent entered from domestic sales questions",38.6%,SALES_US_TOT_DPCT
1413,BENEFIT_PENSION_BEN,B_RDEXP_DOM_EMPL,Employer's Cost for defined benefit pension plans,"Amount of domestic R&D costs going to salaries, wages, and benefits",38.5%,EXPS_RD_DOM_EMP_VAL
1414,PROP_MAR12_DENTIST,B_EMPNUM_RDFTE_TOTAL,"Proprietor or Partner by Occupation, Dentists - having D.M.D., D.D.S., or D.D.Sc. degree and other dental practitioners (Include hygienists, assistants, and others performing or assisting with dental procedures.)",Full-time equivalent of the R&D employees,38.5%,EMP_FTE_RD_NUM
1415,OPSTAT_ADDR_STREET_TXT,B_PROXY,Operational Status: Sold or Leased Mailing Address,Yes/No if person is reporting in behalf of business owners,38.5%,PROXY_REPRT_CODE
1416,NUMUNITS,B_OWNERNUM,"Number of total units for indicated type of unit (Unfurnished, Furnished, Co-op, or Condo)",Number of owners of the business,38.5%,OWNER_NUM_STAT
1417,ROWDONE,EXPNS,Flag to determine if the COST variable row has been completed,Amount of total expenses,38.5%,EXPS_TOT_VAL
1418,RCPT_CONTRACT_PR,B_CONTRACTOUT,"Contract Work done by customer location, Puerto Rico",Yes/No if business contracted out manufacturing tasks,38.5%,MAN_CONTRACTOUT_STAT
1419,NEWCON_YES,B_PRODSVC_PROB,"Was this consolidated reporting unit involved in new construction or renovation of buildings, structures, or communication lines?",The actions taken when a production or service problem arose ,38.5%,PRODSVC_PROB_CODE
1420,TOURIST_LAW_YES_ARCHIVE,AFFILWI ,Establishment operates under the Puerto Rico Tourist Incentive Act,Details on affiliated organization ,38.5%,AFFIL_ORG_TXT
1421,INV_E_IVAL_TOT_DVAL,B_IMPROCESS_LOG ,Inventory Valuation Methods: CY LIFO and non-LIFO,"Whether the business introduced new or improved methods for logistics, delivery or distribution methods",38.5%,IMPROCESS_LOG_STAT 
1422,EXPS_TAX_VAL,B_IP_ACT_CROSS ,Purchased tax and license fees,Yes/No if business participated in cross-licensing agreements with non-affiliated businesses,38.5%,INTELL_PROP_ACT_CROSS_STAT
1423,INCOM_UNIT_BROK_BROK_PCT,B_CONTRACTIN_TYPE ,"Brokering and Dealing Products, Brokering products",Types of companies that this business performed manufacturing for,38.5%,MAN_CONTRACTIN_CHKBOX
1424,CLASS_HOTEL,B_COOP,"Class of Customer,  Hotels or other traveler accommodations",Companies that are the clients or customers outside the business group,38.4%,COOP_PARTNER_LOC_CHKBOX
1425,PGM_UNITS,B_TRAINEXP_TOT,Number of Units in programs,Amount spent on formal training programs ,38.4%,EXPS_TRAIN_VAL
1426,REPORTING_ID,B_NUMKPI,"Reporting Unit ID.  8nnnnnnnnn= Enterprise level or record type 10, 2nnnnnnnnn= Establishment or record type 20, 3nnnnnnnnn= KAU or record type 30",Number of key performance indicators monitored by this business ,38.4%,KPI_MONITOR_NUM
1427,RCPT_MOTR_WOOD_PCT,B_CONTRACTIN_TYPE ,"Analysis of Motor Carrier Operations: Wood products, textiles, and leather",Types of companies that this business performed manufacturing for,38.4%,MAN_CONTRACTIN_CHKBOX
1428,EXPS_EHR_VAL,B_WORLDEXP_TOTAL ,Electronic Health Records: Expenses,Total worldwide operating expenses,38.4%,EXPS_WORLD_TOT_VAL
1429,SOMA_LETTER,"
RESP_TITLE   ",Advanced Letter Information,Contact Information: Title,38.4%,CERT_TITLE_TXT
1430,CLASS_GOV_FED,B_COOP,"Class of Customer,  Federal government","Clients or customers from the public sector: public sector includes government owned organizations such as local, regional and national administrations and agencies, schools, hospitals, and government providers of services such as security, transport, housing, energy, etc. ",38.4%,COOP_PARTNER_LOC_CHKBOX
1431,CERT_CALYEAR_YES,EXTERNALCPA,"Certification, Is the time period covered by this report a calendar year?","Did this company retain an external Certified Public Accountant to conduct an audit, review, or compilation of its financial statements",38.4%,CPA_EXTRN_RETAIN_CODE
1432,DIRECT_PREM_SUREPC_INS,B_ACTIVITYUC_OTHER ,"Direct Premiums Earned,  Surety and related insurance",Yes/No if domestic unaffiliated companies were involved in any other operating expenses,38.4%,UNAFFIL_US_EXPS_OTH_STAT
1433,EXT_DATE,RESP_PHONE_EXT ,Survey Time Extension granted,Contact Information: Extension,38.4%,CERT_EXTENSION_NUM
1434,RCPT_CLIENT_S_FEDGOV,B_COOP,"Class of Customer, Federal government","Clients or customers from the public sector: public sector includes government owned organizations such as local, regional and national administrations and agencies, schools, hospitals, and government providers of services such as security, transport, housing, energy, etc. ",38.4%,COOP_PARTNER_LOC_CHKBOX
1435,PAY_ANN_LSD_HEALTH,WZWAGE,Leased Annual Payroll from Health care Clients,Amount of internal research funds allocated to payroll for internal employees,38.3%,EXPS_RSRCH_PAYROLL_VAL
1436,RCPT_BOOK_OTH_PCT,B_SALES_PCT_US_TOT,Source of Book Revenue: Other media,"Write-in of other sales, revenue, and grant sourcesTotal percent entered from domestic sales questions",38.3%,SALES_US_TOT_DPCT
1437,CARE,B_IMPROCESS_ADMIN ,Management provides assistance with personal care,Whether the business introduced new or improved methods for administration and management activities,38.3%,IMPROCESS_ADMIN_STAT
1438,NONPROFT_STAT,B_RDTAX_STATE,Tax Status,The state in which the business filed for a tax credit for increasing research activities,38.3%,RSRCH_TAXCRED_ST
1439,EMP_PAINT,B_TYPS_WRKS,"Selected MetalWorking Employment,  Painting, lacquering, and enameling on metals",Types of workers that were used by the business,38.3%,WRKR_TYPE_CHKBOX
1440,PAY_FOUND,B_EMPNUM_W2_TOTAL,"Steel Mill Department Wages,  Foundry (iron or steel)",Total number of W2 paid employees and owners,38.3%,EMP_W2_TOT_DNUM
1441,EMP_MAR12_LSD_UTIL,B_EMPNUM_UNPAID,Q1 LEASED EMPLOYMENT FOR UTILITY CLIENTS,Number of individuals who did work for the business but were unpaid,38.3%,EMP_UNPAID_NUM
1442,HOUSE_MULT_BUILD,B_OWNERNUM,"Multifamily homes started,  Number of Multifamily Buildings (apartment/condominium complexes)",Number of owners of the business,38.2%,OWNER_NUM_STAT
1443,EMP_MAR12_SECURBLDG,B_TYPS_WRKS,"Employment By Occupation, Security, including security patrol, locksmith, monitoring, and investigation; and building services, including janitorial, carpet cleaning, pest control, and landscaping",Types of workers that were used by the business,38.2%,WRKR_TYPE_CHKBOX
1444,PATNT_CARE_OTHR_WRTIN,B_INNOV_SERV,"Patient Care Services Offered,  Other patient services write-in description",Whether the business introduced new or improved services,38.2%,NEW_IMPROVE_SERVICES_STAT
1445,PAY_DEPT,RECPERFBNSM,"Steel Mill Department Wages, Steel department (furnaces) (through pouring stage)","When production targets were met, what percent of managers at this company received performance bonuses",38.2%,EMP_MNG_TARG_BONUS_PCT
1446,EMP_ELECTRO,B_CONTRACTIN_TYPE ,"Selected MetalWorking Employment,  Electroplating and other plating",Types of companies that this business performed manufacturing for,38.1%,MAN_CONTRACTIN_CHKBOX
1447,ASKROW1,EXPNS,Flag to determine of first and second row of COST variables needs to be asked,Amount of total expenses,38.1%,EXPS_TOT_VAL
1448,LGL_FORM_CODE_NUM,AFFILWI ,Legal form-of-organization code based on administrative records. The LGL_FORM_CODE is assigned in the EIN_UNITS and transferred to the EMPLOYER_UNITS. The EMPLOYER_UNITS code is carried to the SURVEY_UNITS_CENSUS table or SURVEY_UNITS_COS_ASM table.,Details on affiliated organization ,38.1%,AFFIL_ORG_TXT
1449,PAY_ROLL_WIRE,B_EMPNUM_W2_TOTAL,"Steel Mill Department Wages, Wiredrawing mills",Total number of W2 paid employees and owners,38.1%,EMP_W2_TOT_DNUM
1450,COST2U3B0INT0,B_RDCOST_DOM_BASIC,"Initial Interview, Coop, 0 Bedrms, Cost #2",Domestic R&D performance costs for basic research,38.0%,EXPS_RD_US_BASIC_VAL
1451,AIES_RECORD_TYPE,B_TYPS_WRKS,Type of establishment being processed (One of the 4 types of KAUs and one of the 4 types of Estabs),Types of workers that were used by the business,38.0%,WRKR_TYPE_CHKBOX
1452,VER_NUM_UNITS,B_OWNERNUM,Verify Number of Units in building,Number of owners of the business,38.0%,OWNER_NUM_STAT
1453,RCPT_PAT_OUTPCKT_VAL,ZCLNZP,Net patient revenues from patient out-of-pocket from patients and their families V1,Amount of internal research funds allocated to medical clinical trials,38.0%,EXPS_RSRCH_MEDTRIAL_PCT
1454,RESP_BSTTIME,"RESP_PHONE_AREA_CODE
RESP_PHONE_PREFIX, RESP_PHONE_SUFFIX, ",Best time to contact agent.,Contact Information: Phone,38.0%,CERT_PHONE_NUM
1455,PRCH_TRANS_NODRIVERS,B_SALES_TOT_US,"Purchased Transportation,  Lease and rental payments for trucks and other motor vehicles without drivers","Amount of sales, revenue, and grants from domestic operations",37.9%,SALES_US_TOT_VAL
1456,BALANCE_SHEET_DATE,FYEND_MONTH,Balance sheet date,Month that fiscal year ends ,37.9%,FY_END_DATE
1457,IA_PAPER_TYPOP_SELFDSG_11,B_CONTRACTOUT_TYPE,IA TYPOP Code - Merchant wholesale distributor or jobber,Type of companies that manufacturing was contracted out to ,37.8%,MAN_CONTRACTOUT_CHKBOX
1458,BEDNONEU1,RDALE,Total Efficiencies for Type 1,Total number of full-time equivalents working on research activities,37.8%,EMP_FTE_RSRCH_TOT_DNUM
1459,DIST_LRN_OTH_LOC_PCT,B_EMPTRAIN,"Modes of Instruction, Instructor-led learning at other location",The areas covered by employee training,37.8%,EMP_TRAIN_AREA_CHKBOX
1460,INV_B_OTHNL_VAL,B_IMPROCESS_LOG ,"Inventory Valuation Methods: PY, Other Non-LIFO","Whether the business introduced new or improved methods for logistics, delivery or distribution methods",37.8%,IMPROCESS_LOG_STAT 
1461,RCPT_PROPCSLTY_INS_VAL,B_RDEXP_DOM_EMPL,Net patient revenues from property and casualty insurance,"Amount of domestic R&D costs going to salaries, wages, and benefits",37.8%,EXPS_RD_DOM_EMP_VAL
1462,INC_GAS,B_OPEXPENSE ,Is Gas included in the rent/condo fee?,Total domestic operating expenses,37.8%,EXPS_TOT_VAL
1463,RCPT_PAT_OUT_PCT,B_SALES_PCT_SERVICE,Inpatient/Outpatient Revenue: Outpatient care services,"Percent of domestic sales, revenues, and grants coming from selling services to customers",37.8%,SALES_SERVICE_PCT
1464,COST2U3B1INT0,B_RDCOST_DOM_BASIC,"Initial Interview, Coop, 1 Bedrms, Cost #2",Domestic R&D performance costs for basic research,37.7%,EXPS_RD_US_BASIC_VAL
1465,NEG_EXPS_PRCH_RESALE_DVAL,O1_ACQ_BUS_YR_DK  ,Negative copy of purchases for resale,Owner 1 does not know when initially acquired ownership of this business,37.7%,O1_ACQ_BUS_YR_CODE
1466,PAT_CARE_TOT_PCT,EXPNS,"Patient Care, Total",Amount of total expenses,37.7%,EXPS_TOT_VAL
1467,COMPANYBESTTIME,"
RESP_TITLE   ",Best time for the Company Contact,Contact Information: Title,37.7%,CERT_TITLE_TXT
1468,EXPS_BENEFIT_LIFE,B_RDEXP_DOM_EMPL,"Benefits Paid, Life insurance and annuities","Amount of domestic R&D costs going to salaries, wages, and benefits",37.6%,EXPS_RD_DOM_EMP_VAL
1469,CLASS_GOV_COMWLTH,B_INNOV_SERV,"Class of Customer,  Commonwealth government",Whether the business introduced new or improved services,37.6%,NEW_IMPROVE_SERVICES_STAT
1470,SURVEY_PERIOD,B_FREQCSM,The survey period,How frequently customer satisfaction is monitored by this business,37.6%,CUST_SATISFACT_FREQ_CODE
1471,INCOM_NET_VAL,EXPNS,Net income (loss) for quarter,Amount of total expenses,37.6%,EXPS_TOT_VAL
1472,EXPECTED,B_EXPCOST_BLDG,Total building units minus program units minus transient units,R&D capital expenditures for buildings and land imp R&D capital expenditures for equipmentrovement,37.6%,CAPEX_RD_OPS_BLDG_VAL
1473,TOTU4INT4,B_EXPCOST_BLDG,"Total Condo Units, Fourth Intv",R&D capital expenditures for buildings and land imp R&D capital expenditures for equipmentrovement,37.6%,CAPEX_RD_OPS_BLDG_VAL
1474,CLNC_SEE_PERF_PUBL,B_FREQKPI,Measures of Clinical Performance - Who sees your organization's measures of clinical performance - On public display?,How frequently key performance indicators are monitored by this business,37.6%,KPI_MONITOR_FREQ_CODE
1475,IA_PAPER_TYPOP_SELFDSG_42,B_COOP,"IA TYPOP Code - Broker, representing buyers and sellers",Companies that are the clients or customers outside the business group,37.6%,COOP_PARTNER_LOC_CHKBOX
1476,INC_H2O,B_OPEXPENSE ,Is Water included in the rent/condo fee?,Total domestic operating expenses,37.5%,EXPS_TOT_VAL
1477,INV_B_IVAL_TOT_DVAL,B_IMPROCESS_LOG ,"Inventory Valuation Methods: PY, LIFO and non-LIFO","Whether the business introduced new or improved methods for logistics, delivery or distribution methods",37.5%,IMPROCESS_LOG_STAT 
1478,INV_VAL_OTH_END,B_SALES_PCT_US_TOT,"Inventories by Valuation Method, Other non-LIFO valutation methods, End of Year","Write-in of other sales, revenue, and grant sourcesTotal percent entered from domestic sales questions",37.5%,SALES_US_TOT_DPCT
1479,INV_MAT_BGN,B_RDEXP_DOM_MATERIALS,"Inventories, Materials, supplies, fuels, etc., Beginning of Year",Amount of domestic R&D costs going to materials and supplies,37.5%,EXPS_RD_DOM_MAT_VAL
1480,TOTU4INT1,B_EXPCOST_BLDG,"Total Condo Units, First Intv",R&D capital expenditures for buildings and land imp R&D capital expenditures for equipmentrovement,37.5%,CAPEX_RD_OPS_BLDG_VAL
1481,TRAILER_NUM_TOT_DVAL,B_OWNERNUM,"Inventories:_x000D_
Total Trailers",Number of owners of the business,37.5%,OWNER_NUM_STAT
1482,INV_CY_LIFO_VAL,B_IMPROCESS_LOG ,Inventory Valuation Methods: CY LIFO,"Whether the business introduced new or improved methods for logistics, delivery or distribution methods",37.5%,IMPROCESS_LOG_STAT 
1483,EMP_MAR12_CHIRO,B_EMPNUM_RDFTE_TOTAL,"Employment By Occupation, Chiropractic physicians - licensed practitioners having D.C. degree",Full-time equivalent of the R&D employees,37.5%,EMP_FTE_RD_NUM
1484,INV_LIFO_RSV_END,B_CEASED_DATE_ YEAR ,"Inventories, LIFO reserve,  End of Year",Year the business ceased operation,37.4%,OPSTAT_CEASED_YEAR_DATE
1485,INCOM_BEF_INCOM_TAX_VAL,O1_PRIM_SRC_INCOM,Income (loss) before income taxes,"Yes/No if the business provided the first owner's primary source of persStatus of the previous business, other than this one, that the first owner startedonal income",37.4%,PRIM_SRC_INCOM_CODE
1486,INCOM_UNIT_CRED_OTHFE_PCT,B_RDFUND_US_OTHBUS,"Credit Card Products,  Other fees",Domestic R&D costs paid by other U.S. businesses,37.4%,FUNDS_RD_US_OTHBUS_VAL
1487,MEDIA_SUB_TOT_PCT,EXPNS,"Subscription Media,  Total",Amount of total expenses,37.4%,EXPS_TOT_VAL
1488,EMP_MAR12_AUDIO,EMPC,"Employment By Occupation, Audiologists",Number of contract employes working on research activities,37.4%,EMP_RSRCH_CONTRACT_NUM
1489,PAY_ROLL_OTH,B_CONTRACTOUT_TYPE,"Steel Mill Department Wages, Other mills, including semifinishing, plate, and structural",Type of companies that manufacturing was contracted out to ,37.3%,MAN_CONTRACTOUT_CHKBOX
1490,SPACE_FLOOR,CPSTR,Total under-roof floor space,Total capital expenditures for research operations that went towards buildings and land improvement,37.3%,CAPEX_RSRCH_BUILD_VAL
1491,COST2U3B0INT1,B_RDCOST_DOM_BASIC,"First Interview, Coop, 0 Bedrms, Cost #2",Domestic R&D performance costs for basic research,37.3%,EXPS_RD_US_BASIC_VAL
1492,COST6U3B0INT0,B_RDCOST_DOM_BASIC,"Initial Interview, Coop, 0 Bedrms, Cost #6",Domestic R&D performance costs for basic research,37.2%,EXPS_RD_US_BASIC_VAL
1493,INV_VAL_TOT_END,EXPNS,"Inventories by Valuation Method, Total LIFO and Non-LIFO valuation methods, End of Year",Amount of total expenses,37.2%,EXPS_TOT_VAL
1494,HOUSE_SNGL_DETACH_LAND,B_OWNERNUM,"Houses built for customers on their land,  Number of Detached (free standing single-family homes)",Number of owners of the business,37.2%,OWNER_NUM_STAT
1495,SOMA_CASEID,B_OWNERNUM,Sequential Control number assigned by sponsor.,Number of owners of the business,37.2%,OWNER_NUM_STAT
1496,RCPT_NEWS_OTH_DVAL,B_SALES_PCT_SERVICE,other media newspaper revenue,"Percent of domestic sales, revenues, and grants coming from selling services to customers",37.2%,SALES_SERVICE_PCT
1497,TOTU4INT0,B_EXPCOST_BLDG,"Total Condo Units, Initial Intv",R&D capital expenditures for buildings and land imp R&D capital expenditures for equipmentrovement,37.2%,CAPEX_RD_OPS_BLDG_VAL
1498,RCPT_NEWS_PRNT_PCT,B_SALES_PCT_US_TOT,Source of Newspaper Revenue: Print,"Write-in of other sales, revenue, and grant sourcesTotal percent entered from domestic sales questions",37.2%,SALES_US_TOT_DPCT
1499,PAT_OUT_VISIT_NUM,RESP_BUS_DESC,Inpatient/Outpatient Activity: Outpatient visits,Primary business activity,37.2%,NAICS_DESC_TXT
1500,INC_CABLE,B_RDFUND_US_STLOC,Is Cable/Satellite TV included in the rent/condo fee?,Domestic R&D costs paid by U.S. state or local government,37.2%,FUNDS_RD_US_LOCGOV_VAL
1501,CERT_FAX,"RESP_PHONE_AREA_CODE
RESP_PHONE_PREFIX, RESP_PHONE_SUFFIX, ","Certification,  Fax Number",Contact Information: Phone,37.1%,CERT_PHONE_NUM
1502,RCPT_UFO_YES_ARCHIVE,B_OPR_CEASED,Unfilled orders yes/no response,Yes/No if business has ceased operation,37.1%,OPSTAT_CEASED_STAT
1503,INV_E_FIFO_VAL,B_IMPROCESS_LOG ,"Inventory Valuation Methods: CY, FIFO","Whether the business introduced new or improved methods for logistics, delivery or distribution methods",37.1%,IMPROCESS_LOG_STAT 
1504,COST2U3B3INT0,B_RDCOST_DOM_BASIC,"Initial Interview, Coop, 3 Bedrms, Cost #2",Domestic R&D performance costs for basic research,37.1%,EXPS_RD_US_BASIC_VAL
1505,PHYSLOC_ADDR_ST_TXT,"
RESP_TITLE   ",Physical Address: State,Contact Information: Title,37.1%,CERT_TITLE_TXT
1506,EXPS_BENEFIT_PRDPC_INS,B_OPEXPENSE ,"Benefits Paid, Product liability insurance",Total domestic operating expenses,37.1%,EXPS_TOT_VAL
1507,PATREV_GOV_WRKCMP,B_RDEXP_DOM_EMPL,Patient Care Revenue:  Workers' compensation,"Amount of domestic R&D costs going to salaries, wages, and benefits",37.1%,EXPS_RD_DOM_EMP_VAL
1508,MSC_OTH,EXPNS,What were the miscellaneous receipts for Other miscellaneous receipts,Amount of total expenses,37.1%,EXPS_TOT_VAL
1509,FLRS,CPSTR,Number of floors in building (SOC Data),Total capital expenditures for research operations that went towards buildings and land improvement,37.1%,CAPEX_RSRCH_BUILD_VAL
1510,TRUCKTRAC_WOD_NUM,B_CONTRACTOUT_TYPE,"Inventories:_x000D_
Truck-tractors without drivers",Type of companies that manufacturing was contracted out to ,37.0%,MAN_CONTRACTOUT_CHKBOX
1511,COST4U3B0INT0,B_RDCOST_DOM_BASIC,"Initial Interview, Coop, 0 Bedrms, Cost #4",Domestic R&D performance costs for basic research,37.0%,EXPS_RD_US_BASIC_VAL
1512,COST11U3B0INT0,B_RDCOST_DOM_BASIC,"Initial Interview, Coop, 0 Bedrms, Cost #11",Domestic R&D performance costs for basic research,37.0%,EXPS_RD_US_BASIC_VAL
1513,COST1U3B0INT0,B_RDCOST_DOM_BASIC,"Initial Interview, Coop, 0 Bedrms, Cost #1",Domestic R&D performance costs for basic research,37.0%,EXPS_RD_US_BASIC_VAL
1514,RCPT_ECOMM_DRUGS_VAL,B_IMPROCESS_MARKET ,"Electronic Commerce (e-commerce) - Drugs, health & beauty aids",Whether the business introduced new or improved methods for marketing methods,37.0%,IMPROCESS_MARKET_STAT
1515,ASSET_LAND_MINERAL_VAL,B_OWNED_GOVT_TRIBAL,Land and mineral rights,Yes/No if business is owned by a government or tribal entity,37.0%,OWNED_GOV_TRIBAL_STAT
1516,EXPS_BENEFIT_SUREPC_INS,B_RDEXP_DOM_EMPL,"Benefits Paid, Surety and related insurance","Amount of domestic R&D costs going to salaries, wages, and benefits",37.0%,EXPS_RD_DOM_EMP_VAL
1517,ALPHA,AFFILWI ,Enterprise Identifier,Details on affiliated organization ,36.9%,AFFIL_ORG_TXT
1518,RECORD_LINENUM,WEMP,"The line number listed in the following sequence: Employer Identification Number (EIN), major activity, and geographic location",Number of employees as of March 12th,36.9%,EMP_MAR12_NUM
1519,RCPT_ECOMM_AUDVID_VAL,B_IMPROCESS_INFO,Electronic Commerce (e-commerce) - Audio & video recordings,Whether the business introduced new or improved methods for information and communication systems,36.9%,IMPROCESS_INFO_STAT
1520,CLNC_CHSE_MEAS_INS,PERFBONUSM,Measures of Clinical Performance - Who chooses which measures of clinical performance to collect - Insurance providers?,What were managers’ performance bonuses usually based on at this company,36.9%,EMP_MNG_BONUS_CODE
1521,CLNC_CHSE_MEAS_BOARD,PERFBONUSM,Measures of Clinical Performance - Who chooses which measures of clinical performance to collect - Board of Directors?,What were managers’ performance bonuses usually based on at this company,36.9%,EMP_MNG_BONUS_CODE
1522,TRUCKTRAC_WD_NUM,B_RDEXP_DOM_EQUIPMT,"Inventories:_x000D_
Truck-tractors with drivers",Amount of domestic R&D costs going to expensed machinery and equipment,36.9%,EXPS_RD_DOM_EQUIP_VAL
1523,COST2U3B2INT0,B_RDCOST_DOM_BASIC,"Initial Interview, Coop, 2 Bedrms, Cost #2",Domestic R&D performance costs for basic research,36.9%,EXPS_RD_US_BASIC_VAL
1524,EXPS_BENEFIT_PRPCAS_REINS,B_RDEXP_DOM_EMPL,"Benefits Paid, Property and casualty reinsurance","Amount of domestic R&D costs going to salaries, wages, and benefits",36.8%,EXPS_RD_DOM_EMP_VAL
1525,OPERATE_CLNC_OWN,B_NEWCUSTSTART_REASON,Which best describes who operated this retail health clinic?,Why this new/customized product or service was developed,36.8%,NEW_CUST_PROD_START_REASON_STAT
1526,RCPT_C_ST_MA,CPSTR,"Construction Work by State,  Massachusettes",Total capital expenditures for research operations that went towards buildings and land improvement,36.8%,CAPEX_RSRCH_BUILD_VAL
1527,COST9U3B0INT0,B_RDCOST_DOM_BASIC,"Initial Interview, Coop, 0 Bedrms, Cost #9",Domestic R&D performance costs for basic research,36.8%,EXPS_RD_US_BASIC_VAL
1528,ADD_OPEN_DATE,B_INNOV_SERV,New Establishment: Open date,Whether the business introduced new or improved services,36.8%,NEW_IMPROVE_SERVICES_STAT
1529,INC_SEWER,B_OPEXPENSE ,Is Sewer included in the rent/condo fee?,Total domestic operating expenses,36.8%,EXPS_TOT_VAL
1530,INCOM_STATEMNT_E_DATE,EXTERNALCPA,Statement of Income and Retained Earnings for your 3-MONTH PERIOD: To Date,"Did this company retain an external Certified Public Accountant to conduct an audit, review, or compilation of its financial statements",36.8%,CPA_EXTRN_RETAIN_CODE
1531,RCPT_FOOD_CNTRC_REC,RESP_BUS_DESC,"Contract Feeding,  Stadiums, clubs, and other recreation and amusement facilities",Primary business activity,36.8%,NAICS_DESC_TXT
1532,COST1U3B1INT0,B_RDCOST_DOM_BASIC,"Initial Interview, Coop, 1 Bedrms, Cost #1",Domestic R&D performance costs for basic research,36.7%,EXPS_RD_US_BASIC_VAL
1533,INC_ELEC,B_OPEXPENSE ,Is Electricity included in the rent?,Total domestic operating expenses,36.7%,EXPS_TOT_VAL
1534,RCPT_UFO_STAT ,B_CEASED_MONTH,Unfilled Orders Status,Month the business ceased operation,36.7%,OPSTAT_CEASED_MONTH_DATE
1535,GOV_DEL_RET,RESP_EMAIL  ,Gov Delivery - Email returned out of office,Contact Information: Email,36.7%,CERT_EMAIL_TXT
1536,EMP_MAR12_OSTEO,B_EMPNUM_RDFTE_TOTAL,"Employment By Occupation, Osteopathic physicians - licensed practitioners having D.O. degree",Full-time equivalent of the R&D employees,36.7%,EMP_FTE_RD_NUM
1537,REPAY_CASH_ADV,B_ACTIVITYUC_OTHER ,"True if the receipts or revenue reported included the repayments of cash advances made by this establishment for the convenience of those served to cover such items as cemetery expenses, transportation, flowers, newspaper notices, clergy and musician honoraria, transcripts, and other items not in the services normally included in the price of a funeral selected at this establishment; false otherwise",Yes/No if domestic unaffiliated companies were involved in any other operating expenses,36.7%,UNAFFIL_US_EXPS_OTH_STAT
1538,INV_PREADJ_CY_LIFO_VAL,B_PATENT_OWNED ,Inventories: Total before LIFO ADJ,Number of patents owned,36.6%,PATENT_OWNED_NUM
1539,COST7U3B0INT0,B_RDCOST_DOM_BASIC,"Initial Interview, Coop, 0 Bedrms, Cost #7",Domestic R&D performance costs for basic research,36.6%,EXPS_RD_US_BASIC_VAL
1540,QTR_REPORTING_ID,B_SALES_PCT_US_TOT,Quarterly ID,"Write-in of other sales, revenue, and grant sourcesTotal percent entered from domestic sales questions",36.6%,SALES_US_TOT_DPCT
1541,PAT_DSCHG_NUM,WEMP,Number of patient discharges,Number of employees as of March 12th,36.6%,EMP_MAR12_NUM
1542,CAPCTY_PETR_LQUID_LT50K,B_SALES_TOT_US,"Choices for: How much liquefied petroleum storage tank capacity did this establishment operate, both owned and leased, on the last business day of $$00?","Amount of sales, revenue, and grants from domestic operations",36.6%,SALES_US_TOT_VAL
1543,BENEFIT_HEALTH_PY,B_RDEXP_DOM_EMPL,Employer's cost for health insurance  Prior Year,"Amount of domestic R&D costs going to salaries, wages, and benefits",36.6%,EXPS_RD_DOM_EMP_VAL
1544,IA_PAPER_TYPOP_SELFDSG_46,B_COOP,IA TYPOP Code - Manufacturers' representative or agent,"Suppliers of equipment, materials, components, or software outside your business group ",36.5%,COOP_PARTNER_LOC_CHKBOX
1545,INV_VAL_OTH_BGN,B_SALES_PCT_US_TOT,"Inventories by Valuation Method, Other non-LIFO valutation methods, Beginning of Year","Write-in of other sales, revenue, and grant sourcesTotal percent entered from domestic sales questions",36.5%,SALES_US_TOT_DPCT
1546,INCOM_STATEMNT_B_DATE,EXTERNALCPA,Statement of Income and Retained Earnings for your 3-MONTH PERIOD: From Date,"Did this company retain an external Certified Public Accountant to conduct an audit, review, or compilation of its financial statements",36.5%,CPA_EXTRN_RETAIN_CODE
1547,ADDR_ZIP,RESP_EMAIL  ,Mailing Address ZIP Code,Contact Information: Email,36.5%,CERT_EMAIL_TXT
