,MDR's Variable,Variable Source,MDR's Description,Source's Description,similarity_score
708,JOINT_INVEST_PCT_1,00324,Investors: Percent of Investment of Company Investor 1,Other Stockholders Equity            324 Other Stockholder Equity Other Stockholders Equity,46.70%
709,RCPT_C_OWN_TOT_PCT,00219,"Ownership of Construction projects,  Total",Net Property Plant and Equipment     219 NET PPE Net PPE,46.70%
710,OPSTAT_STAT,00031,Operational Status Selection,Corp status active/discontinued/merged Corporation Status Active/Discontinued/Merged Corporation Status Active/Discontinued/Merged,46.70%
711,INCOM_LEAS_XAUTO_INT_PCT,00301,"Finance leasing services, except automobile and light-duty truck leasing services, Interest",Short Term Loans (Loans from Banks)  301 Short Term Loans (Loan from Banks) Short Term Loans (Loan from Banks),46.70%
712,RCPT_CLIENT_U_IND,00001,"Class of Customer, Industrial",Is this your Company's Industry -YES/NO Is this your company's industry - yes/no Is this your company's industry - yes/no,46.70%
713,PROP_MAR12_TOT_S,00324,"Proprietor or Partner by Occupation, Total",Other Stockholders Equity            324 Other Stockholder Equity Other Stockholders Equity,46.70%
714,INCOM_LOAN_RESMOR_ORI_PCT,00105,"Loan Products Income, Residential mortgage loans, Origination Fees",Interest Expense                     105 Interest Expense Interest expense,46.70%
715,TAXSTAT,00114,Tax exempt status,Provision for income taxes           114 Provision for Income Taxes Provision for domestic income taxes,46.60%
716,INCOM_UNIT_BROK_INTER_PCT,00213,"Brokering and Dealing Products, Interest income from trading accounts",Trade Accnts and Notes Receivable    213 Trade Accounts and Trade Notes Receivable Trade Accounts and Trade Notes Receivable,46.60%
717,PATREV_GOV_WRKCMP,00101,Patient Care Revenue:  Workers' compensation,"Sales Receipts and Operating Revenue-101 nan Sales , Receipts, and Operating Revenues",46.60%
718,GROUP_KEY_TXT,DOCDE,NAICS + Tax status + Type Op + Scope,IRS Form nan nan,46.60%
719,OPSTAT_STAT,00031,Establishment status from BR or COLLECTION,Corp status active/discontinued/merged Corporation Status Active/Discontinued/Merged Corporation Status Active/Discontinued/Merged,46.60%
720,CLASS_MOS_WARE_ARCHIVE,00101,"Class of Customer,  What best describes this establishment's principal method of selling?","Sales Receipts and Operating Revenue-101 nan Sales , Receipts, and Operating Revenues",46.50%
721,PROD_QTYPRD_RDS_NONE,00217,"None for the question: If MINE_HERE = 1, report the quantity of rough dimension stone (including limestone, granite, slate, marble, trap rock, sandstone, quartz, and miscellaneous types of stone) mined at this mine or pit",Land and Mineral rights              217 Land and Mineral Rights Land and Mineral Rights,46.50%
722,INV_PY_LIFO_VAL,00214,Inventory Valuation Methods: PY LIFO,Inventories                          214 Inventories Inventories,46.50%
723,RCPT_APSOFT_ENTR_DVAL,00101,Enterprise or Network Application revenue,"Sales Receipts and Operating Revenue-101 nan Sales , Receipts, and Operating Revenues",46.50%
724,ROBOT_ACTIVE_WRTIN,00216,Number of industrial robots IN OPERATION at this plant write-in description,Plant and Equipment                  216 Plant and Equipment Plant and Equipment,46.50%
725,INCOM_UNIT_BROK_AO_DEAL_NO_ARCHIVE,00101,Did this establishment have income from brokering and/or dealing products?,"Sales Receipts and Operating Revenue-101 nan Sales , Receipts, and Operating Revenues",46.50%
726,CERT_CALYEAR_YES_ARCHIVE,RPTB,"Certification, Is the time period covered by this report a calendar year?",Beginning of Report Period nan nan,46.50%
727,RCPT_BILL_PAY_PCT,00101,Source of Billings and Fees Revenue: Payroll,"Sales Receipts and Operating Revenue-101 nan Sales , Receipts, and Operating Revenues",46.50%
728,TOTU2INT3,00215,"Total Furn Units, Third Intv",All Other Current Assets             215 All Other Current Assets All Other Current Assets,46.40%
729,INV_RPT_DATE,00214,reporting Date for inventories,Inventories                          214 Inventories Inventories,46.40%
730,INCOM_LOAN_RESMOR_TOT_PCT,00302,"Loan Products Income, Residential mortgage loans, Total",Short Term Loans (Commercial Paper)  302 Short Term Loans (Commercial Paper) Short Term Loans (Commercial Paper),46.40%
731,INV_E_NL_TOT_DVAL,00101,Inventory Valuation Methods: CY non-LIFO Total,"Sales Receipts and Operating Revenue-101 nan Sales , Receipts, and Operating Revenues",46.30%
732,RCPT_CLIENT_F_GOV,00207,"Class of Customer,  Federal, state, and local governments",St and Local Government Securities   207 State and Local Government Securities State and Local Government Securities,46.30%
733,JOINT_INVEST_PCT_5,00324,Investors: Percent of Investment of Company Investor 5,Other Stockholders Equity            324 Other Stockholder Equity Other Stockholders Equity,46.30%
734,PROD_QTYPRD_CBOTH_NONE,00217,"None for the question: If MINE_HERE = 1, report the quantity of crushed or broken other stone (including slate, marble, trap rock, sandstone, quartz, and miscellaneous types of stone) mined at this mine or pit",Land and Mineral rights              217 Land and Mineral Rights Land and Mineral Rights,46.20%
735,REPAY_CASH_ADV_PCT,00101,Percent of receipts or revenue from repayments of cash advances,"Sales Receipts and Operating Revenue-101 nan Sales , Receipts, and Operating Revenues",46.20%
736,INCOM_UNIT_CRED_NO,00101,Did this establishment have income from credit card products?,"Sales Receipts and Operating Revenue-101 nan Sales , Receipts, and Operating Revenues",46.20%
737,MAIL_ADDR_NAME2_TXT,00022,Company Mailing Address: Name 2,EI of corp Employer Identification Number Employer Identification Number,46.20%
738,JOINT_INVEST_PCT_3,00324,Investors: Percent of Investment of Company Investor 3,Other Stockholders Equity            324 Other Stockholder Equity Other Stockholders Equity,46.20%
739,RCPT_MOTOR_LOCAL,00101,"Trucking Revenue,  LOCAL (motor carrier service within a single metropolitan area and its adjacent nonurban areas, which may cross state lines)","Sales Receipts and Operating Revenue-101 nan Sales , Receipts, and Operating Revenues",46.20%
740,NAME1,00044,Company Name,EI of company who owns EI of company who owns EI of company who owns,46.20%
741,RCPT_BOOK_OTH_DVAL,00101,other media books revenue,"Sales Receipts and Operating Revenue-101 nan Sales , Receipts, and Operating Revenues",46.20%
742,RCPT_ECOMM_WEB_STAT,00101,Revenue from Electronic Sources: Website,"Sales Receipts and Operating Revenue-101 nan Sales , Receipts, and Operating Revenues",46.20%
743,RECORD_CFN,0122D,The CFN (census file number) - Unique identifier used for downloading and uploading data,Census Use Only -- ADJ               122 Census Use Only -- ADJ Census Use Only -- ADJ,46.10%
744,EXPS_BENEFIT_TOT,CPAY,"Benefits Paid, Total",current PAY from BR nan nan,46.10%
745,AFFIL_FOR_ADDR_CITY_TXT,00041,Foreign Ownership or Control: City,Owned by another company-NO/YES Owned by another company - No/Yes Owned by another Company-No/Yes,46.10%
746,SURVEY_PERIOD,RPTB,The survey period,Beginning of Report Period nan nan,46.00%
747,PROD_QTYPRD_RDLIME_NONE,00217,"None for the question: If MINE_HERE = 1, report the quantity of rough dimension limestone (including dolomite, cement rock, marl, travertine, and calcareous tufa) mined at this mine or pit",Land and Mineral rights              217 Land and Mineral Rights Land and Mineral Rights,46.00%
748,AFFIL_CONTROL_STAT,00041,Ownership or Control: Management and Policy Status,Owned by another company-NO/YES Owned by another company - No/Yes Owned by another Company-No/Yes,46.00%
749,PROD_QTYPRD_CBS_NONE,00217,"None for the question: If MINE_HERE = 1, Report the quantity of crushed or broken stone (including limestone, granite, slate, marble, trap rock, sandstone, quartz, and miscellaneous types of stone) mined at this mine or pit",Land and Mineral rights              217 Land and Mineral Rights Land and Mineral Rights,46.00%
750,AFFIL_FOR_STOCK_EQ50,00041,"What percent of voting stock was owned directly or indirectly by a foreign entity (company, individual, government)?",Owned by another company-NO/YES Owned by another company - No/Yes Owned by another Company-No/Yes,45.90%
751,OWNSTAT_RACE_CHINA,00041,Race of majority ownership - Is the race of the majority ownership of this establishment Chinese?,Owned by another company-NO/YES Owned by another company - No/Yes Owned by another Company-No/Yes,45.90%
752,AFFIL_FOR_ADDR_STREET,00208,"Street Address of the foreign entity (company, individual, government, etc.)",Foreign Securities                   208 Foreign Securities Foreign Securities,45.90%
753,RCPT_GROSSBILL_VAL,00105,Gross billings/professional services fees,Interest Expense                     105 Interest Expense Interest expense,45.90%
754,RCPT_CLIENT_U_RES,00219,"Class of Customer,  Residential (Include apartment buildings.)",Net Property Plant and Equipment     219 NET PPE Net PPE,45.90%
755,COST_MAT_PARTS_PY,00221,"Materials, parts, containers, packaging, supplies, etc. used for manufacturing processes, repairs, services for others, or other operating supplies   Prior Year",All Other Non-current assets         221 All Other Non-current Assets All Other Non-current Assets,45.90%
756,RCPT_FOOD_CNTRC_MANUF,00216,"Contract Feeding,  Manufacturing and other industrial plants",Plant and Equipment                  216 Plant and Equipment Plant and Equipment,45.90%
757,RCPT_APSOFT_PERS_DVAL,00101,Personal Computer Application Software revenue,"Sales Receipts and Operating Revenue-101 nan Sales , Receipts, and Operating Revenues",45.90%
758,RCPT_ECOMM_OTHMRCH_VAL,00213,Electronic Commerce (e-commerce) - Other merchandise,Trade Accnts and Notes Receivable    213 Trade Accounts and Trade Notes Receivable Trade Accounts and Trade Notes Receivable,45.90%
759,DEFNS_SHIPM_NDP_YES_ARCHIVE,00211,Did this establishment ship national defense related products?,Trade Receivables from US Government 211 Trade Receivables from the U.S. Government Trade Receivables from the U.S. Government,45.80%
760,RCPT_CUST_NORES_DVAL,00101,Non-residential consumer revenue,"Sales Receipts and Operating Revenue-101 nan Sales , Receipts, and Operating Revenues",45.80%
761,EMP_MAR12_LSD_TOT_S,P2PAY,TOTAL Q1 LEASED EMPLOYMENT FOR ALL CLIENTS,Prior Prior quarter payroll from BR nan nan,45.80%
762,OWNSTAT_RES_ARCHIVE,00041,What is the citizenship of the majority ownership of this establishment?,Owned by another company-NO/YES Owned by another company - No/Yes Owned by another Company-No/Yes,45.70%
763,OPSTAT_WRTIN,00031,"Operational Status,  Write-in description",Corp status active/discontinued/merged Corporation Status Active/Discontinued/Merged Corporation Status Active/Discontinued/Merged,45.70%
764,RCPT_MOTR_PHARM_DVAL,00101,Pharmaceutical and chemical products motor carrier revenue,"Sales Receipts and Operating Revenue-101 nan Sales , Receipts, and Operating Revenues",45.70%
765,RATIO_FACTOR,P2PAY,"post stratification factors - _x000D_
makes KAU totals match the frame totals for Payroll_x000D_
makes GRO/Estab totals match the frame totals for Payroll",Prior Prior quarter payroll from BR nan nan,45.70%
766,RCPT_CLIENT_U_TOT_PCT,00219,"Class of Customer,  Total Utilities",Net Property Plant and Equipment     219 NET PPE Net PPE,45.70%
767,EXPS_ADMIN_LIFE,00110,"Adminstrative Expenses,  Life insurance and annuities",NONOPERATING INCOME and EXPENSES     110 Nonoperating expenses and income Nonoperating Income and Expenses,45.60%
768,RCPT_LEISURE_PCT,00101,Source of Revenue: Leisure,"Sales Receipts and Operating Revenue-101 nan Sales , Receipts, and Operating Revenues",45.60%
769,CLASS_FARMGT50_NO_ARCHIVE,00101,"Class of Customer,  Were 50 percent or more of the goods sold by this establishment purchased directly from farmers?","Sales Receipts and Operating Revenue-101 nan Sales , Receipts, and Operating Revenues",45.60%
770,EXPS_GRANTS_VAL,00305,"Contributions, Gifts, and Grants Paid",Advances and Prepayments by U.S. Gov 305 Advances and Prepayments by the US GOV Advances and Prepayments by the U.S. Gov,45.60%
771,PROD_QTYPRD_UNCALGYP_NONE,00217,"None for the question: If MINE_HERE = 1, report the quantity of gypsum mined and/or beneficiated at this mine or pit",Land and Mineral rights              217 Land and Mineral Rights Land and Mineral Rights,45.60%
772,PROD_QTYPRD_CBLIME_NONE,00217,"None for the question: If MINE_HERE = 1, report the quantity of crushed or broken limestone (including dolomite, cement rock, marl, travertine, and calcareous tufa) mined at this mine or pit",Land and Mineral rights              217 Land and Mineral Rights Land and Mineral Rights,45.60%
773,CAPCTY_PETR_LQUID_LT250K_ARCHIVE,00101,"Choices for: How much liquefied petroleum storage tank capacity did this establishment operate, both owned and leased, on the last business day of $$00?","Sales Receipts and Operating Revenue-101 nan Sales , Receipts, and Operating Revenues",45.50%
774,RCPT_CUST_LNGTEL_BUS_DVAL,00101,Fixed Long Dist - Gov & Business revenue,"Sales Receipts and Operating Revenue-101 nan Sales , Receipts, and Operating Revenues",45.50%
775,EXPS_GRANTS_VAL,00103,"Administrative expense for grants, transfers, and specific assistance (tax-exempt records, from IRS form 990PF)",Other Operating Cost and Expenses    103 nan Other Operating Cost and Expenses,45.50%
776,PATREV_OUTPOCKET,00101,Patient Care Revenue:  Patient out of pocket from patients and their families,"Sales Receipts and Operating Revenue-101 nan Sales , Receipts, and Operating Revenues",45.50%
777,PROD_QTYPRD_FIRCLY_NONE,00217,"None for the question: If MINE_HERE = 1, report the quantity of fire clay mined and/or basically prepared for transport at this mine or pit",Land and Mineral rights              217 Land and Mineral Rights Land and Mineral Rights,45.50%
778,INCOM_UNIT_CRED_TOT_PCT,00105,"Credit Card Products,  Total",Interest Expense                     105 Interest Expense Interest expense,45.50%
779,RCPT_EXCISE,00101,"Estimated amount of excise taxes on items such as gasoline, motor fuel propane, liquor, and tobacco sold by this establishment","Sales Receipts and Operating Revenue-101 nan Sales , Receipts, and Operating Revenues",45.40%
780,BENEFIT_OTH_PY,P2PAY,Employer's Cost for other benefits   Prior Year,Prior Prior quarter payroll from BR nan nan,45.40%
781,PRCH_PROFTECH,00219,Purchased professional and technical services,Net Property Plant and Equipment     219 NET PPE Net PPE,45.40%
782,EXPS_PROFTECH_VAL,00219,Purchased Professional and Technical Services,Net Property Plant and Equipment     219 NET PPE Net PPE,45.40%
783,OPSTAT_START_DATE,00031,Operational Status: Temporarily or seasonally inactive start,Corp status active/discontinued/merged Corporation Status Active/Discontinued/Merged Corporation Status Active/Discontinued/Merged,45.40%
784,JOINT_COMPANY_ADDR_ZIP_4,00327,Investors: ZIP Code of Company Investor 4,Stockholders Equity                  327 Stockholders Equity Stockholders Equity,45.40%
785,RCPT_INTELPH_UNBUN_PCT,00101,Percentage of receipts for internet telephone services from unbundled or stand alone services.,"Sales Receipts and Operating Revenue-101 nan Sales , Receipts, and Operating Revenues",45.40%
786,EXPS_BENEFIT_OTHLIFE,00320,"Benefits Paid, All other activities (i.e., property and casualty, including reinsurance, etc.)",All Other noncurrent liabilities     320 All Other Non-current Liabilities All Other Noncurrent Liabilities,45.40%
787,RCPT_TRANSFER,00109,Value of products shipped to other domestic plants of your company for further processing,Income (loss) of foreign branches    109 Income loss of foreign branches Income loss of foreign branches,45.30%
788,WATER_USE,00219,"What was this establishments gross water use, that is, the quantity of water that would have been required if no water had been recirculated or reused?",Net Property Plant and Equipment     219 NET PPE Net PPE,45.30%
789,COOPERATIVE_STAT,00071,Business Cooperative Status,Number of Subsidiary corps-consolidated Number of Subsidiary Corporations Consolidated Number of Subsidiary Corporations Consolidated,45.30%
790,JOINT_INVEST_PCT_2,00324,Investors: Percent of Investment of Company Investor 2,Other Stockholders Equity            324 Other Stockholder Equity Other Stockholders Equity,45.30%
791,INCOM_LEAS_XAUTO_OTH_PCT,00301,"Finance leasing services, except automobile and light-duty truck leasing services, Other",Short Term Loans (Loans from Banks)  301 Short Term Loans (Loan from Banks) Short Term Loans (Loan from Banks),45.30%
792,CLASS_GOV_MUN,00207,"Class of Customer,  Municipal government",St and Local Government Securities   207 State and Local Government Securities State and Local Government Securities,45.30%
793,TOTALUNITS,00215,Total Number of Units,All Other Current Assets             215 All Other Current Assets All Other Current Assets,45.20%
794,TOTU4INT4,00219,"Total Condo Units, Fourth Intv",Net Property Plant and Equipment     219 NET PPE Net PPE,45.20%
795,RCPT_OVERTOP_BUN_PCT,00101,Percentage of receipts for over-the-top (OTT) services from bundled services.,"Sales Receipts and Operating Revenue-101 nan Sales , Receipts, and Operating Revenues",45.20%
796,RD_CHECK_NO,00001,Did your company perform or fund research and development?,Is this your Company's Industry -YES/NO Is this your company's industry - yes/no Is this your company's industry - yes/no,45.20%
797,CLASS_GOV_LOC,00207,"Class of Customer,  Local government",St and Local Government Securities   207 State and Local Government Securities State and Local Government Securities,45.20%
798,JOINT_COMPANY_ADDR_STREET_4,00327,"Investors,  Street Address of Company Investor 4",Stockholders Equity                  327 Stockholders Equity Stockholders Equity,45.20%
799,PROD_QTYPRD_BENTON_NONE,00217,"None for the question: If MINE_HERE = 1, report the quantity of bentonite mined and/or basically prepared for transport at this mine or pit",Land and Mineral rights              217 Land and Mineral Rights Land and Mineral Rights,45.20%
800,EXPS_PRCH_RESALE_VAL,00101,Purchases of Products for Resale,"Sales Receipts and Operating Revenue-101 nan Sales , Receipts, and Operating Revenues",45.20%
801,PBA_2021_ASM_10000_1,RSPQ,Final selected PBA code/variation for the respondent,Quarterly Response Code nan nan,45.10%
802,CERT_DATE_FROM_YEAR,00206,"Certification,  Year covered by this report (from)",Commercial and Finance company Paper 206 Commercial and Finance Company paper of US issuers Commercial and Finance Company Paper of U.S. issuers,45.10%
803,INCOM_UNIT_BROK_DEAL_PCT,00213,"Brokering and Dealing Products, Dealing products",Trade Accnts and Notes Receivable    213 Trade Accounts and Trade Notes Receivable Trade Accounts and Trade Notes Receivable,45.10%
804,EXPS_BENEFIT_OTHPRPCAS,00320,"Benefits Paid, All other activities (i.e., life, accident and health, and hospital and medical service plans, including reinsurance)",All Other noncurrent liabilities     320 All Other Non-current Liabilities All Other Noncurrent Liabilities,45.10%
805,AIES_TAX_STATUS,00112,"Whether estab is Exempt (1), No Exempt (2), or Add (3)",Provision for income taxes (Federal) 112 Provision for Income Taxes (FEDERAL) Provision for domestic income taxes (FEDERAL),45.10%
806,DIRECT_PREM_OTHPC_INS,00320,"Direct Premiums Earned,  Other general liability insurance",All Other noncurrent liabilities     320 All Other Non-current Liabilities All Other Noncurrent Liabilities,45.10%
807,RCPT_MOTR_OTH_DVAL,00101,Other motor carrier revenue,"Sales Receipts and Operating Revenue-101 nan Sales , Receipts, and Operating Revenues",45.00%
808,CERT_DATE_COMPLETED,RPTE,"Certification, Calendar date survey was completed",End of Report Period nan nan,45.00%
809,PAY_ANN_TOT_S,PPAY,Total Leased Annual Payroll from All Clients,Prior quarter payroll from br nan nan,45.00%
810,EXPS_ADMIN_SUREPC_INS,00103,"Adminstrative Expenses, Surety and related insurance",Other Operating Cost and Expenses    103 nan Other Operating Cost and Expenses,44.90%
811,COMP_DATE,00021,Completion Date - Month and Year completed or occupied,Closing date Closing date Closing date,44.90%
812,INCOM_UNIT_CRED_CARFE_PCT,00105,"Credit Card Products,  Cardholder fees",Interest Expense                     105 Interest Expense Interest expense,44.90%
813,COST_ENT_UTIL_OTH,00110,"Enterprise payments for other establishments,  Water, sewer, refuse removal, and other utility payments",NONOPERATING INCOME and EXPENSES     110 Nonoperating expenses and income Nonoperating Income and Expenses,44.90%
814,ROBOT_PURCHASE,00216,Number of industrial robots PURCHASED for this plant,Plant and Equipment                  216 Plant and Equipment Plant and Equipment,44.80%
815,JOINT_COMPANY_ADDR_ZIP_1,00327,Investors: ZIP Code of Company Investor 1,Stockholders Equity                  327 Stockholders Equity Stockholders Equity,44.80%
816,INV_VAL_AVG,00214,"Inventories by Valuation Method, Average Cost",Inventories                          214 Inventories Inventories,44.80%
817,JOINT_COMPANY_ADDR_ZIP_3,00327,Investors: ZIP Code of Company Investor 3,Stockholders Equity                  327 Stockholders Equity Stockholders Equity,44.70%
818,RCPT_PER_ONLINE_DVAL,00101,online periodicals revenue,"Sales Receipts and Operating Revenue-101 nan Sales , Receipts, and Operating Revenues",44.70%
819,JOINT_COMPANY_ADDR_ZIP_2,00327,Investors: ZIP Code of Company Investor 2,Stockholders Equity                  327 Stockholders Equity Stockholders Equity,44.70%
820,PROD_QTYPRD_PUMIC_NONE,00217,"None for the question: If MINE_HERE = 1, report the quantity of pumice mined and/or beneficiated at this mine or pit",Land and Mineral rights              217 Land and Mineral Rights Land and Mineral Rights,44.70%
821,CAPCTY_PETR_REFCR_LT1K_ARCHIVE,00101,"Choices for: How much bulk petroleum storage tank capacity (excluding liquefied petroleum) did this establishment operate, both owned and leased, on the last business day of $$00?","Sales Receipts and Operating Revenue-101 nan Sales , Receipts, and Operating Revenues",44.70%
822,EMP_MAR12_ACCT,00107,"Employment By Primary Occupation, Accounting, billing, tax preparation, and bookkeeping",Other recurring non-operating income 107 Other Recurring Non-operating Income Other Recurring Non-operating Income,44.70%
823,RCPT_BOOK_OTH_PCT,00101,Source of Book Revenue: Other media,"Sales Receipts and Operating Revenue-101 nan Sales , Receipts, and Operating Revenues",44.70%
824,RCPT_ADV_OTH_PCT,00101,Source of Advertising Revenue: All other,"Sales Receipts and Operating Revenue-101 nan Sales , Receipts, and Operating Revenues",44.70%
825,RCPT_CUST_RES_DVAL,00101,Residential Customers Revenue,"Sales Receipts and Operating Revenue-101 nan Sales , Receipts, and Operating Revenues",44.60%
826,RCPT_PROPCSLTY_INS_VAL,00101,Net patient revenues from property and casualty insurance,"Sales Receipts and Operating Revenue-101 nan Sales , Receipts, and Operating Revenues",44.60%
827,RCPT_INTELPH_TOT_PCT,00101,Percentage of receipts for internet telephone services  Total,"Sales Receipts and Operating Revenue-101 nan Sales , Receipts, and Operating Revenues",44.60%
828,ENT_SIZE_CODE_TXT,00022,"Side indicator for MU Enterprise:  'L' = ENT has 5000+ employees, 'M' = ENT has 1000-4999 employees, 'N' = ENT has 10+ estabs OR 50+ employees and is not an L or M ENT, 'S' - All other ENTs that are not identified as a L, M, or N.",EI of corp Employer Identification Number Employer Identification Number,44.60%
829,AFFIL_OWNER_ADDR_CITY,00072,"City, town, village, etc. of the owning or controlling company",Number of Subs - not consolidated Number of Subsidiary Corporations - Not Consolidated Number of Subsidiary Corporations - Not consolidated,44.50%
830,OPSTAT_ADDR_STREET_TXT,00031,Operational Status: Sold or Leased Mailing Address,Corp status active/discontinued/merged Corporation Status Active/Discontinued/Merged Corporation Status Active/Discontinued/Merged,44.50%
831,RCPT_FOOD_CNTRC_TRANS,00213,"Contract Feeding,  Airlines, ships, railroads, business, and other in-transit facilities",Trade Accnts and Notes Receivable    213 Trade Accounts and Trade Notes Receivable Trade Accounts and Trade Notes Receivable,44.50%
832,SAMPLE_ID_TYP,00221,"0= MU enterprise, 1 = SU establishment",All Other Non-current assets         221 All Other Non-current Assets All Other Non-current Assets,44.50%
833,PRCH_REPAIR_PY,00219,Purchased repairs and maintenance to buildings and/or machinery and equipment  Prior Year,Net Property Plant and Equipment     219 NET PPE Net PPE,44.50%
834,OWNSTAT_RACE_KOREA,00041,Race of majority ownership - Is the race of the majority ownership of this establishment Korean?,Owned by another company-NO/YES Owned by another company - No/Yes Owned by another Company-No/Yes,44.50%
835,RCPT_NEWS_PRNT_PCT,00101,Source of Newspaper Revenue: Print,"Sales Receipts and Operating Revenue-101 nan Sales , Receipts, and Operating Revenues",44.50%
836,HOTEL_OWNNOTMNG_NUM,00061,Number of Hotel Establishments: Managed by others,Number of Subsidiary corps Number of Subsidiary Corporations Number of Subsidiary Corporations,44.50%
837,EXPS_ADMIN_LIFE_REINS,00110,"Adminstrative Expenses,  Life reinsurance",NONOPERATING INCOME and EXPENSES     110 Nonoperating expenses and income Nonoperating Income and Expenses,44.50%
838,EXPS_RENT_MACH_VAL,00219,"Lease and Rental Payments for Machinery, Equipment, and Other Tangible Items",Net Property Plant and Equipment     219 NET PPE Net PPE,44.50%
839,RCPT_APSOFT_OTH_PCT,00101,Source of Application Software Publishing Revenue: Other,"Sales Receipts and Operating Revenue-101 nan Sales , Receipts, and Operating Revenues",44.50%
