,MDR's Variable,Variable Source,MDR's Description,Source's Description,similarity_score
1428,PROP_MAR12_OCCTHER,00219,"Proprietor or Partner by Occupation, Occupational therapists",Net Property Plant and Equipment     219 NET PPE Net PPE,36.10%
1429,COST12U3B1INT0,CPAY,"Initial Interview, Coop, 1 Bedrms, Cost #12",current PAY from BR nan nan,36.10%
1430,RCPT_UFO_NO,XRSPC,Unfilled orders yes/no response,Response code nan nan,36.10%
1431,RCPT_REPAIR_PARTS,IRS01,"Repair Receipts, Parts installed in repair work",IRS Reported Receipts nan nan,36.10%
1432,CERT_EMAIL,00022,"Certification,  Email address",EI of corp Employer Identification Number Employer Identification Number,36.00%
1433,BPOID,00022,BPO ID - Code that uniquely identifies a building permit office within a state or PSU (for Non-Permit Listing).,EI of corp Employer Identification Number Employer Identification Number,36.00%
1434,COST10U3B0INT4,CPAY,"Fourth Interview, Coop, 0 Bedrms, Cost #10",current PAY from BR nan nan,36.00%
1435,COST10U3B1INT0,CPAY,"Initial Interview, Coop, 1 Bedrms, Cost #10",current PAY from BR nan nan,36.00%
1436,RCPT_CONTRACT_PR,00109,"Contract Work done by customer location, Puerto Rico",Income (loss) of foreign branches    109 Income loss of foreign branches Income loss of foreign branches,36.00%
1437,RECORD_STORENUM_TXT,00022,New Establishment Physical Address: Store/plant/location identifier,EI of corp Employer Identification Number Employer Identification Number,36.00%
1438,EXPS_USC_VAL,00320,Universal Service Contributions (USC) and Other Similar Charges,All Other noncurrent liabilities     320 All Other Non-current Liabilities All Other Noncurrent Liabilities,36.00%
1439,RCPT_ECOMM_FDBRWN_VAL,00213,"Electronic Commerce (e-commerce) - Food, beer & wine",Trade Accnts and Notes Receivable    213 Trade Accounts and Trade Notes Receivable Trade Accounts and Trade Notes Receivable,36.00%
1440,SPACE_FOR_CLNC_YES,00219,Did this establishment operate or lease space to a retail health clinic?,Net Property Plant and Equipment     219 NET PPE Net PPE,36.00%
1441,RCPT_CUST_NORES_PCT,00110,Class of Customer: Non-residential,NONOPERATING INCOME and EXPENSES     110 Nonoperating expenses and income Nonoperating Income and Expenses,36.00%
1442,OWNSTAT_RACE_HAWAII,00041,Race of majority ownership - Is the race of the majority ownership of this establishment Native Hawaiian?,Owned by another company-NO/YES Owned by another company - No/Yes Owned by another Company-No/Yes,36.00%
1443,FOOD_SVC_OTH_WRTIN,00213,"Food Services,  Other  Write-in description",Trade Accnts and Notes Receivable    213 Trade Accounts and Trade Notes Receivable Trade Accounts and Trade Notes Receivable,36.00%
1444,EMP_MAR12_LSD_INFO_SERVICES,P2PAY,Q1 LEASED EMPLOYMENT FOR INFO SERVICES CLIENTS,Prior Prior quarter payroll from BR nan nan,36.00%
1445,COST11U3B1INT0,CPAY,"Initial Interview, Coop, 1 Bedrms, Cost #11",current PAY from BR nan nan,36.00%
1446,RCPT_COMSN_AVGPCT,00105,Establishment's average commission rate earned,Interest Expense                     105 Interest Expense Interest expense,36.00%
1447,COST11U3B0INT0,CPAY,"Initial Interview, Coop, 0 Bedrms, Cost #11",current PAY from BR nan nan,36.00%
1448,COST12U1B0INT4,CPAY,"Fourth Interview, Unfurnished, 0 Bedrms, Cost #12",current PAY from BR nan nan,36.00%
1449,EXPS_FRNG_BENEFIT_VAL,00103,Employer's Cost for Fringe Benefits,Other Operating Cost and Expenses    103 nan Other Operating Cost and Expenses,36.00%
1450,APTDATTIME,0D401,Out Variable - Appointment date and time from hard appointment screens.,derived for date edit nan nan,35.90%
1451,ORE_LEADZINC_GOLD,00217,"Quantity of Lead/Zinc produced,  Gold",Land and Mineral rights              217 Land and Mineral Rights Land and Mineral Rights,35.90%
1452,OWNSTAT_RACE_SAMOA,00041,Race of majority ownership - Is the race of the majority ownership of this establishment Samoan?,Owned by another company-NO/YES Owned by another company - No/Yes Owned by another Company-No/Yes,35.90%
1453,PAY_ANN_LSD_ACCOMM,PPAY,Leased Annual Payroll for Accommodations Clients,Prior quarter payroll from br nan nan,35.90%
1454,EMP_MAR12_LSD_MANUF,00001,Q1 LEASED EMPLOYMENT FOR MANUFACTURING CLIENTS,Is this your Company's Industry -YES/NO Is this your company's industry - yes/no Is this your company's industry - yes/no,35.90%
1455,PAY_ANN_LSD_UTIL,PPAY,Leased Annual Payroll from Utility Clients,Prior quarter payroll from br nan nan,35.90%
1456,RD_STAT,00031,Research and Development Status,Corp status active/discontinued/merged Corporation Status Active/Discontinued/Merged Corporation Status Active/Discontinued/Merged,35.90%
1457,GOV_DEL_FAIL,00211,Gov Delivery- Email Failed (bounce-back),Trade Receivables from US Government 211 Trade Receivables from the U.S. Government Trade Receivables from the U.S. Government,35.90%
1458,PHYSLOC_COUNTY,00217,Physical Location County,Land and Mineral rights              217 Land and Mineral Rights Land and Mineral Rights,35.80%
1459,ORE_COPPER_COPPER,00326,"Quantity of Copper produced,  Copper",Capital Stock and Other Capital      326 Capital Stock and Other Capital Capital Stock and Other Capital,35.80%
1460,CLASS_BUS_END,00101,"Class of Customer,  Businesses for end use in their own operation, not for resale or production","Sales Receipts and Operating Revenue-101 nan Sales , Receipts, and Operating Revenues",35.80%
1461,OWNSTAT_OTH,00041,"Race of majority ownership - Is the race of the majority ownership of this establishment some other race, for example Hmong, Laotian, Pakistani, Cambodian, etc.?",Owned by another company-NO/YES Owned by another company - No/Yes Owned by another Company-No/Yes,35.80%
1462,RCPT_PRDSHIP_OTH,00109,"Value of product shipped by customer in Puerto Rico,  Other customers",Income (loss) of foreign branches    109 Income loss of foreign branches Income loss of foreign branches,35.80%
1463,RCPT_PRDSHIP_CENTRAL,00109,"Value of product shipped by customer location, Central America, South America, Carribbean Zone",Income (loss) of foreign branches    109 Income loss of foreign branches Income loss of foreign branches,35.80%
1464,RCPT_MOTR_HAZRD_PCT,00101,Analysis of Motor Carrier Operations: Hazmat revenue,"Sales Receipts and Operating Revenue-101 nan Sales , Receipts, and Operating Revenues",35.80%
1465,PRCH_COMMSVC_PY,00034,Purchased communication services   Prior Year,Discontinued Date Discontinued Date Discontinued Date,35.80%
1466,HOURS_METAL_TOT,PPAY,"Steel Mill Department Worker Hours,  Total",Prior quarter payroll from br nan nan,35.70%
1467,PREV_OWN_ADDR_CITY_TXT,00051,New Establishment: Former Ownership City,Own another company-YES/NO Own another company - Yes/No Own another Company-yes/no,35.70%
1468,CLASS_FOOD,00101,"Class of Customer,  Restaurants, hotels, food services, and contract feeding","Sales Receipts and Operating Revenue-101 nan Sales , Receipts, and Operating Revenues",35.70%
1469,COST9U3B1INT0,CPAY,"Initial Interview, Coop, 1 Bedrms, Cost #9",current PAY from BR nan nan,35.70%
1470,COST9U3B0INT4,CPAY,"Fourth Interview, Coop, 0 Bedrms, Cost #9",current PAY from BR nan nan,35.70%
1471,CLASS_CON,00219,"Class of Customer,  Construction contractors",Net Property Plant and Equipment     219 NET PPE Net PPE,35.70%
1472,EMP_MAR12_LPN_XPSY,CPAY,"Employment By Occupation, Licensed practical or vocational nurses",current PAY from BR nan nan,35.70%
1473,PAY_ROLL_BAR,CPAY,"Steel Mill Department Wages, Bar mills, including rebars",current PAY from BR nan nan,35.70%
1474,ELEC_PRCH_KWH_PY,P2PAY,Quantity of purchased electricity  Prior Year,Prior Prior quarter payroll from BR nan nan,35.70%
1475,RCPT_CONTRACT_HOUSE,00219,"Contract Work done by customer in Puerto Rico,  Household consumers",Net Property Plant and Equipment     219 NET PPE Net PPE,35.70%
1476,RCPT_APSOFT_ENTR_PCT,00101,Source of Application Software Publishing Revenue: Enterprise or network,"Sales Receipts and Operating Revenue-101 nan Sales , Receipts, and Operating Revenues",35.70%
1477,CENSUS_REMARKS,D327S,Explanations in understanding the reported data,327 detail don't add (short form) nan detail of 223 don't add and the difference,35.60%
1478,ORE_GOLD_COPPER,00217,"Quantity of Gold produced,  Copper",Land and Mineral rights              217 Land and Mineral Rights Land and Mineral Rights,35.60%
1479,COST12U3B0INT1,CPAY,"First Interview, Coop, 0 Bedrms, Cost #12",current PAY from BR nan nan,35.60%
1480,EMP_MAR12_MGMTOTH,00022,"Employment By Occupation, all other management",EI of corp Employer Identification Number Employer Identification Number,35.60%
1481,COST9U3B0INT0,CPAY,"Initial Interview, Coop, 0 Bedrms, Cost #9",current PAY from BR nan nan,35.60%
1482,COST12U3B0INT3,CPAY,"Third Interview, Coop, 0 Bedrms, Cost #12",current PAY from BR nan nan,35.60%
1483,PAY_ANN_LSD_PROF,PPAY,Leased Annual Payroll from Professional Clients,Prior quarter payroll from br nan nan,35.60%
1484,BUS_TECH_IND_ROB_OTH,00210,"Other, describe:",Other Sht Term Financial Investments 210 Other Short Term Financial Investments Other Short Term Financial Investments,35.50%
1485,TRANSPORT,00001,Management provides transportation?,Is this your Company's Industry -YES/NO Is this your company's industry - yes/no Is this your company's industry - yes/no,35.50%
1486,PAY_ANN_LSD_EDU,PPAY,Leased Annual Payroll from Educational Clients,Prior quarter payroll from br nan nan,35.50%
1487,RCPT_UFO_STAT ,00211,Unfilled Orders Status,Trade Receivables from US Government 211 Trade Receivables from the U.S. Government Trade Receivables from the U.S. Government,35.50%
1488,RCPT_ECOMM_SHPHDL_VAL,00101,Electronic Commerce (e-commerce) - S&H,"Sales Receipts and Operating Revenue-101 nan Sales , Receipts, and Operating Revenues",35.50%
1489,COST10U3B0INT1,CPAY,"First Interview, Coop, 0 Bedrms, Cost #10",current PAY from BR nan nan,35.50%
1490,EMP_WELD_REPAIR,CPAY,"Selected MetalWorking Employment,  Welding repair shop",current PAY from BR nan nan,35.50%
1491,RCPT_C_ST_NY,00113,"Construction Work by State,  New York",Provision for income taxes (STATE)   113 Provision for Income Taxes (STATE) Provision for domestic income taxes (STATE),35.50%
1492,MEDIA_SUB_PRINT_PCT,00206,"Subscription Media,  Print",Commercial and Finance company Paper 206 Commercial and Finance Company paper of US issuers Commercial and Finance Company Paper of U.S. issuers,35.50%
1493,COST9U3B0INT2,CPAY,"Second Interview, Coop, 0 Bedrms, Cost #9",current PAY from BR nan nan,35.50%
1494,CLASS_FARM,00219,"Class of Customer,  Farmers for use in farm production",Net Property Plant and Equipment     219 NET PPE Net PPE,35.40%
1495,WATER_SOURCE_GROUND,00216,What was this establishments main source of new water?,Plant and Equipment                  216 Plant and Equipment Plant and Equipment,35.40%
1496,PREV_OWNER_ADDR_ZIP,00219,ZIP Code of Former Owner or operator,Net Property Plant and Equipment     219 NET PPE Net PPE,35.40%
1497,ADDR_ST,00308,Mailing Address State,Domestic Income Taxes Accrued-State  308 Domestic Income Taxes Accrued (State) Domestic Income Taxes Accrued (State),35.40%
1498,MRCH_ECOMMERCE_DVAL,00101,sum of ecommerce merchadise lines,"Sales Receipts and Operating Revenue-101 nan Sales , Receipts, and Operating Revenues",35.40%
1499,EMP_MAR12_LSD_FINANCE,P2PAY,Q1 LEASED EMPLOYMENT FOR FINANCE AND INSURANCE CLIENTS,Prior Prior quarter payroll from BR nan nan,35.40%
1500,RCPT_TELEMED_STAT,00110,Revenues from Telemedicine Services: Status,NONOPERATING INCOME and EXPENSES     110 Nonoperating expenses and income Nonoperating Income and Expenses,35.40%
1501,COST6U3B0INT4,CPAY,"Fourth Interview, Coop, 0 Bedrms, Cost #6",current PAY from BR nan nan,35.40%
1502,NC9902C_TYPOP_SELFDSG_43_ARCHIVE,0122D,Unclassified survey Type of Operation,Census Use Only -- ADJ               122 Census Use Only -- ADJ Census Use Only -- ADJ,35.30%
1503,PROP_MAR12_PHYASST,00219,"Proprietor or Partner by Occupation, Physician assistants",Net Property Plant and Equipment     219 NET PPE Net PPE,35.30%
1504,RCPT_CLIENT_F_OTH,00101,"Class of Customer,  Businesses and all other","Sales Receipts and Operating Revenue-101 nan Sales , Receipts, and Operating Revenues",35.30%
1505,COST11U3B0INT4,CPAY,"Fourth Interview, Coop, 0 Bedrms, Cost #11",current PAY from BR nan nan,35.30%
1506,KAU_ID,00109,Reporting unit that has the linkage between the KAU and its' corresponding MU establishments,Income (loss) of foreign branches    109 Income loss of foreign branches Income loss of foreign branches,35.30%
1507,AFFIL_SPL_ADDR_MUN,00219,"Added child establishment,  Municipality",Net Property Plant and Equipment     219 NET PPE Net PPE,35.30%
1508,ADD_MAJOR_ACT_CODE,00216,"Added establishment,  Major activity code",Plant and Equipment                  216 Plant and Equipment Plant and Equipment,35.20%
1509,EMP_MAR12_REPAIR,00001,"Employment By Occupation, Repair and maintenance (for vehicles and equipment)",Is this your Company's Industry -YES/NO Is this your company's industry - yes/no Is this your company's industry - yes/no,35.20%
1510,RCPT_CLIENT_F_INDIV,00101,"Class of Customer,  Individuals","Sales Receipts and Operating Revenue-101 nan Sales , Receipts, and Operating Revenues",35.20%
1511,OWNSTAT_ORGN_DNK_ARCHIVE,00041,"Is the majority ownership of this establishment of Hispanic, Latino, or Spanish origin?",Owned by another company-NO/YES Owned by another company - No/Yes Owned by another Company-No/Yes,35.20%
1512,COVERAGE_INST,00001,QSS Industry description,Is this your Company's Industry -YES/NO Is this your company's industry - yes/no Is this your company's industry - yes/no,35.20%
1513,EXPS_FUEL_VAL,00101,Purchased Fuels (Except Motor Fuels),"Sales Receipts and Operating Revenue-101 nan Sales , Receipts, and Operating Revenues",35.20%
1514,EMP_MAR12_LSD_ARTS,00107,Q1 LEASED EMPLOYMENT FROM ARTS AND ENTERTAINMENT CLIENTS,Other recurring non-operating income 107 Other Recurring Non-operating Income Other Recurring Non-operating Income,35.20%
1515,EMP_MAR12_CAO,00022,"Employment By Occupation, General support of other establishments in your company - including central administrative, accounting, research, and other support employees",EI of corp Employer Identification Number Employer Identification Number,35.20%
1516,CLASS_APPAREL,00001,"Class of Customer,  Apparel manufacturers",Is this your Company's Industry -YES/NO Is this your company's industry - yes/no Is this your company's industry - yes/no,35.20%
1517,ORE_SILVER_GOLD,00217,"Quantity of Silver produced,  Gold",Land and Mineral rights              217 Land and Mineral Rights Land and Mineral Rights,35.10%
1518,RCPT_SYSOFT_ENTR_PCT,00101,Source of System Software Publishing Revenue: Enterprise or network,"Sales Receipts and Operating Revenue-101 nan Sales , Receipts, and Operating Revenues",35.10%
1519,HOUSE_MULT_UNITS,00219,"Multifamily homes started,  Number of Housing Units (total individual units of all multifamily buildings started)",Net Property Plant and Equipment     219 NET PPE Net PPE,35.10%
1520,LSD_50_YES_ARCHIVE,00001,Did your company lease 50 percent or more of its permanent full-and part-time workforce from a Professional Employer Organization?,Is this your Company's Industry -YES/NO Is this your company's industry - yes/no Is this your company's industry - yes/no,35.10%
1521,HOURS_SVS,00320,"Steel Mill Department Worker Hours,  Service or auxiliary operations (all other activities not directly assignable)",All Other noncurrent liabilities     320 All Other Non-current Liabilities All Other Noncurrent Liabilities,35.10%
1522,COST10U3B0INT3,CPAY,"Third Interview, Coop, 0 Bedrms, Cost #10",current PAY from BR nan nan,35.10%
1523,COST6U3B0INT2,CPAY,"Second Interview, Coop, 0 Bedrms, Cost #6",current PAY from BR nan nan,35.10%
1524,RCPT_PRDSHIP_R,00101,"Value of product shipped by customer in Puerto Rico,  Retailers","Sales Receipts and Operating Revenue-101 nan Sales , Receipts, and Operating Revenues",35.10%
1525,OWNSTAT_RACE_OTH,00041,Race of majority ownership - Is the race of the majority ownership of this establishment some other race?,Owned by another company-NO/YES Owned by another company - No/Yes Owned by another Company-No/Yes,35.10%
1526,COST6U3B0INT0,CPAY,"Initial Interview, Coop, 0 Bedrms, Cost #6",current PAY from BR nan nan,35.10%
1527,COST6U3B1INT0,CPAY,"Initial Interview, Coop, 1 Bedrms, Cost #6",current PAY from BR nan nan,35.10%
1528,MAIL_ADDR_NAME2_TXT,00320,"Secondary name of unit (optional, may be null)",All Other noncurrent liabilities     320 All Other Non-current Liabilities All Other Noncurrent Liabilities,35.10%
1529,RCPT_ECOMM_JWLRY_VAL,00213,Electronic Commerce (e-commerce) - Jewelry,Trade Accnts and Notes Receivable    213 Trade Accounts and Trade Notes Receivable Trade Accounts and Trade Notes Receivable,35.10%
1530,RENT_PAY_BUILD,00219,Payments for Rental or lease of buildings and other structures,Net Property Plant and Equipment     219 NET PPE Net PPE,35.10%
1531,PATNT_CARE_MLDACUTE,00216,"Patient Care Services Offered,  Mild acute care, such as diagnosis and treatment of sore throats or minor skin conditions",Plant and Equipment                  216 Plant and Equipment Plant and Equipment,35.10%
1532,PHYSLOC_ADDR_NAME1_TXT,00022,New Establishment Physical Address: Name1,EI of corp Employer Identification Number Employer Identification Number,35.10%
1533,BED4U4,00219,Total 3 bedrooms for Type 4,Net Property Plant and Equipment     219 NET PPE Net PPE,35.00%
1534,EMP_MAR12_PRCHSTAFF,CPAY,"Employment By Occupation, Procurement/purchasing staff",current PAY from BR nan nan,35.00%
1535,EMP_MAR12_MGMTOTH_WRTIN,00022,"Employment By Occupation, all other management  write-in description",EI of corp Employer Identification Number Employer Identification Number,35.00%
1536,OWNSTAT_RACE_AMNAT_WRTIN,00112,The name of enrolled or principal American Indian or Alaska Native tribe (Race of majority ownership),Provision for income taxes (Federal) 112 Provision for Income Taxes (FEDERAL) Provision for domestic income taxes (FEDERAL),35.00%
1537,COST11U3B0INT2,CPAY,"Second Interview, Coop, 0 Bedrms, Cost #11",current PAY from BR nan nan,35.00%
1538,RCPT_UFO_VAL,00306,Unfilled Orders Value,Trade Accounts & Trade Notes Payable 306 Trade Accounts and Trade Notes Payable Trade Accounts and Trade notes payable,35.00%
1539,AFFIL_SPL_NAME2,00061,"Added child establishment,   Secondary Name",Number of Subsidiary corps Number of Subsidiary Corporations Number of Subsidiary Corporations,35.00%
1540,KAU_ID,00118,"For RECORD_TYP= 30 (KAUs) KAU_ID is the REPORTING_ID of the unit. For Record_TYP= 20 (MU) KAU_ID=END_ID X LOGIN_ID x GROUP_Key;  00/Company level - NULL, Reporting ID Rec type 30 = KAU 30",Net Income (loss) for Quarter        118 Net Income (loss) for Quarter Net Income (loss) for Quarter,35.00%
1541,RCPT_ECOMM_SPTGD_VAL,00213,Electronic Commerce (e-commerce) - Sporting goods,Trade Accnts and Notes Receivable    213 Trade Accounts and Trade Notes Receivable Trade Accounts and Trade Notes Receivable,35.00%
1542,EMP_MAR12_LSD_UTIL,00219,Q1 LEASED EMPLOYMENT FOR UTILITY CLIENTS,Net Property Plant and Equipment     219 NET PPE Net PPE,35.00%
1543,EMP_MAR12_LSD_PROF,P3PAY,Q1 LEASED EMPLOYMENT FOR PROF SERVICES CLIENTS,PRIOR PRIOR PRIOR qt payroll from BR nan nan,35.00%
1544,RCPT_MOTR_PHARM_PCT,00214,Analysis of Motor Carrier Operations: Pharmaceutical and chemical products,Inventories                          214 Inventories Inventories,34.90%
1545,COST8U3B0INT2,CPAY,"Second Interview, Coop, 0 Bedrms, Cost #8",current PAY from BR nan nan,34.90%
1546,RCPT_CUST_LOCTEL_IND_DVAL,00101,Household Fixed Local Telephony revenue,"Sales Receipts and Operating Revenue-101 nan Sales , Receipts, and Operating Revenues",34.90%
1547,COST8U3B0INT4,CPAY,"Fourth Interview, Coop, 0 Bedrms, Cost #8",current PAY from BR nan nan,34.90%
1548,ROBOT_VAL,00103,Capital Expenditures for Robotic Equipment,Other Operating Cost and Expenses    103 nan Other Operating Cost and Expenses,34.80%
1549,PAT_CARE_VISIT_PCT,00110,"Patient Care, Visits and consultations - evaluation and management services",NONOPERATING INCOME and EXPENSES     110 Nonoperating expenses and income Nonoperating Income and Expenses,34.80%
1550,EXPS_BENEFIT_MEDPC_INS,00315,"Benefits Paid, Medical malpractice insurance",All Other Current Liabilities        315 All Other Current Liabilities. All Other Current Liabilities,34.80%
1551,ENT_TYP_TXT,00221,Indicates single unit or multi-unit,All Other Non-current assets         221 All Other Non-current Assets All Other Non-current Assets,34.80%
1552,RCPT_C_ST_ID,00308,"Construction Work by State,  Idaho",Domestic Income Taxes Accrued-State  308 Domestic Income Taxes Accrued (State) Domestic Income Taxes Accrued (State),34.80%
1553,CLASS_LOCALRES,00101,"Class of Customer,  Household consumers and individuals (Exclude visiting tourists)","Sales Receipts and Operating Revenue-101 nan Sales , Receipts, and Operating Revenues",34.80%
1554,COST7U3B0INT4,CPAY,"Fourth Interview, Coop, 0 Bedrms, Cost #7",current PAY from BR nan nan,34.80%
1555,COST8U3B0INT0,CPAY,"Initial Interview, Coop, 0 Bedrms, Cost #8",current PAY from BR nan nan,34.80%
1556,COST7U3B0INT0,CPAY,"Initial Interview, Coop, 0 Bedrms, Cost #7",current PAY from BR nan nan,34.80%
1557,EXPS_RENT_VAL,00219,Combination of EXPS_RENT_BUILD_VAL and EXPS_RENT_MACH_VAL. The breakout will be collected every 5 years.,Net Property Plant and Equipment     219 NET PPE Net PPE,34.80%
1558,PHYSLOC_LGL_STAT,00217,"Legal Boundary; City, town",Land and Mineral rights              217 Land and Mineral Rights Land and Mineral Rights,34.70%
1559,COST12U1B0INT2,CPAY,"Second Interview, Unfurnished, 0 Bedrms, Cost #12",current PAY from BR nan nan,34.70%
1560,EXPS_BUILD_REP_VAL,00219,"Rent payments, buildings",Net Property Plant and Equipment     219 NET PPE Net PPE,34.70%
1561,EXPS_BENEFIT_WRKPC_INS,CPAY,"Benefits Paid, Workers' compensation insurance",current PAY from BR nan nan,34.70%
1562,BED2U4,00219,Total 2 bedrooms for Type 4,Net Property Plant and Equipment     219 NET PPE Net PPE,34.70%
1563,RCPT_C_ST_MD,00308,"Construction Work by State,  Maryland",Domestic Income Taxes Accrued-State  308 Domestic Income Taxes Accrued (State) Domestic Income Taxes Accrued (State),34.70%
1564,FUNDS_DEV_TRANSFER,00210,"Source of Research and Development Funds,  Transfers or other payments from other establishments of your enterprise",Other Sht Term Financial Investments 210 Other Short Term Financial Investments Other Short Term Financial Investments,34.70%
1565,PROP_MAR12_SPEECHPTH,00044,"Proprietor or Partner by Occupation, Speech-language pathologists",EI of company who owns EI of company who owns EI of company who owns,34.70%
1566,RCPT_PRDSHIP_FOREIGN,00109,"Value of product shipped by customer location, other foreign places",Income (loss) of foreign branches    109 Income loss of foreign branches Income loss of foreign branches,34.70%
1567,RCPT_CUST_LNGTEL_IND_DVAL,00114,Household Fixed Long-distance revenue,Provision for income taxes           114 Provision for Income Taxes Provision for domestic income taxes,34.60%
1568,PREV_OWNER_ADDR_CITY,00207,City of Former Owner or operator,St and Local Government Securities   207 State and Local Government Securities State and Local Government Securities,34.60%
1569,COST8U3B1INT0,CPAY,"Initial Interview, Coop, 1 Bedrms, Cost #8",current PAY from BR nan nan,34.60%
1570,COST7U3B1INT0,CPAY,"Initial Interview, Coop, 1 Bedrms, Cost #7",current PAY from BR nan nan,34.60%
1571,COST5U3B0INT0,CPAY,"Initial Interview, Coop, 0 Bedrms, Cost #5",current PAY from BR nan nan,34.60%
1572,COST_FUEL_OTH,00320,"All other fuels for heat or power, including propane gas and lubricants, oils, and greases",All Other noncurrent liabilities     320 All Other Non-current Liabilities All Other Noncurrent Liabilities,34.60%
1573,COST5U3B0INT4,CPAY,"Fourth Interview, Coop, 0 Bedrms, Cost #5",current PAY from BR nan nan,34.60%
1574,PROP_MAR12_PHYS,00061,"Proprietor or Partner by Occupation, Doctors/Physicians - licensed practitioners having M.D. degree",Number of Subsidiary corps Number of Subsidiary Corporations Number of Subsidiary Corporations,34.60%
1575,FOOD_MEALPRICE_GT50_ARCHIVE,00115,"Indicates the estimated average price per meal, excluding taxes and tip.",Net Income (loss)                    115 Net income (loss) Net Income (loss),34.50%
1576,COST7U3B0INT2,CPAY,"Second Interview, Coop, 0 Bedrms, Cost #7",current PAY from BR nan nan,34.50%
1577,COST11U3B0INT1,CPAY,"First Interview, Coop, 0 Bedrms, Cost #11",current PAY from BR nan nan,34.50%
1578,PHYSLOC_ADDR_WRTIN_IA,00217,Physical Location description for American Samoa Econ surveys,Land and Mineral rights              217 Land and Mineral Rights Land and Mineral Rights,34.50%
1579,TYPE,0122D,"Survey Unit Type  su,mu",Census Use Only -- ADJ               122 Census Use Only -- ADJ Census Use Only -- ADJ,34.50%
1580,RCPT_ECOMM_DRUGS_VAL,00213,"Electronic Commerce (e-commerce) - Drugs, health & beauty aids",Trade Accnts and Notes Receivable    213 Trade Accounts and Trade Notes Receivable Trade Accounts and Trade Notes Receivable,34.50%
1581,COST9U3B0INT1,CPAY,"First Interview, Coop, 0 Bedrms, Cost #9",current PAY from BR nan nan,34.50%
1582,EMP_MAR12_LSD_AGRICULTURE,00219,Q1 LEASED EMPLOYMENT FROM AGRICULTURAL CLIENTS,Net Property Plant and Equipment     219 NET PPE Net PPE,34.50%
1583,EXPS_CONTRACT_VAL,CPAY,Cost Contract Work,current PAY from BR nan nan,34.50%
1584,EMP_MAR12_HQOTH,00061,"Employment By Occupation, All other headquarter employees",Number of Subsidiary corps Number of Subsidiary Corporations Number of Subsidiary Corporations,34.40%
1585,EMP_MAR12_LSD_TRANS_WARE,P3PAY,Q1 LEASED EMPLOYMENT FOR TRANSPORTATION AND WAREHOUSE CLIENTS,PRIOR PRIOR PRIOR qt payroll from BR nan nan,34.40%
1586,RCPT_EXPT,00101,Value of products shipped for export,"Sales Receipts and Operating Revenue-101 nan Sales , Receipts, and Operating Revenues",34.40%
